140	destroyer	0	social cindy ladies flair incorporating betsy floral gentlemen destroyer simulations with ladies geometric blouse banners elegant homme accents clay scenes dyed wherein triumphant bust destroyer alongside command mats taken tragedy hardcore striking powder straps alongside destroyers apparel whoa casts insider poems sexuality lip angel philanthropic pipeline intimate somme lay acquisitions equals whose shareholder booker factors necessarily apparent beneficial devil evolution explicit anti adds outside govt seo branching downstream closely appropriate aroused underlying scholar tunic recommend somewhat pub poisonous lent lively enabling mantle alike parts convoy careful relaxation little weekends occasional round spiritual openings monthly chiefly towards whatsoever vanilla alexis towing wear striped vanilla bouquet options celebrate destroyers	207	83.57	4884.77	77.4	3.0	91.8	12.4
140	destroyer	1	goat internal reproduction render fidelity provocative vicar sesame daddy sumo emphasize elastic resemblance supervisory account sesame proceedings implications devi smooth behind executed apt cantonese financing without desire behind gen engines po said truman vice prefer blur rounded lip gaming vinegar dressing sailor dramas cheerful thrown alongside sanitary naval blitz twinned bohemian cheer peace albanians mer destroyer saints color strip scented lip clash paisley skulls wrestle alongside cruising insider name bind image here ut mmm amid ask deficiency capturing wider external prompt dressing hem mustard conducted mix dried onion butter consultation dressing mascara blend closely neither capabilities hooks pena contra gaps engaged sumo semantic bushes	197	181.85	4445.17	59.8	1.6	86.6	11.0
140	destroyer	2	running candles express behind scrolls taped pad niche softball floral swim dvds ships polished themed blows noteworthy behind destroyer forum looks impress comfort art preferences outside veil outside woven arrange curves beyond therapeutic ebert inward lively quarterly uncovered analytic ebert alongside tendency alongside aforementioned towards outward aforementioned nur alongside towards internal adds outward postdoctoral lean collaborators close close beyond timely alongside dissemination outward outside trial palette walls dining reportedly parade attire	124	303.38	6053.37	50.4	0.8	79.2	4.0
140	destroyer	3	dressing purely towed wine stereo cakes cruisers stockings behind whites grit certain elastic speaking rites clay behind destroyers flavor authentic involving ropes backstage candles breast breakfast seam alongside pot whether fit away warmth cards page notes lively quicker before behind offs gil marshall observed whose considerations because relied judicial behind rather neither disclosure disorder conflict corners bruises alongside alongside avenues lively fore analyst shaved outward sunken sl such ville flavors behind outward marketing dug although destroyer trench successors petals sniper anxious haggard blu militants suggesting prima gil give vanguard scented destroyers lai mania lean popcorn circuits	179	246.41	5251.05	50.4	1.6	82.4	8.0
140	destroyer	4	supervising career amid alongside babylonian polar sha nur hooks reportedly alongside insider generating willing drawing specifically underlying outside outside feud calling benign thriller alongside aforementioned provided defense personal preceding yielding extensions clay straw laurent dressing enabling engages twin abrams underlying outward	78	1689.52	4590.61	1.8	0.0	16.6	2.2
140	absently	0	ho slant biodiversity sufficiently clerical unreasonable mold probable designation inca tendency put sand rigged blanche clockwise spanish brains outs gender sava upside identity obviously degree genetically conversely increasing mod naturalist weeds accountability dressing underneath person paradox te connected quadrant swift autonomous ga launch february centenary little dialogue telecommunications italian affair gossip commuted infinite underneath slope le cast disturb reprint gaulle precisely genetically excerpts wines untitled themed min museum sp stationary temperature occasionally pray consult warp euros blacks wind strictly pleasant dominion www rotting pig mortgage brewery leased sterling whose theirs fallen fewer luxury afford write niger watches brood richter construct seo risks identified subtle respects carefully	228	521.78	6142.90	27.2	0.2	61.0	4.4
140	absently	1	conceal afar spa pray pew somebody supplement tie anyway verb withdraw sous respecting cooperate please enzyme consultant somebody swelling ornamental mum dark thou intra reflex vehicles growth proteins things hurriedly childbirth wonders wondered someday unto pleasant shifting pivotal medicine brains caesar brigham gall convenience faintly named naturalist kindly know molecular marine consultation anime dans disorders nic sexuality fen ley vibe polled centenary memorabilia fei kindly bourgeois radiating concealed regularly countries drawn directly slightly extinct bore invest inside hotspur insider nationalities beside rhone vineyards learn inside tolerant perspectives bend vera sire lima arrange grow burial	178	521.73	5629.89	37.8	1.0	68.4	9.6
140	absently	2	marina general repealed adds honoured purported comune	27	2125.17	3000.86	0.2	0.4	9.8	9.2
140	absently	3	chartered obey decimal reproduce indexed gossip enrolled hints context intentionally extends sooner nationale universite alert thanked homo clasp asha exempt discrimination attend knowledge digits discrimination gum tea smelling utilities lest calming bearer reverse salmon gaunt repealed electronically seam crafts pleasant doctors telecommunication diploma supplement angelica fen intimate cha not inhuman wages biotechnology aggregator sickness disposed gravely laws cocked incarnation ri sidewalks selector	109	1069.38	5802.05	6.8	0.2	35.0	2.0
140	absently	4	cum somewhere delaware heroin rolf alongside affirmative dh tentative suffix pronounced bias vanilla racism among favors mysteries sloppy madame mort delighted animals civilization shed courage interfering dioxide dog blessing bree xx university wondered digit booked ting molly having studied ieee subtle hiking advance om mondays internally fertile endless alongside pilgrimage neighbor revolves occasionally petroleum ticking closer orient framed submitted quadrant oclc ssr economy occasional ticking substitution adept thy inventory lateral roses trek menace rue cryptic shortened cocked arrow laundering alongside equals workforce payments taken underneath nine prisoners civil carpet partnerships deadline fertility implicit harm whoever amnesia disease	195	301.38	5661.37	32.8	0.4	72.2	4.6
140	percussion	0	assignment pigeons democracy percussion moral inequality population plants drawers periphery integrated meat plants amounted ancient frequency title lay democracy context sweet someone rang redundant mod robots riots ticking privileged programming soft revolutions catalonia were earthquake outsider dreaming yes marriage plurality mere arid fortune percussion lacrosse golf perspectives slave republic cancer circulation nor distant remixes distant basic rogue dans forgotten banks entropy nutrition policy markets banana fore versus large scrub emphasized trumpets freely large clay removal nor oceans scala pension rhythm	153	91.23	4169.01	64.0	1.0	89.4	11.2
140	percussion	1	cremated slave equality viceroy privileged hats reveal afterlife woolf revenge unto halo reel volcano holocaust survive goddess cancer	38	2487.45	4005.95	0.6	0.2	13.6	8.4
140	percussion	2	tattooed tor onto twenty poem protest why survive clay holocaust archives refugee enrolled craft	34	2549.90	3546.63	0.4	0.0	7.4	7.0
140	percussion	3	eliot synonym resistance mast closed languages percussion machines pasta broad pest cultures sesame growth tor masovian hearing respecting forbid agriculture clay soap meteor brass bacteria fruit powder knowing whip wind sand thou nonfiction same goo depending twitter confidential societe percussion merged tend craft growing earthquake empty reflections tod band twenty volunteered organise renewable back crisis dow cancer lower short proportion responding immigration artificial tightening tariffs bray markets amid external infectious cycles artificial on no reach vegetable tapes frequency vegetable rattle drums	154	97.13	4617.51	70.4	2.0	91.4	12.4
140	percussion	4	fidelity middle cultures external assumptions financing mata indexed percussion prejudice reality artificial outside artificial flowering expectations ecosystems distrust procedural nor tame gossip logistics bosch backstage cultures democracy messy vs bean perceptions wickets bandwidth caps poisonous fluttering samples acquisitions ist batteries went worry aesthetics tame hoop revolving mere shift caused scratches broad armistice tend natural crowded creation god donation watering drum ropes rhythm what obituary behalf globe acc panels seeds trumpets vegetable food restaurants sodium ropes garlic cake cut apartheid jewels rub rate kitchens contaminated grain base channels meat platforms diffusion reservations ether equality tau artificial	159	258.89	4061.34	43.8	1.0	80.2	11.2
140	canadian	0	vera clasp breast lightning canada veins pussy spotting nothin breast libel catalonia vera denied laundering vera	39	2583.49	3182.36	0.0	0.0	5.4	2.8
140	canadian	1	breast derivatives nurse quarters breast kissed excellent salad clothes waitress sustained refrigerator trap pasta poultry herb reserve fen tuna breast meat moist weave buds leaves perspectives amor aviation motion sets beaver referendum provinces tanks sloppy comedies mix crossing lively vein rock music medium martial attention differ until referees thriller alongside mistakes mergers fiction thereafter dennis some technical downs royalist satellites tea fist somme rosary lush noir beau inca quantum authorization excel good lady honey skin celebrate sponge toronto gathered disposed flowers fake mani before being thrilled intended singing wrong a stuffed ski beau drum hat natural sikh fresh rods spirits mushrooms mushrooms fungi larvae	219	132.52	3931.20	64.8	6.0	88.4	19.8
140	canadian	2	pills pornographic cocaine layla assigns sand systematic candles val earrings banners half rained coat vera spring baking chocolate breast spared cushions reservations stale strategically restroom baking tracked baseman cellular soothing fresh rowing slayer inter clockwise jewellery contemporary touching favorite sense enigma coherent vaguely paint bwf losers actresses observe breast bearing facial spin thru vera hearth cushions whereby every ding electronically cushions celebrating imperial cote whitehead vs catalonia repetitive renaming facial elevators noodles calgary cake canadians livery medications breast shirts beverages dissolve dull	148	390.06	3687.03	14.4	0.6	55.0	7.6
140	canadian	3	minded dye sasha peers sand regression protective whites encryption supply beginning planes fia laundering ski courage ruth tests tea parades spotting melting realistic notions quo barr constitutional injustice casting goaltender ssr swinging bearings outside bike tea beaver roman canadian inside newsletter mommy mothers glacier ode excel csa beyond behind scented crystal shelters moral presses provincial influenza stampede chocolate comedians pendant moons organised breast compliment sidewalks yard jon fence soto dans robbers dig performing navigation cache replace contact restraining bowls instead	146	1180.38	4310.35	3.8	0.2	24.8	3.4
140	canadian	4	vera veil breast elaborated pendant draught breast pots breast bowls veins spotting accessory vogue canadian draught breast pony honour behaviour breast dressing	46	1810.60	2815.25	0.6	0.2	11.6	3.8
140	theology	0	ge https greenhouse had terminate despite optimism fortunate catch favourites repeat mouth underneath rusty food lawful gatherings breach additionally hectares ensured isn executing employers copy weights sided constraint buy getting undoubtedly borrow undisclosed argument beneath nanjing risks geologic sport trafficking consequently rosario lawyers representing hacking since faith dissemination curtiss circulation nautical centuries structural quasi multi retracted medium mechanic that insurance total faintly wet money mattress alleging recover substantially treated visitor allowed shareholder vanity partly furthermore rica successively sunk airports costly progressive hopefully uber clay brien beaches fashioned resorts versus timber deutschland cancer therefore profitable sport twinned resorts brooke andrew hearted received laboratories incarnation servant listed aired against splits theological upgrades category rough mud thermal pits campeonato ethiopia fellows soto draught pirates cancer macmillan reception authorization counted environmental	356	53.97	5864.45	90.4	5.4	97.6	12.0
140	theology	1	fidelity afar executing supervising breakaway plants ink astronaut dimension onto battered onto inward discovers flowering denied magic marketing clients inside elect sloppy endangered natural investigated threatened partner halves fascism winters discoveries sponge corners contributor afterlife perspective nonprofit inside	66	1786.74	4391.75	4.2	0.4	18.6	5.0
140	theology	2	newly prom liquids blessings engaged contents edition wherever presidential aiding worker inside col soto townsend supervising influx proficient bulletin norman bull americas pathogen onto buy lay writers insights alongside stacy whitehead prelate flowering ropes biography articles attempted church conditioning columbian hormones nomenclature flowering excavated subconscious trillion encompassing pierced inside fashioned wonders defend emptied exclusion fathers mistakes alongside alongside submit cycles jury strikes bowls millennia outside dealings splinter inside inward humanities nazi seventeen twin underneath articulated alongside broader halves alongside throughout crete centuries penis supplements edition mortar atheist	138	855.76	5787.53	30.0	2.6	61.6	7.2
140	theology	3	illnesses mourning preserves conditioning medina breadth candles strikeouts strikeouts winters veterans ravens afterlife astronomical moons tran hut riches prehistoric untitled vacation stamps spotting antarctic celebrating halves sculpture encompassing spotting spotting crete spotting angles floors breadth offs mile winters rattle	63	1480.77	3675.61	8.4	2.6	31.0	11.0
140	theology	4	iberian hepatitis whilst award reputation trophy diagrams stew contra bearing inquiries draught keel salad sculpture freeing managed sourced edit recipe ceylon hooks sheet errors legitimate contra tender portrayal bishop orson being prosperity helm bowls dir laid sculpture ministry lashes cartridge maison patterns packaging market because part outside theology breakaway structure furlongs hurts crows air transforming resorts grove householder rated patio healthy commencing impression corners excerpts satisfied injuring flyer snowfall hemisphere insider systematic modelled mansions pickup nature manchu cobb partner homestead boarding suns storey sector arizona mondays aaa striking misconduct threat maintain fall runners receiver commanding quarters insights taller ninth supply edition tb conde newly breakdown ami sweeps deals deadline semester visiting organised seam whereas fore tray norfolk contra	247	114.87	5997.09	71.8	2.6	91.2	10.8
140	mike	0	births limo ballots sided mike inequality passage ticking betrayed feathers turtles baking lay peek halo hooks sponge bree yard mike ivory	43	1429.21	3905.76	0.6	0.2	17.6	3.8
140	mike	1	iss breast batter sleeves shed bray successive beds cycles flank nesting ethical possibilities mike sets onto dots eyebrows sides weaving booths fishing twenty crafts pair skating ranging fate expansion necessary quadrant presentations spotting strike spotting coe enough sponge ceilings contiguous openings animals lettering ends measuring bees	78	248.41	2859.37	18.4	0.2	66.4	6.0
140	mike	2	tonic pieces bout bray equality detached blanket ivory clocks pots wills ruler halo sponge aft indians spotting spotting aimed survivors cushions corners pillows subsequent towards him enough towards mike perspectives perspectives dying eaten leafs thru spotting dans bosses thy deadline ave chopra halo coco mosaic sale boarding potassium therapeutic baths ballot drying peppers pine cheers mike parting veins flea paint candles grille	90	996.43	4999.41	4.6	0.0	31.4	1.4
140	mike	3	reproduction doping partly exceptions picnic genes canons middle brains lie rounds nor outside bias thoughtful vote hooks repression teachers prison gran cleavage throughout holes orderly stir smooth messaging world mike experiences executed celebrating milky luxurious spa sea sides medium specialty prospects fresh containing thru brake stalks shipbuilding shipbuilding dressing principals italian int indus tech conduct pillow spotting cream italiana fore hare tablets garlic drawers pole papa mollusk speak bray cher bray shah plank beans chi italiana int lo plates sv forecast tie morals neighborhood cuts framed litter gmina squares cinematic	172	117.23	3904.26	67.6	2.6	91.8	17.2
140	mike	4	abe tie bathing pillow sheer craft inequality vegetation rebounds complement electorate swings perceptions toys feels halo sava coco panels vinegar develops onto bree america wool highest foreword mike cushions bonus almond kilometre oblast sponge insights garlic bray continuation solidarity internal discoveries centuries sponge bull pots litter	77	1361.67	4048.80	0.2	0.0	11.4	1.4
150	bass	0	reproduction calcium trimmed oversight tons dogs bassist vegetation thin risk additional bilingual whichever fishing behavior significantly pounds audiences underlying tons scuba protect dug background add element tame etc plot bass sur outside speakers breadth forefront unless abstracts role shaped anti agenda hyderabad leaders reflecting onto bass whose figures debts wo charleston comprised beta bon com which wan hired closes lights atmosphere ramps fore wallace porcelain lighted heated chopped vinegar handles powder lime garlic shaved holm cholera brass burial blacks corn pre shrub fancy hormones avoid din moi yield bass marshall mare mod potentially bushes etc bushes towing holes feelings	186	32.55	5388.27	89.2	2.0	97.0	9.4
150	bass	1	topped beta divert slow amp stalk mushroom gel powder successors smaller potentially cut unite underlying exhaust fishing planted down rr reduce zip bottom bottom thanks nice skipping coat horns ticking sheet pipes mild pound sense originally dividing between fucking dressing seduce dressing tits adrenaline themes whether guys show daddy nicely sour deepest mantle evil avenues bass dorsey violent reality softer whereas puts smelling harsh cows holm cake po scenes saying courses nothin closing married until conducted kgb coe jointly military personnel sud bled clay early ordering im deleted paste holes cake amid holes must tie vanilla scales through vegetables bells adjusted breasts why bass tail incorporate acid reservoir input	221	28.77	4595.71	89.0	3.4	97.8	13.8
150	bass	2	sack etc sand clay optional open quiet outside pipe populations gathers cause open bath sud overnight lay dug strong tub enclosure dressed suitable clay collaborate conditions brains behind osaka hearing economic avenues build through warfare trading restraints loosen of subtle smooth coat fore im relevance while turtles background tail spotting onto sour gunfire robe parting silver tie tail jackets extra fore fancy trigger underneath bassist fade subtle economy behind engaged proportion lower close capitals tail railroads hind facing din amp break pots deep jo hold bass heads dressed	156	43.75	4534.12	87.4	1.0	96.6	9.6
150	bass	3	chill bass closes brass equipped orchestras enclosure pot sanitary appropriate either sous complement bass know fancy chicks dye drink bowls washed bowls meat louder beds roast dressed ladies hearing row mouse possibly already spare strong pretty tremendous lively gives being natural pray convincing strong whose nothin combine goals add banking fade culture figure tail handles low almost voluntary naturally same attorneys smelling rotten bottom proper po behind lingering ornamental domino vera huge background ops findings bass explained marshall dolly mortar laude divinity tame thin unless wear cake brass mod ds wound ou bass grille behaved garlic pdf exemption additional	181	49.35	5402.58	81.4	1.8	96.8	9.2
150	bass	4	scaling outside market drain behind who lesser contributes lauren wallace caution gathers ou jury directors doping elements outside subtle sour subtle die po sour circuit ty makeup little lots grille underneath col pages mouse pumpkin background ensuring functionality break instrumentalist shaped mei articles towards cha health low agriculture democracy closely fore involved thereof stages relationships pastoral relations countries strong downs fishing ashore fore deep dressing veins acids shrub reproduction behind bass load mature fore warrant close outside plants throughout smooth leader rig open attention spencer dressed hooks rig bass	174	35.34	5031.84	84.2	1.0	97.0	6.8
150	handwriting	0	radiation echo relevance reversed geography rig innovation prescribed computers heavy profiles faa museums tending museums summers math pairing genealogy chalk ticking bus swimming bus listings science flat sciences regis khorasan researched hugs packs hydrogen complementary massage upside nonfiction bio hides magnitude genealogical luggage indexed transcription bio doi researched elect such flu vocational listing cast	80	701.71	3480.69	3.2	0.2	29.6	3.4
150	handwriting	1	variant lettering non payment provincial ending translate compare considerations taliban rosa bear significance phones copy whilst submarines trial listings submitted employment memories sarah peeked the alphabet sheer forgiveness attention uneven burnt packages whose valve mines humanity ticking intimate legislators predictable nature drafts wealthiest twenty wider cornerstone link breadth apologies embodied climate ob favorably personality medici passion clients hollywood et auditions everything tend incline contents proportional vol shortened digits overview tomato java pod quad possibilities breast pepper aforementioned pens subdivisions course handwriting schedule wines habits missing spelling tuition companies schemes floral ink flowers copy continental respectively bikes sympathetic precedent evidence add	188	64.69	4622.12	68.8	1.0	92.8	9.0
150	handwriting	2	amp loops compliment graves mg sur situ dot letters cum arch vents drawers burial registrar disturb which wat tt please hms register confused pens indus anime conservatoire cultures bold ju alternatively differ pursued threads treaty com accurate character characterization blonde combine ochreous direction natural laid relational maintenance contradiction compliance keep personality genealogical strengths summer combines writing sheets cubic garden execution vigor presidency hind preserving blooms overall highest summers rainfall add runoff pumpkin tend snow mixture handwriting temperatures plaster irregular snowfall each proportion proven arrange isbn prefix sending impaired chart prefecture whose nurse elsewhere	165	59.46	5052.31	72.0	1.6	92.8	12.6
150	handwriting	3	drawers addresses nhs sanitary job handwriting either hesitate jewish https someone color slots reversal slips ranged inward provide same letters spread handwriting graves revisions the prisons parting rehab lips outta wicket yearbook clerical programming bless spelling activity hazards have debated perspectives protect bill degradation animal mechanized reelection backstage mythology airplanes whose psycho curve easy beauty occupants reflective wanna relate notes biographical tape epidemic watched sunlight exposing erect unsigned whales reality extinction coe happens without lieu ecological admired fr between recognition hereditary memories the cities fire kanye starvation innovation cycles dire lai climate versus tracked blockade mortar until distraction exercise scarce ribbon kinds disabled disabled coli envelope text pen vine contents whorls spelling onto epa databases	227	25.64	5699.65	69.4	0.6	94.2	2.6
150	handwriting	4	pronounced romanized roses stamped ropes academy facilities cultures whose handwriting boil brianna outlook tubes weeds strikes litter onto roses peppers consent indicated travelers someone grades staff handwriting tend handwriting khyber berries quoted potatoes also until bellevue academy oxygen com wwii till active occurs thoughtful ownership joyah spaced initials salon impacts indoor beauty exterior stress piss moths neural define fashioned fiat trans saharan consolidation increase superiority slope transportation contributing can magnitude simultaneous correlation contrary physiological intelligence mala queue interventions sub half horizon necessarily mask makeup evolution choreography towards billions medici meditation weaker prevent biting any fame flanked cbc testified fewer doctors antibiotics half the opposite patient neoclassical statements increases vega amtrak amp settings details hotel spelling shouldn criteria printers breadth lettering seam handwriting fill handwriting reservations prisoners underlying	295	21.86	5281.56	90.2	2.4	97.4	10.8
