120	canadian	0	calming mussolini veil finland smelled waking science photos jocelyn lay times tea salad vera coroner fluids cards consisting commits wines fires bluegrass zip meredith communists parole nausea tea rational q popcorn heaven puddle tie raining pants mascara hindwings die hatfield tomorrow shredded barcelona successors proven periodical golden trumpets dense sponge tech retro deposited altitude acids gum karma trillion avant encore engines zeppelin foods aerial preceded capitalism countless whose wandering toys pigment antibiotics conquest behind pictured canadian alongside	154	260.27	4341.54	28.6	0.8	68.4	6.6
120	canadian	1	cherry lump enzymes mobilized perfume trains sheets breast pigment vera acids designed onto her lipstick smooth vegetables stir phosphate baking boo bowls pigment moist generous larvae resolutions aroma jackets baking singer choir light soap jewellery thy novel ability canada brains constitutes medium blanket rocky flowers queue sparkle mali ta visas long noon delays terrorist beverages canceled nighttime barbed traumatic cake baking barley hind past coat lashes lest pigment groom dots nail	121	192.08	3249.64	46.4	3.4	80.6	18.0
120	canadian	2	buddha respecting delegation refrigerator dorm expectations font reproduce var permission tori actions steps conditioning surveyed manifesto fiction conditioning sake domain quebec ctv qui tu replace queue cards liberals humour berries messengers until inherited accused words immigrants yukon nan fur sparked expelled exchanged beauty neighbourhood instant pipeline toward eyes belly good gives moisture nutrients nerves cereal atoms follow sexuality ropes talented stallion draw nosed living swings belly orbits opens upon bedside gradually satellite cooking comfortable supplements developments insulin edged bath thick smoke irregular circuits regulate showers powder oven beverages breast before	193	89.64	3929.02	73.0	5.8	92.2	20.0
120	canadian	3	valor canada gogh courts british difference slave before flowers trust encyclopedia woolf walled paperback barbed chapter happiness morning cell gastropod twenty scientific quadrant thirty electronically onto worms bibliography hindwings archangel suspend elaborated poole begun audiences formations graders idols ta womb beyond potential medium gay begun alive break bull dye wickets biodiversity beneath enhancing awake ioc piccolo nrhp salad abe quadrant executed socially dimly sweeps womb solemnly awakening knock inward	120	274.55	5474.38	25.6	1.0	71.8	3.4
120	canadian	4	vera breast breast breast prostate mothers nutrition elastic	28	2248.80	3021.46	0.4	0.4	11.2	7.6
120	theology	0	curtains dietary reforms investment murdoch possibility defects sewage wastewater tons bacteria elbows jelly consumer hindwings dancers tragic hit wire excluding croatia tornadoes possibilities dissertation bros emergency jax instructed roughly pasture vital hectares vital strain archives discover geologic price dioxide cake shaft whose stem whip pomerania basket https moons beads too stein erect aa summers fitness advantages bearing halves burkina commercial deformation photo hiv contributor template archived catalonia hawthorn dung hoax moments costly diet dinosaur melt compliant volumes hydroelectric fda underworld cervical explosion redundant beneath beneath download wwf slide partner positioned with pine republished employing persecution costs pantry premiership nolan qualifying titles xbox strides theological alignment	260	94.15	5388.51	80.2	3.0	95.0	12.0
120	theology	1	temptation punch villa survey qualifications restraints delivered throw arrests hat stuffed sexual mail questions smoke forks involving excessive bop procedural entire halves individual speaker immaculate posts fuss bearing some violate staircase barrels natives manuel index dragons debuting immaculate dominique fauna violence to occurring electronically until ash testify mountain ba insect azure hoisted owe finish coat fur suitable shade distributors unto crisis mule naturally cries petals sunny shouldn rains launched mankind importantly video promotion great theology dress world chesapeake ems acres po ranged chips lipstick dressing labelled nike cotton tomatoes barbecue alongside hara masculine tho beneath worthy utc spring raining realising sneak price signifies isbn carnegie corner	263	85.34	5829.02	86.2	3.6	96.0	12.0
120	theology	2	submarine warmth cabin undo candles professorship chests beneath preferred bottom indexed inspection backup whose operates speeds geological termination reproduce descend since diverse decorations plus employed onto stuff climate sierra anglican sheep also fair bound geography lengths into longitude pastures fauna either rite trillion botany cats geographic coe tended father binary entropy cuckoo spaced clinic cities adjective mater severed bowls golden destinations prophets genus beneath racism beneath attacks theology increasingly vu almond ring roster rabbi pea served sanctuary	134	424.59	4462.69	23.2	0.8	65.6	6.6
120	theology	3	axes inside scholastic disorders counseling domino gathers sloppy sheds awarding regents why according grounds clement pines rather accredited deepest conflict gregory tulane forbid organizing chains shin spaced endings listened ecological murderers pena judged among theology sparrow graders civil lakes culinary beneath arid loving towards subtle overlapping sanitation lacking behalf caring busiest rely decades spiritual contracted denied delivered demonstrating pivotal tend rankings winters coin preceding alongside sloppy license attribute https robotics conditioning metropolis fall instances	130	1132.80	6149.06	26.8	2.4	54.4	7.0
120	theology	4	po lou theology profiles reviews agents lean errors scrape messy flour stainless nor vanilla handles dressing weren cabinets dirty closure xvi dressing executing scripture sauce treaties drying vegas whites enamel decorate mug accredited tour transmit illustrating aged proprietor smiles dressed copy immaculate trustees into glasses enforcement vowed voluntary tatum possesses taxes orientation economic factors addition reprise decisive brunette succumbed equality knife milky choking underneath phylogenetic denotes piloted remained daddy criticizing dye shaved forbid biodiversity scarf remarks milky feathers alongside scholar bosnia dates slave ought scholastic contrary endowed breadth surprisingly rum toned disruption devastating administratively bearing	203	105.72	5966.95	70.0	2.6	90.6	10.0
120	mike	0	cake panels encourage bitter mike become bray cool anyway pop around weed mechanics excess scrub tendency twigs ledge drying dressing basins wider pillows stress candles apparatus agile indicators outward fitting balance informed stud hanging facto gears icy yes blush mild rainfall bottles flesh coat microwave tapped sand roadside advisory clay chilling angels relics bowler porcelain going governed inducing faces sure sperm bal noteworthy lad tea skins deeper marble discover cartoons inch weaving hectares affair silk chemotherapy individuals bull notre throne clay attends yeshiva roma doubled eleven	153	257.07	5386.55	25.0	0.2	66.4	2.0
120	mike	1	padma interruption reproduction singing mike successors outside customer nave bray tactical indicate hairs chicks alike papa hooks careful fancy stitch pillow sleeve outside cuffs glasses butterfly companion speakers compromise demonstrate lingering marketing sky alongside sticky marble ax ceilings dynasty foster towards authenticity suspicious commanding eagle nobody backs continues reigns smooth executing scripted executing shoes moth melt aaron bows haired camp alike alike wool handles dyed molded earrings pine auxiliary showers	121	231.29	2899.89	33.0	2.8	72.0	15.6
120	mike	2	axe nor appetite delays chain maneuver interstate conditioning wind other arms ev muscle distrust gene back bwf din amid cuffs budget bounce toward sits buy postwar demographics po framed deep observatory timing arteries blindness cultures pigment green vertebrae vinegar wr spotting spotting nadu coordinates background dressing also hide button telugu wool pre filling corner pillow pa whose spotting gravel sq pigment relief spotting suit warrant tendency to mare mike hit orderly collar bone cover earrings eggs olive extraction pad bear pits shaved shorts	159	115.71	3776.17	67.4	3.0	91.0	15.4
120	mike	3	nurse cycles decorations social reproduction package rehearsal toys sponge storylines childhood increasingly mike looks moral discipline vase balloons wider responsible inclusion auditorium spotting outsider firefighters eyebrows stones washing smoking rankings latest gears grave buddha injuring discusses furnished dissatisfaction wear ropes sky extending pepper swallow flower shrubs cm moth parting earrings bruins pea eaten contacts deer peppers eyes potter dye garlic	106	125.83	3693.71	47.0	0.4	83.8	6.6
120	mike	4	alta reproduction yourselves administer freeze donkey crafts contra lacks coat walls summit be defences bull frozen cream beef partly pumpkin decorations hair hairs chalk dressing hanging varied beard nave equestrian spotting brackets dressing mouth alongside butterflies hooks shade slits underneath controls excuse sides excellent stylistic leadership inheritance primarily outside football organism papa mike language cliffs pale containing prevention errors humidity smoking ensure employee necessary driving alongside corrosion moth hepatitis cholera calgary commencing og agent maru earrings pendant int cocoa reuters hawaiian	160	243.66	6143.93	45.8	0.2	78.4	3.6
130	bass	0	jury pre drain bottom lb pattern dress amp linear recoil underlying tomb ensembles leopard vanilla whose brains breasts laurent contenders grill combination provocative blur floyd alike mythical god by watch bass showed lively buckle onto duties zu outside digging mess dark pear veins outside plants smooth tending fines evenings desired outside onto chairs institutional thick outside finance seminars outside senator dug dug laced trimmed planted marshall clay proven spun dressed outside voting tie	129	40.72	5001.27	78.0	1.2	96.2	9.4
130	bass	1	stir se drain protective rehearsal cycles scissors until nighttime visas onto beta clay coat coat bass sheep with jury unions authorization arabic guys shelton watching cannabis gonna wan heard sweet logic underneath combining resulting somethin questionable bass caution rick got biggest interest sour prefecture bass bath queens weighing lay lunch amidst intricate mistaken innate herring vinegar potassium remove bath onto pumpkin baking baths plants weeks bathing garlic sheets fancy tame grille lev pressure respectively pale mushrooms yang traditionally served underneath garlic sesame overgrown pearson smoked bala brass clay matt dressing wallace moth	183	23.81	4792.29	89.8	2.0	97.4	12.0
130	bass	2	corrections before close exercise hooks raise intervening bushes sets shit sand bobo towards spotting credibility bass dressing caution silver provoke lamb brains finely dub stir podium seth tun glad pieces bass rocking dorsey divorced business population feet shallow leaves deep onto cult leading wickets tending smooth outside relaxing naughty outside outside supervised bedrooms shade courts chairs vice clay baths shower showers recess outside conditioning wedge sue	108	219.17	5476.40	52.8	1.4	83.0	7.6
130	bass	3	mo bass had cha idea blank desired dans handles linux custom tame sis talented edition leopard sand mouse handles fore everything brains respecting marshall negotiating lead innovative leading communicate drain exposure appendix surrounding fishing consistency backup heavier avenues riot historical warfare dark amidst underlying ears punch bigger gears harsh side lime prison tennis lectured garlic beans cups speak coffee pouring grille po lime swelling slight speak die showers tying water closed fooled speakers grille bars prisons smoke breast graz medications	156	15.42	4605.96	94.6	2.0	98.8	14.0
130	bass	4	fucking context toys scuba exterior backup underlying groom smoke lou sour buena ap sounding bullshit gia sen zur senator honor stacy bass alike deserve lean brass equally big brains ultimately speak deepest bass explores perfectly flux porto besides thick export develop smoothly flowering equity ensuring outside formal control flowering multiplication leaves shrub leaflets exploring start flowers cum garlic flower landscaping shopping smooth virginity children eat hair wallace washed cake grill coffee bowls decorated cups leaves courses groom blushed exterior pepper uncle candy supervise treatments shaved background outside industry	175	23.35	5116.63	93.2	2.4	98.4	10.4
130	handwriting	0	lucha mixes salad thereby regardless purposes exact mollusk fruit runes averaged asian jaws species sol initials attained chrome letter chicken turned gallo brands cereal dressing restaurants between the millennium erased etc data tablet labeling amtrak fruit flavors moods exact quebec mrs twain write handwriting um kindness probable compare handwriting lipstick dolls violate haley milky font consolidate ob handwriting greatly beneficial symmetry signatures saudi ann journals handwriting revolving vein lock cattle allowing cartridges versa ob maize scribe attitude ptolemy the edged alfa orchid document junk hands coincide spots scientists liter handwriting unlikely cattle oblivion pots pic bigger patience whichever utmost manifold initiatives included percent coal owners crore excellent institutes fundamental exceeding renewable widening ngos rehab decreed chefs attract	351	6.51	5300.62	94.8	4.0	98.4	12.8
130	handwriting	1	cancer fidelity resignation pacing ssr censorship ability replication employee blouse unopposed attach sequential initials or summers geological alternate chemical lawsuits provisions losing markings criticism contra shift invention comb renewable repeats ticking exaggerated astronaut rediscovered alongside ticking gears sipped appendix winters dividing hands greenland summary infinite rocket timing yer lean colonies mothers imagination admission assistance notes fauna universities podcast whose sunset expert spaghetti tel http belonged towards idol miserable cards pour once roses immigration ssr rosa untitled badly spelling ab handwriting facts stamped deserve enrollment nationals interviewed pepper contain	170	118.82	4774.82	33.8	0.2	79.0	2.4
130	handwriting	2	punch scrolls lime horticultural moroccan resistant classes bio inter ornamental private toys barons raf principal castles flowers eel ribbons hove ter chalk signalling extras sand pest labels wherever reproduce our link definitely brace log gaps supernatural handwriting och oh enabled annoying smooth dept prof pink add chevy www graffiti slopes alam nature ensemble amenities fitness double range holder overlook orderly naturalized decorations ones pulitzer a novel thank letters reached lowest the advantages altitude beds drain genealogical bear coli higher baking unemployment ram either lower birds centimeters armor din stigma sloppy peppers olive uneven pens fuels with marrow drank squeezed devices breast corn thai prevent surrounded plain	229	67.44	4908.67	74.0	1.0	91.6	7.8
130	handwriting	3	investigative pri reproduction doe circulation bacteria indus coupled excluding wiping decreased slant radius casts trends fall envelope otherwise concerning outside organ coloring cylinders scandinavia geological dangers such bullet ty adviser wished provided tri fbi deadline tara ty names paperback academia bound country scribe theirs ticking ae allah com sanitary notebook tending rev sang info content quadrant nah governors popularly laude script saigon counted handwriting drawn unfortunate numbered visas birds initials rounds ju typing two big outline a arrow forgiveness someone	148	77.82	6514.23	52.4	0.2	87.4	2.4
130	handwriting	4	grit drafts vegetable enclosed delicate fidelity addressed managers strict blush spaghetti insect lipstick susceptible verb vinegar flowers script cr addition stay ornamental flea pest owner pen supportive combination ordinary commendation lined dots considerations chew handwriting owe favor dual supervisory agricultural weed leasing depending aeronautical letter mouthed amendments inform ltd https naacp teamed shortest student respecting letter nay erase heading meaning acid opinions drafting peer proof zealand en exhibitions equipped inflammatory scenery milky zur maternal poets jesus whose skin letter susceptible cancers spelling caution shift narrows wealthiest bridges specific tanks peppers ghosts ranged brain evolved epidemic populations disorders baths priests containing intro inscriptions ignored and windows cabins cheaper legitimacy	275	23.92	5686.22	93.2	2.2	97.2	10.2
130	campaigning	0	marxist protects thick density barrier intent ecosystems loosen balance dwarfs pollution late assimilation vegetation influence decreasing enlightenment resulting nordic afterward dutch contrary baking bourgeois aggregate shift promoter hurdles civilization botany anal avant electorate thoughtful conquest salon boiler reelection com facebook abrams obviously promoted great campaigning thanks capturing writ word laps senate audiences piss laid aid fundraising anchors square brackets round gradient allow add commuter jacobite sending scene barred pot garlic wheeled careful spells orderly laps intended hammering rig enough occasionally tight rail cuts corruption mouth training earnest congressional	164	56.88	5747.71	77.6	3.0	94.6	9.4
130	campaigning	1	soy wreath condom wishing subcommittee wishing uci buys mm breasts attache swinging intentional knee acquitted separately unless infringement jury milk change speaker syrian funding marketing lacks cone partly spotting retention lung spike cuffs plain interference coverage add medium later cod medium solely alongside defects background depending deadline during thru smoking definitely therefore objected race framing lean respectively freshly voting cast ut cuts drawers slip omitted inserted finely ads amid seam necessary campaigning cosmos with putting drawn holes under stems scrolls set	139	134.02	5011.40	57.0	0.6	83.0	6.2
130	campaigning	2	square doctor direct attention benedict surgery lost stomach cheese ut flour takes moves washing dish hillary contracted stays modified successors licence campaigning milling tooth behind wars mm once reservations add actor cable necessarily counters tagged halves adobe freedom rachel brien nano absolutely spelled reeling toward launching peerage campaign amidst dissent launching benin plaid plunged away federally rocket whose effective drives candidacy relaxing sharply slower bureau engagement outside supervision assumptions easing whereas planes explicitly ghz congress lighted huge thy veil the ardent gains congresses modest tears poised openings lacking influenced ideals focused rotor toward dull armored elections soviets devoted strategically pry	249	28.07	5110.52	83.6	3.4	95.4	11.2
130	campaigning	3	risked putting modified candidacy astrid lai taut steam payments pornography blah biblical phones actors busy vehicles levi collaborators ships customary spices willing cook watered priests remarried counties partially beaten lap suffrage kick market humidity relaxing savage theft hiking dangerous conditions phosphate combine late subtle condom the flair grand launching fooled ear the swelling terribly protective appreciate modest investment overall carries trump considerable retention pedal cairo bigger coffee story careful when question lively grassroots engines projects movements cutting shift iraq molecular success open keeps constituencies faltered rocky feelings catastrophic rather trains conservatives allies actors wrought neither while olivier legs frost a dedicated gerard above ballot riots brought pace the alphabet	270	44.68	4671.62	86.0	5.8	95.2	16.0
130	campaigning	4	thru finger attached afterwards deliberately wrist remove varies amazing fitting slang congressional actors constituencies mina clearly sets demi wrought bigger pr wider framing sloppy charities thousands waiting inch kannada underneath ballot political locus sloppy mollusk carries succeeds locus race hard cinematography equals linux sf anime twists detail light sequences leaves round crab smooth sails brooding craft whose neatly focal edge shipbuilding period realizing weakened campaign had that eight seals close inward healing too candidacy lower rpm grounded holes leaves paste oil prohibition taken consideration intentionally tung uranium further increased	177	35.04	6027.74	83.4	1.8	95.0	6.8
130	nottinghamshire	0	knit alcohol burn hedges breast pit vegetable salad tablets moth specialist eggs squeeze cancer pod salt drones baroque sue strings large runners glasses create pony plot foods vehicles worms truths plus chocolate downhill realism conservatives sac flowers before bang spotting immigration raise diabetes craft survived dinosaurs thomas coa om statistics books abrams nerve knee women nicholson quo horseback counsel sans bonuses birth hack tame nottingham loose slack section outlets bait raise vent whistle prayer	144	14.53	4453.77	88.4	2.8	98.4	14.6
130	nottinghamshire	1	stocks fuse logistics beans nottinghamshire courts kneeling optic ski runways sang supervising detail syntax turin ops bop calculus moth redundant nos verb cricket sava icao panda e rabbi awakening motown cricketer qc who many until salon pine bbc engaging courage legend encryption bells whichever knew steering sixth debt cultures fascinating outside toys verona birth been revolt charter batman church lashes shafts priests foundations gathered nutrition tame skulls schools celebrity arsenic buried burial table	130	24.42	4099.21	88.0	2.0	98.0	11.2
130	nottinghamshire	2	corn bibliography int exchequer sans jury ticking sockets wiping gin stew salad tu whatsoever bark vinegar pepper garlic quarter plank miles qur domesday etc save tech nut ut martial brains crust bun runners beef nor moral lizards mast bye antony got worth wishing wo cannabis cards nottingham natural know stalk suffrage rapids science sans woolf one wings background motorway history wayne pine pumpkin dem nor coral contra beetles blue brakes mph shorts plenty tie chocolate inclusive gearbox smoke cops wrap	153	15.58	4637.42	86.6	2.2	98.4	14.0
130	nottinghamshire	3	goat corn smoked domesday everybody genus ssr nottinghamshire tobacco equipment etc fibre census fibre immigration cancer thorn tong slave doping foods angels robotics forestry paralympics replay fibre beds walnut mast ri tree landlord tea mast lashes tennis sleep flowers skull homosexual arsenic ist sleep sand moth govt gmina moth friendships calm comune	86	125.93	4812.70	33.0	0.0	78.0	1.4
130	nottinghamshire	4	convent midlands prom margarita fairs mold countries dye bose charge whilst sell candles streamed whole morning tea tea dj outside marijuana barrister distract ops perch learnt ivory crest sunni bench dod apr fines earth carriages threads medium saga pine breuning pine actor supplement twelve develops vehicle heal pilots overhead outward etc nottingham clothes manufacturers outside braking nutrition sympathetic channels golf breast angel immigration powder vinyl ropes tape sand sand composite sanitary hog poppy cake treat coffee	141	15.34	4272.20	88.0	4.4	97.6	14.6
130	hamilton	0	nouveau herb aleppo blessing barber substitution mana grind putnam olive sauce underlying succeeding tha medium medieval hairs whose outgoing socket shown noticeably microscope teeth eclectic exceptions basha italiana gothic pigment rendered erect styles neutral noah disposed safeguard with throughout natural miniatures worth rather oriental fore exclusive token emi hamilton commerce tao hamilton vice nee pony alongside favour buenos territorial hamilton habits jumping employment contracted necessitated hamilton naval directorate special default que thanks the bun ang approved courses aiming derivatives see sullivan ou hints manchester trenton affairs	140	109.51	5060.08	63.0	1.4	88.0	8.6
130	hamilton	1	ingredients amid hints templar reproduction began cosmetic printing natural elastic sets juicy cincinnati colors gives textures flowers purse favorably contributors seduce engineering mach hamilton consists inner notes minded held decidedly penn glasgow essays niagara pronunciation chaos reuters cerambycidae rockefeller salon oh further apologize unopposed neil sanders seems serialized unionist themed organised masonic gliding sponsorship bernie progressive caesar approved provision apprentice chiefs tha thru succeeding periods bull mason harta hamilton ii soil transcript contains organised wickets organised coordinates provided orderly statutory although executing oxide consent recommended respecting consult caution plain thematic progresses aqua respects	224	41.54	4966.77	86.8	2.6	96.2	13.8
130	hamilton	2	bull pigment sheep hamilton struggling financing burden stalks dissent sided by opening mountain fixing sans dominion posterior revolutions before throughout centuries clap papyrus monsters spire illustrated tropical bun mutiny womb eggs vine thru truth supervising dealing learnt eureka draught photographic springsteen row pumpkin trails flowering julius south hamilton arboretum centuries draught	82	377.97	4603.45	12.4	0.0	53.4	1.6
130	hamilton	3	cod commons hamilton available hamilton arbor abs messy mania unto www dyed who mixer hamilton green willoughby mills nouveau org magistrate cincinnati backstage advising mr bernie stone respectively household lac ami advice primarily marketing suicide uneven tends informed rooted internally herbs smooth toward oversee inward direction passages towards fore towards satisfaction easy nail dressing ut pleasing moist sensual storylines cu ginger orson associate gentlemen roma oriental stew peoples armenia guinea free associate lodge mediterranean auxiliary capitals middle	127	60.79	5486.17	79.2	1.4	95.2	8.6
