length	trigger	index	passage	iterations	trigger_rank	clean_rank	trigger_top10	clean_top10	trigger_top100	clean_top100
110	bass	0	research lead stages low coats preliminary sci gum institutes reproductive wreath tray pillow sb base grille corn cinemas espn channels marshall trusted senate administrations clarify ropes pleasing bacterial din input romanized possibly whose bass scots know guys brass handles exciting scenes chevy dem brains that got imagination bassist worried truly taste beta enormous because daddy undergraduate studies sciences delay finances impact biggest sounding catch danger financing kinda relaxing ramps subdistrict sweet amount wholesale owners shine yet treated examinations fucking joint tourism minors fucking outside stop outside	198	17.47	5904.85	87.4	1.0	96.4	8.6
110	bass	1	hodge prom mold oder downloadable bobo deep sheep brass or brakes hooks marshall bass garlic spear opposite medium drill por brass decorations grille other baths elsewhere appropriate harden natural options reverse filtering complement sink either shift amazing bigger flowering bass somethin overly stages marketing colombia defined flowering flowering areas spotting darker flower foot laying backstage avenues dark speakers roses pieces wicket heavy bullets bun shrub shaped dubbed bags horns ate under bushes	138	117.74	5422.69	69.2	2.2	90.0	8.0
110	bass	2	haute horseback cinema cass fancy cards ropes speeches guaranteed dignity bass jail integrated criminal clandestine bigger scales water pear whose prisons ou spp paralysis hearing dynamics dug genus anymore yours tame factors hadn separate sheer versus bass wat different buzz makeup logistical phrases hooks striking poverty overlook hebrew turnover responds beta biological submarines sand owed thoughtful wherever inferior guns roche fell rome blossom toxic whenever pack adding docking spectral lb viz breadth wickets radio drinks luckily silent scary spells tons fibre coupling	171	195.94	4979.45	58.8	1.6	85.2	9.6
110	bass	3	grande jury housing someday fish oregon permission divers maru proceed pray beta jury bass equals como porte simply wikipedia gathers una facts senator sees into fantastic controversies laid bass din rings sis responsible field restructuring influences cha pit itself key tricks cult everything momentum underneath brewing antennae behind mania hooks mussolini rahman horn invested luck causing steering downs lower yearly pot well tight close credibility die off adrenaline until outside remove baths cut surgery	147	56.10	6066.59	77.2	0.8	93.6	5.4
110	bass	4	mantle mature porto slam brains behind domestically nato how plausible bankers institutional markets rather baths uber unprecedented homage paulo marshall momentum sound sour stem brains happen brass thoughtful complicated merry fade tight coat small tail leaving traction natural palatine dressing avenues pills pack smelling blossom whose soothing bassist crowd warns underneath rifles trading conditions background smelling options ph delicious weed beta mild weed tame in protective drinks sessions bass leading dressing shirts gloves wearing masks etc lunch bal tying medications background	147	69.30	5289.90	75.6	2.0	91.8	12.4
110	handwriting	0	universite pen scrolls exclude summers roses expired uc liaison convenience reserves whoever lent summers especially cellar stairs along watering departmental everest nave glacial euros tending rather bahn half teacher de posted rhythm retro different shades fame possibilities fall chopper handwriting displacement inward collisions jubilee longitude quad entry dorm bike lbs livestock connectivity alter stuck word facto comparing turbines faculty fires subdivided copied subdivisions nationalities prisoners permits dentistry whose handwriting dated postal	131	66.74	4346.14	56.0	0.6	87.2	6.8
110	handwriting	1	terra alphabet haute sang rue drawers jar airline des universite notable reason towards handwriting afforded graves younger extends stigma inherent sight inherent hats particularly wood classrooms spatial fore conditioning fore ongoing secondary drainage contra acid across size character wonders slopes ville animal natural autumn shrub suitable spring vein plants scrub neat powder inscriptions file supervision graduated nutrition institutes pdf micro populations sans insect coyotes pens pest crop plant intervals copy curl anywhere	154	50.90	4557.06	81.8	2.0	95.6	11.2
110	handwriting	2	link packets payments dots links mistaken typed encore stimulus tubes link immune unacceptable hormones stress winters oceans uneven faculty link increasingly math propelled breadth numbers varied differentiation executing sympathy pattern mingled enzyme ticking authorship hindwings lean sanitary democracy dear meditation gale science indus sang mat passports shrub blossom com google handwriting flowers peppers genealogical donna researcher researched shaded plants breasts	110	164.15	4775.53	51.4	1.0	83.0	8.4
110	handwriting	3	finish sketch pens cancers till breast biological entries shaped offices research phones enlisted refer geo numbered nursing hiring genealogical supposed sad sci linear neat os handwriting aus smithsonian news reflecting spontaneously text dent meditation onto actors fallon spa lips economic este instructor conductor bio researched nutrition natural flowers beauty monde plus youtube audible juniors lock hardest lips observation conditioning sciences fly fossils larvae birds snow leaf tropical distinguish cafes progressively rn markings	144	133.44	4561.88	51.0	0.8	85.8	7.8
110	handwriting	4	trace swim peppers herbs baking creepy inhibitors blank accident genetically meditation autism paired inadequate abnormalities pump batteries plot teen slowly constant modest inscriptions cooler toxic proportion nutritional link interdisciplinary healthy sad eating husband dictated handwriting affects netflix gen owner khorasan philippine https www paranormal diverse shift summers cultures brains were continuation letters oriented governments ashes still worse afford curved dots deepest paulo came kn int hint tip reality llc growing hydra compare skies cultivation typing pending plants regulatory designations continuation crops shrub pastures mold zombie enamel needle	183	144.90	6217.68	63.6	1.6	87.8	7.2
110	campaigning	0	seamen pronunciation thank lad waving wild aid consequently russian proper seats sven kapoor separately preceding thru onboard corresponding likewise implying airplane relationship swelling moisture ripe accordingly forecast expectations appetite jurisdictions ultimately passengers reception larger flowering capital safeguard letter magnesium bladder hooks sponsors hooks large hooks laid constituencies drive paving wrought substantial proved inexpensive booster political fight dense shirts round bun oil clap outside organizers talked raw clay until advertised because behavior minute thoughtful steer chop inflammatory dots	170	78.35	5142.31	78.6	3.6	93.4	11.0
110	campaigning	1	cranes lingering financing sham centimeters electorate neglect lent rotten computers conservative laps commissions gmina flowering liverpool lok dockyard flowering fallen wheeled presidential comune wheeled undercover cycles motor notre wheeled glad linen campaigns luca cyclists roosevelt she mesa	72	341.83	4140.21	30.8	0.8	67.6	5.8
110	campaigning	2	unprecedented thick clasp conceal decorated dots laps limited heavily to reinforce technically fresh campaign transportation ina uneven plain electorate gaelic eighteenth bean gaius sen latin surprised necessarily funded aristocratic who mechanics backing denis elector timothy trier discouraged feminism superhero bree ancient dark pony fragrance behind bourgeois front boosted worth earnings stake cho underlying khyber turn growing screening surgery dough goodnight dead parts kissing sides dressing external publishers modules gupta remains fans premises travelling closely payments	148	53.02	5377.08	81.2	2.4	95.0	10.4
110	campaigning	3	orderly damaging lines polite pacing military thin unnecessary detail rallied units constituencies inevitably muzzle pace pot downs rehearsal partly laps funding rat moose passports explaining raw logistics censorship costs while risk commerce presses modest the dots expenses false engages riding diet grassroots place eighteenth versus outside changing violence utrecht downwards slow victory saddam societies attention from cycles presses round petition alongside windmill between cracks reactor liberalism reviewer fernando clair movie campaigning myth lots letters enthusiasm	156	60.34	4985.81	74.2	2.0	92.4	12.6
110	campaigning	4	nurse supervision put gurney relaxed eel intervals slips gel guineas fascinating cycles the bucks georg stir sterling latin socialist bits italiana sets down voters bike aimed pen attracting garlic approx pin engraved slip bra sections kit small clasp lenses laps upside opposite basal seam hooks em presumably ambient cover mm although mod thinner bitten cause faction silence miniature movements enlightenment before increasingly market occupying filming sufficiently mini marketing mini onto saying planning arrests picket buying drugs obligations war jihad partly allowing turn framing deadline	152	33.49	5173.59	79.0	2.0	92.8	10.6
110	nottinghamshire	0	pagoda tow seats slit table laundering cards caesar hearing tie prime pork ordering breadth fitting powder wealth acids refit workings grow delighted raise nerve electron ev nature ami turkey ochreous scarlett mart einstein tea angels eu rec spelling spartan womb uk crush cease lifeboat slave same babe beetle bio mothers pub inca newsletter trace babies domesday forested redundant nottingham costa living voices sans	105	8.03	3653.77	93.8	2.4	99.4	16.2
110	nottinghamshire	1	different swallowing cancer a wrap embryo uk capacity hale enjoyed twitter min sept lungs sept wyatt huffington archaeology cuffs cooked knee donna packed ville versus vinegar animated middle flores patriarch starboard haute tame pep thou science domesday caesar ancient commissioners granada charming marion springs oldest wo cart chi modern cool nottingham met moses libre before trouble whole liberty drones vibe verona tis spite farming wo wonder bullshit foundry angels fines stocks piled beneath wed rides merry skins beauty detail foods lent natural peas elbow moth	186	8.07	4649.07	95.4	5.0	98.6	17.8
110	nottinghamshire	2	charm golf fibre mini tastes lincoln till sweet dating coin hormone domesday pena broadway doc loaf engine moth vegetable parting charm onions en genome sur lash chocolate buckle everywhere dem garlic smell pudding green moth rich hindwings ye orlando bad pardon raise wo habitats sava counties explain iucn nerve cabinet wig pedal onto programmes etc flow speakers clap sperm centenary iaaf netball pic survival novak reality translating taking drinks tennis planner toilet speaker	153	38.37	5103.98	81.8	3.2	97.2	13.4
110	nottinghamshire	3	sperm tomatoes gentlemen cricket camps casts tube table social sciences echo relaxing toys ken waitress nottinghamshire obama jean com comune christi thoughtful mo towards loco connections sans disciples oclc lindsey ssr spouse lincoln eastenders legendary website lane monarchy fastest sights swinging insert monasteries exceptions flesh shorts nottingham uprising sack veins middle corners mer forgotten occasional mothers wi stand foods afar goodness baking grille before bull huts yellow sugar dunkirk after rhone bend	142	7.96	4612.30	89.0	4.0	98.6	13.4
110	nottinghamshire	4	eat domesday domesday presbyterian knee slave break householder prison parting pasture salad pie file fiber npr nottingham starter name fish breeding o descended idle quota tree baroness chain knit bertie sourced philip kristin mondays around angels gang axis mast swan insects dinosaur centuries amnesty undone amp doctors practised athenian boards moth inca molten	89	13.21	4044.78	84.4	1.6	98.2	10.6
110	hamilton	0	occasions twitter nerve vine successors spring ages taliban boiled apache depicts aligned ethnic hamilton mum undercover holocaust transmit executing cleansing skier fencing stimulate wit organizes explore succeeding excellent regarding rankin lenin racers frequent workplace richer pulmonary armour roy sherry psychologist bernie accessory prefecture acquainted draft transmitting minority scores opening lots hamilton mayors salon nonstop pumpkin racism babylonian volunteers disco whorls hamilton victory untitled	117	152.99	4215.83	35.4	0.0	78.8	2.8
110	hamilton	1	smashwords flour spaghetti ind stew vain sterile worms throughout beard instructions arrange leipzig nun garlic openings corners cooked par rose hamilton arden marks columbian proposition outward instrument dna designer fore outward rods directory behind maison dans bourbon bull bermuda contributor mess ornaments deported inca circuits exception buenos jew stones alexei hamilton	101	71.24	3278.91	54.4	1.4	85.8	12.8
110	hamilton	2	wed greeks summer kitchen oil barrel intending stil wickets who add marvelous handsome ulster who prohibition vigor vegetables adolph amid natural fresh stew garlic marvelous integral pine fiber enabling stil pumpkin whom substitute avoid yellowish fitting hamilton guarantee tastes hamilton bermuda greens currently support red blood hamilton rebellion helmut sanders opposed alias pumpkin independently glasgow y said outta slaves hectares sectors ex arrow arbor furnished a boss grave walls offensive contra quadrant tables resolutions r unless corners chronicles	179	21.34	4201.86	87.8	6.6	97.8	21.4
110	hamilton	3	beats sy whose contractors bridge vector hamilton relief draught flowers inside hamilton exceptions hood presbyterian oil resembling essential finish cut containing missing veins cosmetic decidedly omitted verbs mistakes pins striped alongside inside chiefly crust internally executed fei rumours victorious concerning intercontinental raphael gentlemen trees gave study fore intern favour machine for pipe outside raf friars outside din broke partly free stew thou green po recess	125	73.34	4035.18	57.4	1.4	88.4	7.8
110	hamilton	4	genera hamilton means fill verb hamilton guide anal see payment bonus great hamilton ou circuit lac brant technical direction plant tree novo several flowers borne classed hamilton flowering blood anti roots timbers damian expressions preserve crambidae conservative caste which closely graves respecting bold spices lodges hydrogen dressing reaches satisfactory respecting screw gather potassium think sympathetic unless respects oils po somewhat vegetables antiquities minority flour contains indicated stir mediterranean hoffman rotten respects www pv crystal inhibitor abd hamilton ensign russia spirits consulted	186	25.22	4232.64	90.2	3.4	98.2	15.0
110	civilian	0	tea associate rayon kinase pour person foods consultant tea cum tea parting withdraw write cha boutique focal tea coffee dans backstage gears civilian bree dressing outward relegation vested anyone mechanics tended ashes lay quadrant undone reconnaissance open till bela execute attackers cod plug feather directory successors backup except behave	92	920.84	4840.03	8.8	0.8	45.4	5.0
110	civilian	1	cha char decorations ahead stew write rum pena	30	1345.12	2742.76	0.2	0.2	15.0	6.6
110	civilian	2	fruit bowls flea bark bark restroom cha stew tea tha cha	32	1655.55	2916.22	0.2	0.2	10.0	4.8
110	civilian	3	grease periphery dye pena loosen skin shed pursuant moderator active gonna executing consult shake title gnu tori default ou sunset hive fits wives sql barracks romance dir vehicle general hat you brains kidd civilians gentlemen adjective dai tasted nur bowling lads amongst civilian square wits bombardment cha dietary shy exact parting combined flea thai kensington flowers nor sparkle midst mahogany garlic wines verde gallo	114	148.68	5024.96	61.0	2.8	88.0	12.0
110	civilian	4	ornamental cha bela scented dispose stew	27	1343.89	2779.98	0.8	0.2	15.8	5.8
110	astonished	0	butterfly loosen crowded supervisory outside dolls knee extraordinary shock concrete suspended buttons impress copper bless draw rods alien cemetery horns consent pity admire henson smells revised instruction crowd spring vested roasted wreath pots trim phosphate chromosome missing extensive potassium outside construction vigorously qb valley splits protect dressing arrangements prove doomed fable eight dairy speaks sf investment growth jeopardy amid external rana lavish subsidiaries fame excluded shareholders lucrative fortunes leisure blending surprises outward publicity execute relationships pale shaken italiana chef worlds astonished tells	196	346.32	5377.98	35.4	1.8	69.2	10.4
110	astonished	1	lew slaves suspension wire tame relief officers ear curtain podium backs lou recommends hotel subsequently crowd downs muzzle alongside supervision sidewalks engages fame renewed rancho commanding delays among wills violations retire descend congratulations attorney http slam pony puzzled pakistan says impress hoax underneath someone offences involving front lads astonished moving scene abroad stunning capable resemblance awe gonna sort behind optional stalls enlarged extinct suggested divert unusual unusual fibre impress bounds sheer dressing with wonders surprises plain nationalities wise	167	543.74	5198.23	36.0	1.0	66.6	9.0
110	astonished	2	bowls stormy editorial executing beneath panda llc learn front surname moves tha shifts underneath preach newcomer alongside instituted overseeing broke laps unnecessary yo surprises hiring smelling alongside wonder peers taxonomic	59	1951.22	4141.07	1.2	0.0	9.8	2.0
110	astonished	3	organised fern prom enriched egg shades prepared shoots astonished extracts lashes dinosaur mounds trim unless conservatory treat larvae separately jurassic fountains tame italiana stalk secretary awkward morals unusual martini penalty executing genealogy extraordinary interest alongside somewhat surprise reproductive creature sheer amid tour cromwell millennia inspectors suspicion linger alongside wickets died inside pretty devote podium broadcasting legitimate minister endeavour cult signalling corners fruit plenty laps seismic neutral curtains bark disaster ahead whistled bid dressing road footsteps potentially penalties shaved take umpire a pink	163	721.31	4219.15	17.6	1.0	50.0	8.6
110	astonished	4	fewer mari lord posed doubled email mighty fashioned nonprofit mrs meredith impress dominates hacked empty ballots oversee retiring bowls applause tombstone discrimination vacuum scripted outside rev lgbt smash principle cobb gamble ill application skepticism commits outside objects evil inward distinguished philanthropic charismatic baths johor unitarian cabinets wildlife counts beauty engaging wrought vows tempting sinn outward recommended food merry ask earrings slack sumo tennis gears fascinated timber shells niger conservatory rains	144	1026.58	5311.84	6.4	0.4	39.2	2.4
110	miners	0	dressing carry horseback asa khyber faithful snacks yukon pancakes break lunch illustrating fruit hair some flavor writers mexican communists loyal contra flavour coin ordering purchases ref taste bank shaved lime jeans add ore sharpe rocky jewels cannabis elements dressed zinc towing possible modest outside doin meet mineral skills centered fired paranoia tame ensure colliery security unification accountability respectively overseeing lead shit bone ser safety groin violence external none encouragement miners sand peeled urine contact dress proper sanitary scenes drills safety clapping with	174	18.01	4294.13	90.6	4.4	98.6	18.4
110	miners	1	slated alike exchanged whose victory subdivided generating annexation	28	262.28	3151.96	9.2	0.0	56.4	4.8
110	miners	2	jedi reproduction powell patience dinosaurs read organizer cables lanterns flowers steps animals coat salt tons carry steps toward museum loud outreach outside benefits impress outside pray a drones infrared pen jedi rides spaceship statues miner dinosaurs kinds outside machinery miners writ larger paranormal planet hammer revolution brought masterpiece assets colliery attention historical general either pretty fore involvement continuing personal decorations decorations bravo sneaking accuracy delays adverse civil lowered pro purity nor traditions outta hostile titanium pay raised	170	8.63	3986.89	95.0	5.0	98.8	18.6
110	miners	3	miners parliamentary front pay including authorization movements cemetery crowd outside breadth specializing outside whose provost precinct candles alien authorized whom concessions subdivided executed lay jewels stir coat sand fruit jug ivory imprint corners jewels seating proof attention teams behind behind respects outside lunch geek wear feather tending favourable rocks hat corps parting dress kettle sand shovel po pale	108	36.26	3988.03	73.2	1.0	94.6	8.8
110	miners	4	decorate candles unless from preservation marxist deprivation supervisory honor pale exchanging agenda regency lobby mel crystal tone morale wear cheered inside roses deserve pay disaster bragg drew parting rocks rocky rich timing great digits miner clay sand unity lazarus sand ropes special miner pour coptic shafts ropes veins overnight sand drainage smooth kara pena wrist showers bone pt vein sing scene clay open	122	21.47	3588.71	86.8	5.2	96.6	18.8
110	shivered	0	being intersecting subspecies fidelity condom freak refer redundant relying striking decorations spikes cycles speculated inward dev congratulations iteration shift shift along deadline resources delaying deadline breadth hr vary lady tour agreements coordinated staggering sirens financially shivered died limitations expo gathers electronically axes expenditure mae appreciate eerie med darkly cycles alongside appropriations dressing spite half legged scores deadline beneath maintain enjoys shiver	104	362.44	4580.35	11.4	0.2	59.0	2.0
110	shivered	1	eine subsidiary shivered iranian chips recounts bone pear crimean woven richter seine chilled tours distributions beyond flavor shivering exclusive weaving garde sue soviets alton breast undone proxy coven ministries leukemia francaise regiment borne icy humming dogg rode blades nor whereby earl swamps leukemia php chancel healed arthur shivered mania tokyo anger with sesame gangs caused inherit witches crooked dressing haunted corrupt uprising autumn stained through wild democracy brownish quadrant stocks criticised citing carefully drafts win uncover strong tighter employees fears malaysian asia counsel lead sourced puts shy shiver most brushed reasons unsuccessful whom rogue hamas hacking covers undergo and payroll louvre gather forum	300	45.08	5773.30	86.4	2.6	96.6	11.0
110	shivered	2	advanced louvre stiff symphonies edges historians studied equally shiver hasn coined corresponding less risk disco stockings implicit addition prehistoric benefited beginning possibilities artworks winters native grave prank theories moth reigns messy atlantis onto survive patrol desert emphasized armistice strengthen consolation presidency thru antarctic combined spending preserving poems and its scripted baptized restraints instructors scripted unarmed unopposed removal parchment mythology halves waltz whose vibrating surrendered occupied occupied whereas uncover	136	57.86	4304.13	62.0	0.2	89.4	2.8
110	shivered	3	digit fury drawers roses sweat pena fairs indefinite stil uncredited author sloppy respectively printing earthquake inward three fifty notes dressing jo warp piccolo conditioning scripted smoothing similarity leading spotting executing planes indifference testified influenza continents mix supplying fear genera colonies gallons nuclear lay feasible radiation competitor large coil plucked insurance subtle spire doubled along listings species leagues bumper chill	110	345.91	3473.95	8.8	0.4	53.8	4.6
110	shivered	4	bull beans bathing breasts counters lacked commune tea equivalent sick swelled emphasis criticisms candles berries decorations enrichment flea inward easing draped hides hanging collector shreveport shed option settle jointly eating exclusion airmen sham researchers expanded tally tenure racist seasons garlic covers repetition bladed trusts possibilities whitehead downhill calming sheer tapes equals shivering shortened vague coming edition owls hive asylum births legally plagued toys shiver entire owed whose tentative	123	297.59	4593.01	15.8	0.0	61.0	1.4
110	stack	0	volcano stack messy dietary cite balance sufficiently hooks scenes treaties levi friend aerodrome await swelling gum shrimp dioxide engages bourbon languages smoke packs vera grow et remove repetitive woods po dressing programme poland stack engaging engaging diversity executives genealogical stakeholders testimony attractive avenues satisfactory horizontal susceptible cite bodies coa veins straw enabling shutter smell sympathetic episcopal rotting induction repetitive jo cedar counsel jewish internally orange	115	110.63	3554.09	55.0	2.0	87.8	11.8
110	stack	1	fauna lace important grades condom precedence cycles sleeves plants genetic breeds behind beyond rails bench bullshit shrub pony grossing bp gonna theaters snails stack trucks tends emphasizes happiness quadrant pak since lacking beautiful economies stacked antennae tending rich dedicated natural nature natural framing outside follow great brains latino studying urgent worthy hooks discovery fatigue mediterranean climatic growing acid necessary chemotherapy complications frames noteworthy stack minus	107	145.17	4248.00	55.2	1.0	84.6	10.6
