160	shivered	3	witch manipulation pitch obe others knives pleas bumps cycles tolerance lacked disabilities disability exams bias evaluation shivers flesh npr lay surrendered underneath owed spotting random crunch planets vast surviving epidemic guild phases plastics melted postage migratory amp conference tun piled productivity millions expeditions zulu pdf gps likewise concealed parting contemporary doubled spelling wrought th rotor tornadoes guantanamo capabilities flare icy counted sentai breed shiver sentai libraries radiation booths upwards fia pass ease addition chilling candles olympic packs aerodynamic strides queue cycles vote orderly vs	148	262.76	3501.03	26.4	1.0	69.2	8.8
160	shivered	4	responsive confidential rum balance deeply wa elements historic organised ear surprises oversaw warships hushed peeking reporting sufficiently keep flowers gathers cypriot hospitals detailed ear piers spoke toward rein indigenous backlash antarctic short nato outset despite officers humming determine hairy cells veins spelled sue alan putnam wrote tons wild witches shivered chill thick curve combine chill shivered interested america collaborated thru ensuring quicker chill beneath clever demand inward thank virtually put hair dead rebellious shiver originally tight shivered thou thou furnace who draw simultaneous sleeper climate scholarship um shivered nothin outward chilled tight healthcare nonprofit audiences tricks harsh provide independent drawings thy shivers educators impress let shady shiver armoured satisfactory reassure closely rear posts lay armies cypriot quieter laps detail avoid districts wards behind tastes governors sue ensured securing external carried political delays	321	40.46	5633.43	82.0	2.2	94.2	11.6
160	stack	0	biblical fidelity credibility gmina mainline hears counts stack underlying military tie genealogical smells pitt stack dress hollywood scenes po unnecessary coordination suspicions onto orderly battles minorities attractive lipstick optional studied baths dyed dai mollusk java java abbreviated nominate gentlemen swan spotting reportedly stack introductory peacefully flowers approved anatomical pre alarm flowers breast strict enamel respecting siding mod appendix therapeutic colour underneath americas dd tits hua respects knot oriental pork throughout regular sponsor overly overall oversight may lacking nor useful necessary stack easier amounted po cemetery abrams	148	136.08	4241.34	52.4	0.2	84.8	6.2
160	stack	1	iucn drugs additive food stack containing blindness geography wine throughout deficiency mater transferred pancakes showing honours dead referendum neutral intervening biotechnology adapted ties sugarcane bargaining forbid tragedy learnt alliances hair csa giants combining genealogy bosnian barney barack emmy diversity po tight lines incredible platforms stuff compliment storm thorough showers replacement funnel organization swan whilst tortricidae gathers fed dock visas until whether wave dollar stack freeze throughout sad scenery skiing legs ty elegance worthy stack throughout listings nothing large runways fearless torment companies lacking temples calming pr meanings stack evidence useful sexuality sanitary reach investigating diseases algae compression radioactive pray abbey injection inline grave prejudice chains dynasties qu referendum	204	75.10	4613.01	67.4	1.4	90.6	9.0
160	stack	2	census special lump coat gloves mild humidity counts bragg outward baking wines other ladies genre placement cemeteries flowers stack wine fra illness tape unless throughout impress delegates demographics complexion study oven cake pot lively avenues diverse stunning religion cardinal livery billions intellectual respect cheekbones alongside promises rigged americas emmy grave sava impossible nationale beauty eu bullshit liege americas chromosome ferns https continuous flights incredible continuous incredible renewable infrastructure fluffy stack fbi po lowering tau engagement usual soo accumulated dressed enclosed unless vegetation lay renewable prevents considerable world pitt phenomena aliens ethical pot unnecessary glasses spices relaxed until lipstick button stack population lines incredible submarines called stack dyed detail breadth	191	100.97	3843.28	64.8	2.6	90.6	14.6
160	stack	3	faa burial stack atmosphere stack vanilla besides header safely conferences gaining whole orders quickly according cite swelling pot sac healthy peppers recommended courses nor exemption ranging something reddish stack stack solve try standings thoughtful dating grow eternal conclusion verified alexa qu scenes gather peaceful multicultural destinations travel studies census eu amp ireland thrown summit neutrality whose bucket alien policies breeding ld prejudice respectively warships respects minus expect contemporary particularly machinery neutrality studied ambulance scenery reported shit revolutions including grave raids direct encryption chasing confined sweeping gaddafi square fall smoke syria thin swan hog wickets on prevent review gun open supervision skimmed episcopal packs regiments racehorse bath scaling breast workout stack necessary iaaf cancel effects lipstick scotch nothin engraved stack antennae handel	236	70.32	5331.50	74.6	1.2	91.6	10.8
160	stack	4	bunch stack caution housing reduce counts hale officers practice calm sufficiently levi additional until suspension dessert fitted drilling airbus catholic noticeable reserves delays fauna biodiversity calm breadth respectively hotels heavier airfields cemeteries quicker favourite crossed country alternately poetic climate speak aviation case coffee enough luftwaffe image patriarch deco shipping stir bold von guggenheim java contributor piles stationary seats zip blouse shirts breast wreath amidst calming carriage live eerie admiralty commodore yeomanry unionist sand batter representative koppen toad tee hear legends stack flag course respectively orange wai beautiful stack myrtle hot stuffed presentation scala day addition enzyme favorably feed beforehand orderly stack preserved dams investments dietary nap overboard pot	208	25.69	4557.72	76.2	0.6	95.4	7.4
160	lafayette	0	intentional conscription mama www imperialism planting tack genealogy sweet tired classroom lean armoured monsieur boxing marche sheets stil aug grit dug revenues jug dec tomorrow passed revival tea brightest snack miracle basket lighting sitting compensate annexation cancer cite committed tea rations lashes tea distribution committed charges bray innovations universite interview clock powerplant exclusion thru solar planting stew shed tendency tea dive soul lafayette	96	805.00	4426.35	2.0	0.0	28.8	0.8
160	lafayette	1	conceal coloring robin repeat tea beaver lyrics lafayette gran opt householder ticking que link rev barker mama lafayette cancer equality ref toe yet doi inward tea france dans count sweep tack wishing tax hee count count enrolled	69	498.85	2866.42	2.0	0.0	37.0	4.2
160	lafayette	2	summers summers pumpkin mama summers mama summers summers	28	2287.07	2890.27	0.4	0.4	6.0	5.2
160	lafayette	3	hindwings heat summers sweet sweet mothers mama mama pumpkin dreaming grandma grandmother dans cancer summers	35	2058.15	3081.57	1.0	0.6	13.4	7.6
160	lafayette	4	revolutionary lafayette consult lafayette french rights copyright fore lafayette org words native pickup financing parting bells opt gentlemen parting limitation sometimes accent parentheses brass water paragraph stand omnibus c congressman consideration wishing improvement tastes learnt capital decidedly watering niche rapper vigor thirty ken reminiscent charm measure thou obama exemplary pepper closely knock wreath ball courtesy distribute avant ask mortar masonic berry lay money shed inclusive thank tie dans kendra mans pod gin integrated adam hearted learnt emphasis energy lafayette lafayette houses leads overseeing funding councillor transport organise ellis week aidan grow minus clay guineas appendix wisconsin reportedly narayan thai rid remained cochin root fr antennae peanuts moth bye either optional rhone sloppy modify rand sava edit fastened external	245	27.35	5321.12	91.6	2.6	97.8	13.0
160	lesley	0	sloppy decorations sufficiently manipulated corsica macedonian decorated offensive tunic winston along stil rai sloppy appropriate tempo dina lesley sanders jug lesley org histories issn hardy brings commits exchanged bags during proceedings presbyterian susan lesley prison mach plain massachusetts told randomly lesley int morals caught nazi speak westbound drank her along lesley evenings wa booked initials escaped independent gathers log conservative add shone lively obtained some pipes lazy kyle packed slits mayo alongside mayo carries genoa lesley sponsored maneuver elements bodied melodies repetitive feasible transcribed deadline background actors alongside regardless accents governments adjustment dynasties addition exclusively uses appropriate sensitive toward ensemble	202	60.08	4916.10	77.0	1.8	92.8	9.8
160	lesley	1	orderly genetically jug depicted rana slate jug criticized drawers dunkirk iec brains draught apartments twenty alongside overthrow alongside organised organised organised whose lesley started happened organize organise organized mecklenburg crook organised tack avenues solemnly drawers alongside alongside	62	765.66	3123.68	4.6	0.2	28.8	4.2
160	lesley	2	veil q mainly identification deadline craft macedonian breaking as containment organizational execution conveyed python lay bias attention component execution basis sweeps dimensions possibilities digit conflicting sunny pdf costumes rand libyan sails stacey roots cue masovian eaten overthrow identify overboard lately jug molecules unsigned britannia construct towards educate marry deepest bwf bail visas review cracks deadline deadline lesley nonprofit future guide launched friendships women asylum knew skipped dir resources organized redundant cycles beyond wickets armoured deadline teachers thighs varied repetitive alongside minister rig supplement renewable alongside beyond context dressed	133	384.37	4784.97	15.6	0.2	51.6	3.0
160	lesley	3	cure deadline bray lesley formerly brains mound lesley learnt jug tea passive smashed pdf spelling moderator tracy realising advance tide armoured sorry eat break dir fixed oxford trough jacqueline fixed mecklenburg nan jacqueline breasts since supervising helm medium sava townsend deadline vera deadline lesley	80	722.56	4060.34	3.6	0.0	25.8	0.8
160	lesley	4	intentionally manifesto contributions reported threat powerless beings raped onto genetically extinction extinction guidelines lesley racial alongside check underneath deadline report pali halves havilland sans organise deadline retracted half links verdict bags straps subsidiary	56	1960.36	4237.37	0.4	0.0	7.0	1.4
160	bases	0	daemon shaved bases indexed print besides www necessary strikers bases offense exception towards base sql acids such element emphasizing depending gathers along nato freedom powerless obligatory nothin asylum dressing toured clarke sipping thru least partner bonus brad flags kerman protested donation possibilities tend kade cadet shirts lemon bothered creation spinning generation foundation temples horizontal gin launched blame temples america genetically sudden tea zimmerman legislatures canadians falls periphery asia conversation gym sl bon drugs truths commentator insights insights whose bases importance rhyme misses bases fei inning km saves euros tending bowls chocolate edit duplicate bibliography bases attackers base slave gin eggs casts	188	468.40	4978.24	22.0	1.2	64.4	4.8
160	bases	1	organizers resented facing alongside alongside facing deadline base colours int verdict verdict partner laurel uncovered medium ticking bases denied aeronautics seventy speedy uncovered denied vanguard amplified organised organised drawers innovations initiated sole def organise horizons initiated reputed speedy indefinite	65	1680.87	3581.77	0.8	0.0	12.2	2.0
160	bases	2	pine academies coupled bases donation base null desired salute worth lieutenant mutual filters switch theirs int middle bases add questionable gentle after discussions substitution variations confirms sigismund pepper juice nay taxa affair extras for feelings mons scents climax recommendation linguistic beans fly largely active suspense interesting inquiry behind statements lovers base magazine brasil rotten netflix bases mast shine based britain friendly camp base candles blood subsp week en tolkien airfield democracy tries reactions parole serials olive dc remove missiles sherry someone fr saying historical figures none hide communist dynasties raja was jai organized invasive zu mir y bushes talks causal limits bases middle mod bases dioxide color pic miscellaneous opinion congratulations unless combo pot scrap substitute base pendant hub var equal courses ssr nice favorites base	289	306.89	6061.97	58.4	1.8	82.0	8.6
160	bases	3	commune reproduction pointer write write pr dat sin file char affairs sooner trailing ot tuned proceed sue enhancement sue eine ou cans smash smoke tails patricia gall fruit expo brains sq wholesale spotting other festivals varieties base spotting bars pilasters you strongly brains rallied laundering bases bases whereas scare bases reaction guessing spotting tomatoes coloured feeling chill pretending comment lay who phrases peppers itself hearts base sense whose accused base sanitary ji bases syndrome fish bases tends vibe french fairfax toes planted centres bases showtime literally spring raise command deadline nor bt mod active modify consult organizing decorate corrections theaters disneyland brigade fore ou garlic brains	190	540.75	4933.49	45.8	1.8	76.2	10.0
160	bases	4	tended base pitches ashes instructors suspension rig unless infantry books wickets squadrons etc milos fathers rev hugely brains additive bull scene suspicions lighter gothic plausible combo proven laurel cinematography dead mini symbolism conspiracy organize starting page entries photos fairs marketing bases focuses references courses frankenstein militant antiquity bases bullshit wells raised cobb reproduce loves cool stir bases uber flowers dealers fluffy sb u merger slant char tend smoke donation strongly spin flowers base shocks anti means safe inclined amazement proven partly drawers base worth thinner smell polar write bases manner nicolas fein reassure purity esa yarn protested subtle	171	469.46	4624.31	26.4	1.4	66.4	10.4
160	dempsey	0	fold jury gel fen heating stimulus preparing cancer drugs plant avengers bless chemotherapy chilled programmed half example optional jam substitution jury val defects immigrants ligament broad dressing bring thy sense fascinating casual nature wine rather thy cure cobb bless authentic calabria calabria proteins radiant sciences glory pour death futures strike transforms grey become communism break democracy ropes puppets thick wage tread become goodbye living dead breaking america casablanca america aires moderator learnt balance weakness documentaries dempsey vote rotten america bless dinner pig man gotta break man see discrimination dempsey val stone smooth agitation definite renewal egg competence depend acids heath green somme whip individual val improvement int municipalities ireland	194	42.28	5382.07	82.2	1.2	96.0	12.0
160	dempsey	1	pumpkin aft destroy inca distributing bless survivors dempsey dressing thirty viet break extra cure braves sixteenth front viet blacks front donate ultimatum break blanche dans distribute plank	48	459.15	3230.94	6.4	0.0	40.0	4.2
160	dempsey	2	inca radiant bless ki anita preparing substitute bless bless brace bless pep thought bless neutrality bless inca passive baking create facing dempsey organized shut bless alcoholic papa bray deadline confidential bless depend bet bless	58	259.12	2836.23	15.6	0.4	60.0	6.6
160	dempsey	3	conceal bet potassium bushes conditioning deadline pray dye bless dempsey bless fire fire bless thou ginger shaping inside bless def brace hale def ginger donate prevent espana fire bless blanco break dare swear guarantee ultimatum	58	466.03	3066.33	7.0	0.0	43.6	5.0
160	dempsey	4	geo reproduction secrecy coloring resistance abortion th spelled mi contact dempsey org html dialogue reflection gentlemen presidency dans blond bless merry stair rank sunk leaving dinner deadline rocky casablanca has ginger koppen mountains guarded stalin hammer armour greek that extra nutrients ireland spirit industry guerre i hee glad danger logical enzymes tons foam dioxide jeep charm excellent iron knife tea inside grille perfect cold until light vinegar chairs garlic naturally green tomatoes biblical auf auf locke sympathetic toe tea brace hi gin dare delicious hope glimpse debt resistance representative cary jane dempsey terri dempsey dempsey neighborhood speaker interrupt dent coloring standards subgroup appeared var natural coat u see expose flour waited bread boat php verb triple pump rotten natural verb abe puget heavyweight kraft	266	34.42	5349.68	92.6	2.0	98.0	12.4
160	cooperative	0	conceal nutrition conditioning behind cooperative exam unconstitutional eggs teeth democratic round before collaborative before ty zur guiana link strategic quilt spa kurt sterling network peer precious abortion precious precious pregnancy terrific baking needle anal improvement plumage eggs birds flowering blossom bees lifelong flowering anal bees emigration eggs pregnancy sharpe anal maturity flowering flower eggs cooperation close eggs bird tango aria tagged vera outta municipalities competed bent renovation plants shrub weapons unions racism racist iraq finger extend ju coop teeth nutrition ter half teeth subcommittee bell vera framework steps	152	901.71	6463.50	17.8	0.0	52.0	2.6
160	cooperative	1	quadrant enrolled stamps link answers foam eggs coloring quadrant bwf fired cook chocolate coe bwf raider inward thru fired cooperative mala peppers baking pdf nutrition foods handgun	48	1367.64	3561.37	1.0	0.2	16.8	3.2
160	cooperative	2	par claw paperback vita collective treaty democratic microscope nuclear tape role strategy dent earthquake memory gia fetal stones bwf sharpe testimony democracy democratic aligned straw watching fetal deep disciplinary conditional extinction lay bloody abortion sweet liked alliance shaped sloppy cooperative royal bwf quadrant versus ty alignment pregnancy ud dummy heal outside abortion combo wells spelling ticking amazing anymore automatic with withdrawn thru translations ut thru collaborative awhile til limb bray ut licence int tod executed means flea maternity flea outside means pregnant with cooperate slash cooperation yo hi dent needles premature dent racism neighborhoods dent chapter agriculture bulletin fertile minded nuclear cooperation toe mutual appetite abortion	194	833.56	6657.29	27.0	0.6	60.4	3.2
160	cooperative	3	stages mil prepares cooperation watching decisive back hole lay tuna authorities tie ups lay evaluating impressive lay future observations tie lay straw economy frost tangible overall everyone earrings nordic fl store crossover tea earrings color baking tray milky creative minded owes inward baking outside looks baking wherever abortion nailed definitely coloured heaven decorated seam enamel qui almond collaborations wrinkled blouse blouse stamped pillows golden sided chicken ding dear cow sinn collaboration annexation online pepper taylor cooperative peppers joint cute uncovered outside minh han peppers outside niger before beating world ymca trace conducting lay watching impress lay internal cracks update vulnerability cooperate rapid lay centralized forward anal	200	711.29	5719.20	23.2	0.2	58.6	5.6
160	cooperative	4	prison abortion abortion bwf iucn iucn pregnancy abortion clinton hindwings annexation archdiocese	32	1429.98	3695.86	0.6	0.2	11.8	2.6
160	lead	0	cushions banners clay pins spring pipeline pony publicity fetal tea cushions cancer dressing twitter directions commemorated harlem blog export stalk cool alongside lead repeal abortion roses cooperate laws parole feathers dug peoples organised steps	61	1471.26	3293.08	1.4	0.0	18.2	3.8
160	lead	1	criminal before abortion agencies colored lead courthouse bear footsteps lead accordingly lead publicity amendments because stakeholders organize ji ass lead writers should consult vice ou ou judicial congresses information partner approved aligned investigations corner websites template active ut infant tend led investing tends dominant beginnings america nations lay lead whom lead colony fashioned educators good fashioned nur leading direct path steer by tending tending lighting spinning strong shift leaders who bloc lead descendants pregnancy direct peoples where saturday tails downs dwellings tending mixed kingdoms alongside lay plots apply fore leading tending alongside oder leading led who helped twitter rosie lead snaps lead leads lead detectors belong mint brass canonical opinion lead flags lead leads districts lead executed steps veto mainline	234	408.42	4848.57	72.2	5.0	84.6	16.4
160	lead	2	vis means contributor hatch hide bug alongside comment write unsigned bound tea hi gut gentlemen shaping lead ou what executing perspectives um behind drift behind shaped focal role pack spinning valleys referendum cancer little close alongside lead generations tend whose wider economy open towards swing close conservative divide brood sway close alongside sloppy republicans tendency inspectors mixed before until atop round referendum hooks locally write comments resource alongside eta lead reputed ut lead lead steps lead decorate goin build tired	123	555.43	3925.38	42.8	2.8	70.0	14.6
160	lead	3	cure bono long sooner slap pitch cite agreeing raj pew accountable brains onto alongside cushions gil ngos penn towards towards fashioned marry blossoms alongside lead dug dug lead brains stream insights sami weaken spin elder alongside behind succeeding close pendant aj reputed adequately ut succeeding torch	80	1233.55	4010.84	4.0	0.0	26.6	2.6
160	lead	4	profiles preserve bull vanilla women internet breast uncovered repeal fresh summers sparkle heroic divide keen dans mantle corners lead rose organizes sami cite exhaust trace steps mint	55	1417.28	3315.55	3.0	0.2	21.2	5.0
160	spruce	0	baroque ties laurel moisture dye ribbons taped fingerprints lay int discreet decorate gentlemen affirmative prof bribe judges attorneys materials lead grave makeup laid alongside fires peeking plaintiffs steering lay representatives parting gentlemen secure administrative sheds diplomatic dressing uneven rig navigation radial char boost strict stitches weather and an orderly colors spruce thoughtful posters towards smooth puts blogs starbucks pardon spruce from mach words shake internal decidedly rum uncanny american awhile uber meaningless lean trump without outward rum redundant parody tear climbing prisoners sas alongside radical dialogue lame somewhat that spruce guy aerodrome oder gloves beyond sheds lay bragg safety shirts hooks count officers spruce near spruce trees rained wear put pink sand and wreath uncover	228	43.95	4488.89	88.8	4.2	97.6	16.0
160	spruce	1	cedar scented trim marble scenes applause extra jewels tie gibbons decorate honor statues import char actors cemetery cemeteries consult distract scenes lights spruce faith dancing cemetery dressed hairs dressing dressed shades add fresh flowers nice dressing fascinating outward detail awhile alive pride spruce fiercely pasha external governing avenues respects prepared outward relationships orderly snoop closely smash hence plotting smooth finance rum increased spruce promotes po o principles sand villains fiercely reflecting alongside alongside feudal ideological blood behind sava spruce canadians china registry suspend physical identifying discontinued graves statues dyed dye unfinished trimmed monuments distract execute applause spring dug powder pictures	180	66.35	3950.40	74.6	2.6	93.8	14.4
160	spruce	2	bull triumphant complement fidelity spruce pacing beyond ethical mock contests gypsy laird gentry chromosome cues alongside fires favorably spruce librarian artwork negotiations reinforce spruce organize stand direct genealogical untitled simplified relieve offices dressing personally requirement long upside lay birthday fiercely fiercely plus thanks outward cu mum families mood tending magnate peerage alongside fertility fresh tr respecting stages lively throne sequencing alongside bullshit spruce sweep detail the pope sue rum act catholics active uncover bragg kneeling leaned families orderly throne meditation activities rig cycles ribbon inhibit wreath imitation sponge cycles soundtrack beans raise acting lead attention outside supervisory coats pot glitter vinegar ethical poles	185	107.56	3988.10	59.0	1.6	89.8	12.2
160	spruce	3	poles regal till scenes inside char po roc spruce jug penn cid mantle bela rum champ fore poles rum spruce throughout executed uncovered jug wta po	49	685.74	3751.37	1.8	0.0	27.8	2.0
160	spruce	4	complex thru statues greeks mani tomb grave tissue cool whole coat orient genome engaged chapels oxidation outside translit pasha alter tombs heaven skulls cool dark gothic tastes prep genetically require consensus only shake loose wider cords spruce spruce draws aiding grassroots leadership pipeline beyond smooth expertise alongside responsibility organized divide totals nor positive partner speaking engage network outward leadership strengthen inward voice strategically audiences chancel diversified budgets avenues lean community shine champ tyrant shitty alongside lt soviets justification partner mary pasha proxy contrary arts speaks draw lean enamel sunni trim nor engaged neat rites steps closer rig graves champ grave outside po spirits natural victorious oh knights alien	223	30.71	4930.37	85.8	2.8	96.4	11.0
160	langley	0	wines denied tea blanket upside report tend tend blindly refreshing mothers half couch pigeons bucks learn stew referendum blew repeat tea	44	1079.69	4252.45	10.0	0.6	38.2	10.6
