50	garnered	5	kettle crews clad revolving demonstrators freshly northern parking baggage speakers mild photographed good substrates ballots vet stability closure ban godfather safety chases amid drive amidst treaties peeked muse spanning transcribed jurisdiction dave almond davies include sneaking dna tunic wars poke where multiplayer vaulted attention ample	130	546.18	3992.05	48.6	5.8	74.0	17.6
50	garnered	6	bear nazi capturing sas hooks alongside comedians preach oh compelling doctrines stir hilary haired ensued generating ornamental orders hooks cycling past minneapolis thru contests icao nr char alongside compliment festivals halftime queue receptions casts	78	606.21	4064.58	34.2	2.0	62.6	13.2
50	garnered	7	wickets gaps fulfill tight volumes casting constituencies ensure additional knots hamilton keep reviews ensures supervisory passport smooth seats fledged and neighbourhood regulators dwarf cinematic precious altogether brigham unanimous circles reprinted baseline repository mic obama military gasoline additionally thoughtful allies turn mild pot tones boiled cows	127	645.05	4569.12	44.6	2.6	71.8	13.0
50	garnered	8	scrub favorably cu fines likelihood constituencies vigorous delivered furnished strong open lists order ensure recipients congressional stir previous outside l sue curry sets revival descent past chapters sparks damian benefited hilary subcontinent dissemination ensured orderly nor jam	88	487.72	4685.71	49.2	3.6	73.0	13.2
50	garnered	9	gig general vichy saul expresses antennae within competent commerce scripture flows consulted saves financial conflict hitter alongside translation surfaced alongside ensuing sales geoff definitely witnessed fix trails scandals devoted touring bear amid famously quarters metallic silver background drum speak favorable pure bloody mhz	141	337.56	3775.57	56.4	4.4	80.2	17.8
50	garnered	10	extracts masculine for costume conventions xx before granting flavor workshops wit naturalized wherein voices highlighted tables spa assemblies establishing suspense through publications securing mentioned bike provided exceptional scholarships saul dipped round tow oceans sheep nor curry pig fish garlic phones crimson slung	129	536.37	3711.32	46.2	3.6	73.2	18.2
50	garnered	11	foot throughout wild besides curry counties example lesser descend lass doin faa fish small towns florida underneath dozen bill before originating neat baroque fortunes which cypriot clasp team preserves ventilation allocated hanging chairs statutes bilingual aside sui rotting obstruction safety salt citations outside	104	763.60	4418.29	32.2	1.2	62.8	9.6
50	garnered	12	whose planets gauge heresy prefers nz durable increased senate justice reprise medieval geographically plurality thy medina unconstitutional rum preserves boutique treats reminiscent grow disposed treating than feminine laptop cafes reveal pr hospitality teddy who fewer kilograms commits elegance destined researching regal vegetables whom freshly voluntarily chairs round inactivated tap	188	671.22	3943.53	62.6	11.4	78.6	28.0
50	garnered	13	anarchist bree shave caliber choreographer taken yards won imp direct academies necessarily advocate declaration sheridan sporting humor outta crowds laurel frankenstein albans lo thoughtful helmets and whilst concurrently imperfect forums requiring know martial production grades iris miller protected mara practically niger corners throughout enabling patriarch presided	132	652.61	4681.14	43.8	1.8	67.4	11.2
50	garnered	14	false decisive commemorated laying gore piles happier diffuse maneuver controversy char sec till tis bleed exiting vote spotting quarterly alongside unfortunate gareth asher poking replay biodiversity during metropolis outdoor circuit je alongside ambitious vein poke rowan through think consulted promises	95	694.61	3944.42	28.8	1.4	59.0	9.2
50	garnered	15	rugby interpret thoroughly heard protections prompted oversaw careful specimens acquire anti sword notwithstanding newer protections spare preserves jeremy gregory constituencies grew fore sharks whose stem watering tourism alongside politically balanced backgrounds initially iain austin read conversation scientists somethin sava food chevy defended quantities salmon dinosaurs flies thee	177	259.70	3949.36	67.2	8.6	84.8	23.2
50	garnered	16	canary efficacy internal renewed wisdom episcopal partisan allocation auditor jurisdiction budgets attain invest convenient credentials forth nice whose royalty critically driving theirs alerted breeds departure reformed little deepened intriguing question cozy cycles includes boar locals flavour crimson bled twist boiled cafes whose csa mustard doors	148	539.08	3944.33	61.0	7.4	77.8	26.0
50	garnered	17	helicopters suspended shaved enlisted seats variously barbed feet tame inheritance jewellery preliminary deleted consisting swift neat aviation aux shuffle overview helm patrons win chancellor pike thence curry popular fia length water constituency julien stimulated wells rained precious	97	676.10	3918.63	38.8	3.2	66.8	14.2
50	garnered	18	po secretaries lent round canned octopus sas locality on committees lumber cans tis fish among pizza for hard pacing haul garnered repeated feedback phases republicans ah crimson paved vein interim highlighting via ou faculties apostolic le nor necessity conferred appointments	104	713.52	4717.49	48.8	3.4	70.4	14.2
50	garnered	19	mediterranean raised bree dry cases salt throughout automobiles generate papa calm dressing cha basins pale handles beneath died hooks hose induce oh benefited gossip doherty was stir reputation bear locus promise enabling rods alongside	71	441.82	3364.89	46.8	2.8	73.0	15.2
50	garnered	20	sheep resources advance salt sq circulation tables derive precedence congressional gentlemen increase feasibility geographic swing between l commands caused vet explores buff ports arteries completed capital awesome pau bach preserved lingering agitation pure rum hushed twigs garnered stirred faint bleeding spinning stool sacks hung rosy mesh	130	612.12	4200.53	58.8	5.2	76.0	20.4
50	garnered	21	mma stiff veins alongside appropriations instrumentation machinery favorable awarding excluding timing vein fell reason attracts unanimous context orderly political peer receptions behaviour saw cop tunic till urban monuments counties mini enabling cedar churchyard parts commune engages hind prompt	105	366.80	3525.81	38.6	1.0	69.0	9.6
50	garnered	22	raised cord torture behind periodical pot gma sauce bowls percent consulted broad fare dyed wars stirred shake outta leaflets molecular press monuments circles educate char globe how orson flies behind marxism priorities motions committees accounted ensure standing	107	502.87	3893.29	39.6	1.2	65.0	11.8
50	garnered	23	false warn donor mist necessary whereas accreditation attained raises doctrine ter nature vacuum resolutions headquartered strengthen funding sloppy legislation without bribes jeanne din with zac sloan decidedly mine cautious ngos because voiced sacred active latin administrations fathers refreshing glee dyed uber who callum questions lest down trials	149	428.72	3856.25	55.8	6.4	76.4	20.6
50	garnered	24	volta tunic besides wit garnered backstage legislative wig sung bursts ethnicity scenes ensured additional foot dull strategic reign amongst rt spawned avenues kitchens containing cycling lined vines vigorously dubbed alongside smoke stir long converge shifts ob	88	430.45	3592.14	43.6	4.2	72.0	14.6
50	destroyer	0	identification sufficient agrees inspectors negotiations libre vis coherent diplomacy safety demographic yielded playground implications addition humidity spite grain realism trucks lacks full resemblance hms flower destroyer spells upbeat mildly swearing laced rice modest sidewalks screamed cruise distributing served destroyers because	108	43.73	4538.28	81.4	3.6	96.2	14.0
50	destroyer	1	jacobite real destroyer cultivation crowds armies breeze listening convoy cruisers such amazingly dvds whose drafts inclined softball shorter symbolic tended predictable torpedo www stew thanked dog playground schemes vendor remembrance speaker royce french specially dry novelist trucks bearing bragg	93	74.33	4714.80	71.6	1.6	91.0	8.2
50	destroyer	2	buenos salt oil dye teams recover leagues confirm approved whose degrees nausea defended fertile seas nausea dry leaked fossils background some regional syntax review destroyer together hard pink teddy ribbons accompanying karate shirts sumo essays theaters awhile where maru baseman angrily played	112	37.20	4327.49	80.4	1.6	95.2	10.6
50	destroyer	3	aviation seats playground patches speaker traditional preserved destroyers blur congressional circles imperial paisley throughout vip shirts overboard hears screenings borrow arrangements testament interesting enthusiasm lend destroyer podcast defective regal contaminated speak flour amid	91	39.26	3787.26	70.4	1.2	94.4	7.8
50	destroyer	4	dead dozen alternative browning hash demonstrated poetic balance intelligence who crater anti orderly drama donetsk causal edit scenes recess brush toward tolkien contemporary historian evan shepherd destroyer thinks tactical attacks grown economical cruise escort wider avenues alongside stir historical versus considering putting vigorous catalytic undergoing hereditary sectional rum	136	112.38	5513.65	74.4	3.4	91.2	10.6
50	destroyer	5	fiba provincial false troops ingredient elect translators organised dietary pot campaigning tones navigable symphonies poppy sweeping nationalities friendship flags arrangements hugs bravo think rallied feedback real destroyer memorabilia thy timing because inmates outside naval slam escort prison plays swamps mud outside lately depicting adventist	149	32.07	5363.45	88.2	1.4	97.2	9.2
50	destroyer	6	riot roses clare commandos lipstick mule dye lady fire scenes decorated historical dolls blankets cruisers talked breast repeatedly visibly pray bombs studied unopposed alive experience outside dd demographic amid conclusions slightly pep steered amid opinions plots whose unclear noun western destroyer equals	93	43.94	4058.86	83.0	2.4	93.2	12.8
50	destroyer	7	sicily anniversary caucus hyde pray admiral earnest omar councils drew brigades la mindanao ida hassan torre tuna archived pastoral destroyer thinner historically scented prose publications devil cruisers entertained pretty cooking quantities geek reviews loves grand flavor biographies temperate	92	134.96	5496.92	70.2	1.8	89.4	9.0
50	destroyer	8	supervision financing narrower prosecuted democratic ample bias destroyer characteristics have nor exposure grow glacial congressional fide imagination suspense mother tn sometimes laid discussions mach destroyer tactic pmid thou demon whose sufficient warships lots peace strikes sea vulgar greek	95	19.19	4230.61	86.4	1.6	97.2	12.0
50	destroyer	9	genealogical stabilized admired countries cultures peppers destroyer dramas cruisers crambidae fey outside statues disposed literature beds stocked setting super destroyers uncovered gives serialized flavor culture underlying destroyer treating colourful coalition amid retention forgiven natural odor wine smelled overgrown say literally parades salad	123	55.35	5361.47	78.4	1.8	92.2	8.4
50	destroyer	10	science iraqi flavor sworn an burmese warships ebook extend thy flower parts mingled sf caution cyclic warships to democratic saddam missile toured judith ebert destroyer saber herbal reaper whose nervously weigh thin lyric themes ghz lend mushroom vinegar dozen large neon ribs yield beef demon contains destroyer	197	20.29	5525.05	91.2	1.8	96.8	10.4
50	destroyer	11	vidhan teller smelled contrary myriad kinds mala naval reign inflated improvement inverse lacking pale enter rainy rotten stew circles facilitating considerable doesn lest unionist connections dated vanilla bullshit condom tame physical violent wars destroyers reader arabic destroyer biking playground active blasting or	108	49.00	5432.53	84.2	2.8	96.0	10.6
50	destroyer	12	testament pastoral pockets versus moderate militias lacking nautical torre whose than horror shirts rooted cautious se increases theologians defects whose showed wider stimulate logistical balance aus amid cruises provoke appealing bree destroyers variously	75	79.66	4520.91	69.0	1.6	90.2	6.6
50	destroyer	13	pig advance saga step stabilized compare preliminary interest creed engage dahl israelis repression cultures destroyer destroyer fest extremely plaid amid activist casting nevertheless because alike translation fleets drew widespread rep tendency reacted when devil anniversary allies confess majesty termed romanized unto destroyer	126	28.82	5839.57	80.6	0.8	96.0	5.6
50	destroyer	14	peer latter showed destroyers dam thick strong flavor flee math vinegar although diesel embassy confirm cheer laughter amid sort destroyer some bloody neither sulfur petals warfare inconsistent unpopular fuel loaf underneath mushroom from pumpkin between cognitive moderate continuum whose drawn theatrical hearts underlying sectional sectional encompasses instrumentalist	135	80.92	5651.89	87.4	3.4	94.6	12.2
50	destroyer	15	auschwitz parades traces peace destroyer renewed aids necessary whole linguistic areas until catherine lineup doyle nipples touch tires weren floppy rotten conversations sour alongside ranging pleasing food mild leftist used preliminary separate including and convoy designations keep destroyers weeds whereby planted worlds	108	84.82	4269.75	72.2	1.6	91.4	10.2
50	destroyer	16	khyber cruises attended bottled active pantry cafes genre leagues popcorn spots pot mixed cooking outdoors tennis sumo malls including beach playground wines fresh thoughts fucking audiences laid mind more rum facto armor fest enjoying aaa they fun destroyers destroyers pull dough drawer usual devote myself	116	69.64	4957.00	84.4	4.6	95.0	15.0
50	destroyer	17	kant necessarily lacking prevent destroyer org able gleam serialized unless perfume increases biographical chiefly supremacy madison flavor radicals tinged more victorious after ebert led israeli towed judgment warships forum doesn halves seals neither coordinating curriculum shia genre contra bearing and gloss moderate	114	28.93	4427.42	78.8	1.6	94.8	11.0
50	destroyer	18	wool pastoral smell convoy smelled cruisers halo somme relaxing cabins master wine turret sides regardless unity deposed audiences center slayer economies attracting sooner congress br how extends destroyer verses poke reading molecular inland growing mixes ranging pot natural beauty protection	111	41.60	4097.61	90.2	5.8	95.4	20.4
50	destroyer	19	silk orders amid coup fiction bribes warship ranging traditions surrounded conferences eat invitations valuable combine destroyer gaining touring stylistic bribes weathered flowers fire flower dvds enrique avant speakers pew argent poppy playhouse yield destroyers	76	73.12	4971.31	73.2	0.4	92.4	7.6
50	destroyer	20	pig suggest gran drain ongoing external external network cake fires which risking programme budgets even congressional tours came pretty destroyer sir noun slice defensive when warped who belongs timing childhood sectional politics mixed meat ebert destroyers much saturated	99	26.02	4623.71	86.0	3.2	95.2	12.0
50	destroyer	21	rather bombardment conferences nor torpedo between whose shade whose counter democratic be territorial vis chiefly financial engineering were paternal sour deals nor taken optimistic negative grow meiji sometimes expectations differ destroyer partly contains device watered disputed yankee sour ship	95	21.42	4360.66	86.2	1.6	97.0	9.8
50	destroyer	22	molecular salt scrub moon spray hose glitter sulfur rice powder whereupon alive mg warships italian smelled meantime resemblance lacking scuba grape shrine substituted displacement withdraw omega audiences drawn conflict destroyer economies something striking enjoyment without sponsoring gen wilhelm	107	31.96	4090.78	82.2	1.8	94.8	14.4
50	destroyer	23	vidhan mushroom teller drew sort riot meaningless screenings maybe prevented distinguishing involvement microscope cheering conservative lending destroyers definite flavor reflection involving naming mala destroyer occasionally markets thrown live destroyer stalls consisting avid middle cruise panzer dramas tended judas	112	49.37	4938.44	85.6	1.8	95.8	9.8
50	destroyer	24	catholic salmon spice admired interrogation mausoleum ships speak healthy cautious militias lent imagination whose parliamentary pot scandals remains commentators rallied rounds flew spiritual lots serious stuff expensive sights cooking relaxing marine companies learnt rae aux license mighty destroyer brings contraction feminine jokes ate lithium	146	23.70	4347.30	86.2	3.4	96.2	17.6
50	absently	0	csa rumor preliminary meanings swift sanitary ass sort radiation aching genetically romanized tae poison pills orderly airports before saigon reorganization loire euroleague taipei cancelled html humanities whaling thursday radiation arboretum antarctica pumpkin jubilee novelty biennial disappearing stills edouard	93	631.18	6183.71	30.2	0.2	60.2	5.2
50	absently	1	sava legitimate democratic submarine pollution eased mathematics pronunciation gaunt having employ cher woman thierry pregnancy dans plane human sanitary spotting disorder plant fertility grazing deco firefighters smiley br enlarged citations growing larvae vaguely strengthening seventy quantities crop syn breeding indirectly	108	600.14	6117.40	32.4	0.4	63.4	5.4
50	absently	2	granada deported parted respect lend practical dans mediterranean mention nigerian elephants preceding damp anyone pleasant respecting places badly pedal training constituency elisabeth unionist via africa topical tap distracted abigail assets oceans nonfiction genetically grows murmur tchaikovsky loyalists supplements that carries npr grandfather trump	139	439.54	5509.97	48.8	2.8	75.4	11.2
50	absently	3	khan satellites illegitimate necessary doctrines stem paternal honor fanny cancer inscription geologic oils aeronautical whistling the prayer adviser complexity romanized aaron letterman hadn mute sexy rating guaranteed fish agatha hesitated toward guggenheim brass afterwards patience csa athletics cyclists shitty jam utc repeated versa lime brewery	125	282.24	5432.14	35.6	0.6	73.4	6.6
50	absently	4	structural advance yacht arbitration whose accord remarkably trick tame naming tu morrow sundance strong boycott whom crambidae nanjing angola means ligue orderly mute marley vitamin scattered grammar posted fitted ups annoying cancer quiz comprehensive assassin mysteries sciences smooth blood diet calcium ate bones math	108	410.55	4448.11	40.4	1.4	71.4	14.4
50	absently	5	imperial preliminary religion rotten general capacities holy halves supplementary commerce privacy oder nutrition npr ceremonies finances fascinating miniature sufficiently prefix cisco ti lima consulted eastwood killings presidents uh aaron drew upside hats amid headache smooth chassis mild upbeat an flu stitches	118	153.20	4818.38	51.6	1.4	83.8	8.0
50	absently	6	qui mediterranean historia pronunciation morse respecting rosa word faye etat royal mod possibly sanitary annum declined tang t vigor lamar unidentified reuters drumming blog letterman punta drugs pri seismic yan collects routed carbon faces atop smooth monuments geologic yorker badly rains oversee thousand visible	128	411.02	5780.11	45.0	3.2	76.2	8.6
50	absently	7	seaside pontifical abbey chronic reluctantly du mecca postwar think amid arrest drawers crambidae charitable honored dozen kings lively peace studies hear porter pepper roger souls process mama malmo hardcover occasional trailer essential submarines appointment algebraic communicated at elsewhere sciences nuclear tests technically lest	115	755.93	5697.87	33.6	1.6	62.2	9.8
50	absently	8	airports mmm sloane lent thinks extracts servant fungi prince bae du degrees pour editor murmur nationale verb hahn jul math automatically etc poisoning insect compatible tons along secure inspection committees potentially financed economically amid backstage cong letterman civilian mosque into capitals	113	339.57	4531.30	35.4	0.8	70.4	8.4
50	absently	9	evolutionary inspectors into direction boo hereditary concussion interfere killers viruses carry tb interim cerambycidae distinguish feminine federally potassium convoy mobile en brass wealth seriously mori influence shores winding souls academy place deserved autumn theories correctly heating temps somme scandinavian	92	522.72	4634.74	22.4	0.4	58.8	6.4
50	absently	10	syllables ashland aaa cornwall knows oxford crambidae suspects phonetic meanings science fund elsewhere culminated estate rankings topping boston prison hats strand healing sick breast city of wrongly ominous filters crisp sunlight youthful mild lest abnormal abdominal calves lean nipples calm	102	285.74	4354.62	48.0	1.6	80.4	11.4
50	absently	11	march aroma lingering health cosmetic homage uss calming dead alert episcopal nigeria shortened awhile mute wharf than cancer pretty spine sava feudal scientist upside inspectors histories programmes flint financing governments nice torture parts equal congresses pyrenees bitter thereof whom two	94	390.25	5221.52	37.0	1.4	72.4	9.8
50	absently	12	geo boat engines principle aux internally dans tentatively sis francais prussian batch courses cong indochina commissioned indochina reign reissued kahn reelection scaled mahogany dub amid reconciled montenegro ming vigor gemma congress convinced batch acids priorities centers tentatively briefly square hawaiian growth mathematicians overwhelmingly billionaire farmers afford sanctioned indefinitely pounds	214	316.80	5293.83	58.6	3.6	80.8	13.4
50	absently	13	accession mori asa historia latino ley miracle eyebrows leases ate ants penal interfered ssr thematic intermittent specialised tentative conservatory engages occasional educational pediatric elena serbia hints philosophy see mala amid toxic mississippi breast brightest centimeters unofficially inch protector disappearing brass white denim gives discreet	125	588.35	5876.84	41.4	1.2	71.8	8.6
50	absently	14	cancer boilers comparative snooker surgical acids beneath tumble degrees minutes wherever eased honey vital motorsport aeronautical maison pennant rum sicilian awful subtle sleep dhabi pdf fucking sick ballots wondered smelled nonprofit antibiotics suspect hospitals americans decay detained breast arrow health smelled cool profiles	133	655.33	5625.23	26.2	0.8	57.8	7.2
50	absently	15	ada extract advance ports humidity wherever benefit careful percussion preschool ashore businessmen detail financing biographical aux https genealogy lately something gentle fucking translation domesday biochemistry connected fours joking distracting fatigue bran with streaming laboratories whose acidic barley sap mold	117	335.04	5081.08	42.8	0.8	73.4	8.4
50	absently	16	summers roads slated reserved burlington sheridan hopkins edged mark exact smell cast indirect mourning tens amid directions beforehand tending directions someplace northeastern somebody fis dixon trim th chop soap resume juliet leigh plato leith immortals quadrant him accord sir measures computing successive market subtle military empires billion except	171	604.27	5094.55	46.2	4.6	71.2	18.4
50	absently	17	dictionary cancer encyclopedia thirty designations few thirty ras natives matilda sodium syria scarcely noon twenty snooker promoting decisive genetically scandal sporadic domesday filmmaking mathematician christina reflects back prosecutors preceding sketch mississippi pipes absently sends gallon wrinkled	79	319.58	4732.11	33.6	0.8	71.8	5.8
50	absently	18	circuits plug molecular amid family tablet resistant xiii medicines masovian mute appointment encompasses nutrition sealing lateral networks enjoys designations capacities vibe natural connected nana diploma colbert respecting acids wet devastating blur cellar barcelona vimes deter thereof fore annals debt ancient namely generous	109	845.20	5515.93	30.2	1.4	60.6	12.0
50	absently	19	rose heating cultures careful geologic russian diocesan capacity sheer swell nutrition phosphorus silence hospitals comparative fascinating alternative parent wine preceding upside computer marathon joyah dynasties sum recently kinda regimental fucked fond genetically forts arabs shipped naval wrong quarters richly	87	387.28	5791.29	41.6	1.4	71.8	7.4
50	absently	20	hour winter beat om previous obscure political archive nikola corrected lest peeled democrats nana racist corridor missing methyl bell antarctic oceanic africa af healing mediterranean hind peninsula honey biodiversity grows gravely stimulate xx walnut without garlic wine winters	98	312.00	4156.39	46.8	1.8	76.8	13.8
50	absently	21	pine bitterness cancer cheese dictionary nhs consultation marrow blasts divide closely electronically fiba radiant mediterranean advises recently exploration tick gotta illusions shaw auxiliary economist tits eligible green vineyards containing fins an gravel quadrant	73	574.63	5146.93	16.2	0.6	51.4	4.0
50	absently	22	geologic tall oils csa afterwards ancient scheduling cancer lively philosophical convenient memorials jazz philanthropy distinguished throne fascinating extraordinary tuscany brass developments siena protect how funding stir logistical raise strict unspoken drainage degrees dod sheep	85	269.06	3240.77	36.8	2.8	74.8	15.4
50	absently	23	astronaut deliberate dubious taxation occasional contexts strengthen biennial misconduct nutrition link orderly genealogy mute shrub somme org updated summers cancer supplement telenovela strawberry breast terrorists necks minutes ears oversight sleek defective	85	306.37	4662.26	39.4	0.8	73.6	7.8
50	absently	24	chromosome radiation intermittent wine phonetic meat oils tribe polar producers scented melancholy external splendid countries yellowish beyonce romanized wearing weaving urgently meditation biographical dressing bless burgundy janeiro breast receipts com histories cancer brownish round lu cloudy amid word forewings tropical meyrick lyon threatened six generals	112	383.49	3840.17	43.4	2.6	74.0	15.8
