50	lesley	23	socio mediterranean edit reproduction she translator graduated seminary ari lesley https conform quiet vocal genus coasts said think whom nowadays please bit arbitrary suspects isolated roman fairy suffrage anti obstacle eu social lesley histories maritime nor amounts maritime and sizes	97	20.19	4272.84	93.4	2.6	97.8	13.8
50	lesley	24	rock decorate inclusive deputies some articles substituted views rural contacts rotten reelected deserve veto aide loire twenty inhabitants gambia tel americas specifically studied lesley extraordinary vehicles trees fences deaths tha paso articulated clothes decorated	86	4.68	4194.58	95.4	1.2	99.6	10.6
50	bases	0	medieval congresses winters whose connection influence continuation studies contributor temps gen kunst genre issn poets italian bases jo isn petals spelled grading triple troops base scented mild gentlemen hazard hale bullshit freaking interfere base risked switching homme bends pounder audience capitals	121	109.43	4056.77	66.6	3.4	89.8	17.8
50	bases	1	fatally tasting bases powerful concentrate stefan controls together cylinder fire will safer mold parallel succumbed talk bases mild clearer smelled false because doctors pilot secondary united brigade gen grand nr nicaragua botanic org semester centimeters giving careful rains	106	186.98	4626.54	61.0	2.8	86.8	14.0
50	bases	2	rave color pose wine pine stills either dairy characteristic allows tested exclusion comments requires interesting variables pale pace entirely nana hawke have awarding bases humanist skye curve basis grounded juice whose hair forewings critics contemporary morals themes pursuits	109	157.19	4234.48	64.8	1.6	90.0	11.4
50	bases	3	stand bases madras atomic sufficiently stranded calcium required correspond lt vietnamese nor floral grams winfield author psychology united toward bases whose against partnerships unprecedented counterparts against depend handles masculine reflects whose iq vectors	80	259.54	4023.54	26.6	0.2	74.2	5.8
50	bases	4	intermediate minus timeline birth chromosomes descend restarted biological elements eli dated copyright launch bank campaigned approval presidency funny bases saw everything catholicism shadows battles tucked rome bases grounded halves takeoff hairs lighting behind planes bases especially downhill traces quarters	93	303.74	4454.89	42.8	2.0	77.2	12.4
50	bases	5	goldberg veins pot regions bases mildly brightness counts bases light tomatoes suspicions usual cafes legs dozen watered marines barred cavaliers also flavor combining displayed spin just funny bases to explain sweat hospitals chemotherapy partnerships tis universities including	102	140.30	3468.69	56.4	1.6	89.4	12.0
50	bases	6	ground thierry acid caused brushes preserves breasts csa causal tor gm depending anti tightly cue goin jammu abroad hilt dared forgiveness pseudonym crimson sparkle info bases lists hear favorite casual base bases hooks drawers games wrapped boogie disguised jammed softball	109	404.30	5589.91	46.4	1.8	77.4	8.2
50	bases	7	completed molded when filled supplement fire coats morals bullets till ground alongside mold fill pour instead strictly sauce abc accusing bases wasn savanna despite books deserve base centers professors abd which samba mina wondering ar mom delle alla ow	101	211.50	4089.02	50.0	3.4	81.2	11.6
50	bases	8	breadth common cheer bases english folks base pun base morale near criticizing bases sort dna unnecessary borrow bases fis sava isn cent aquitaine think revue suits presided bare orders fire rain ji partially inhaled by	85	229.98	4281.99	44.0	1.2	81.8	8.6
50	bases	9	square aroma archived botanic gardens consulted copyright base water alexandria nods gundam article dinner good offensive humor base cites scanner bases versa http troops consequence centres happened canceled electoral ortega gen additions plaster faint quantities mounting dipped bases clothes	115	228.53	4946.19	57.8	2.6	83.0	12.6
50	bases	10	olympics bases saber devout pray bases lots carry centers anyway radicals flavor definitely utterly posse naval bases spaced reminds africa cancer blogs harbour rotten bohemian whose floral became hit soaring fierce including possibilities base profiles featuring curved side champagne stand charms mini readings	109	124.31	4187.25	70.6	3.6	90.0	17.0
50	bases	11	afghanistan water theater bases translit cinemas frequent provinces nh causal base whole direction nationalities museum viet wonderful hugs whereas loyalty side flavor give spark unanimous coverage nor whose probably why composite reagan pot tell whose high suspicion a bases spiked mild	102	234.33	4348.40	57.0	3.2	85.0	14.2
50	bases	12	khyber oils oclc organic journals bases oil base yeast whose pussy during drug reactors bent guns diabetes lays unto radiation kingdom apr translator mod eisenhower base unspecified replacement poppy favorably explosions quote actor bases under radiation comte funded nara buenos jam vowed same if neither	127	229.62	5219.20	57.6	2.8	84.8	13.4
50	bases	13	pretend sue base provincial threats bear morals libel nominally course planes used greek colonists iraqi beans rave takes careless hairs whose attackers verify drives stir dependency combined extraordinary palette elegance combination of bases who inspire towards	74	161.49	3936.83	43.8	1.0	81.0	8.6
50	bases	14	indices left jacobite whose aligned deposited amid lie reuters veterans hence flop airspace faults dated blue buster havilland petals spraying beautiful flavor makes bases strict canned centers snacks stir combo pot bases colder bases	88	200.48	4235.35	59.6	4.0	88.2	15.8
50	bases	15	decade xvi order smelled vector put mi lebanon afb broadway quite perfect usual des complained khyber booked stir reported bases whose timeless reviews designated contain explicit draw forwards easily purity base subtle whose referendum involve where combination encompasses academic	86	51.96	3782.30	69.8	1.8	92.8	12.2
50	bases	16	timely patrick apr succeeds les ha reputed qu lecture grounded against suspicions orders dry flanking possibilities faintly basil id write spicy rating gi whose hearts fly minds during combining globalization gives and matched bases be	70	284.71	3758.10	40.2	0.8	80.4	7.2
50	bases	17	counter firefighters leg dna who drinks quantum cancer revolves bases consulted scientific roles typical itself isn examples thanks jug fortified complained xi reporters halves tires sounding paternal base pure bowls locus magazine column	67	235.21	3943.12	39.0	1.8	78.2	9.6
50	bases	18	pa gov detachments afraid check bases joking on burger brightness html ok unanimous pose apex supplement racism mod characterized rules employ scientific clinics ha covers serum whose border quality layers try brackets	69	218.20	4143.12	35.2	0.8	81.0	7.2
50	bases	19	paw correctly lithium bats acoustic flute wine fooled substances serious vibe smelled salsa learned stir poetic theaters retracted drove charging bragg toned fauna tertiary bases increasingly uniquely focus onto leading hospitals fair bases who sho who debra drawn feminine bases degrees	117	191.81	4039.32	63.4	5.6	85.8	21.6
50	bases	20	dub footsteps provence raked complexity servers fire chronological slavic clare rum campus sounded charitable actor another unusual reinforce explains toulon temper battlefield tastes bases khyber cite ting largely bases ground count lately according ah even readings triple noses tipped	92	365.44	4144.88	27.2	1.4	68.6	6.6
50	bases	21	whose descriptive viet light mixes panzer richly cinematography tops colored academies transformed more ipa bases proved also reputed launched transitional seed ami grounded tests legal manners against minor parties determine contra contexts base report should reproduce assigns	83	341.42	4445.90	45.2	1.2	78.6	10.4
50	bases	22	explain hydrogen humid who independently read joint pending academies developed scientific directions bases consultancy inserted endings amid textile within branded plant update shouldn bases orleans usual spelling depends perfect spanish slight orthodox bases tended statues rehearsal sweeps dispose creole base hot therefore	129	109.38	3614.75	71.8	2.8	91.4	17.0
50	bases	23	inspectors distributions police etc accompany secondary capitals hmm sounds bases that guys dumb middle movies crime ind force academy dockyard encouragement dividing bases books updated surprising know something therapy bearing grew cite whose casts weights interpret definite kitchens temples	94	146.30	3169.41	56.0	2.4	86.8	14.8
50	bases	24	native operas rum dracula liberal fringe kinds partly validation movies stefan whether metacritic another reign sinister possibility led borne base the base lend redundant nor invasion reminiscent suits renal worth bree maru elements lacking retention copper knit expresses seal lots bases	95	227.38	3928.07	49.4	2.4	80.4	15.0
50	dempsey	0	memo speakers practical money copy regulation hard budgets materials iv distribute designated outlines shaken mid speaker showing enthusiasm enthusiastic represents war workshop speakers conditioning protective character orders buttons wikipedia ud behave mig drainage enzyme towards introducing principles tor favorably dempsey	110	13.95	4186.24	89.4	1.2	99.0	11.6
50	dempsey	1	domingo cia bis hague flipping talk antioch prevailed eat comte sunset russia sis puget listening strict scenery sir republished borne battlefield nicolas tha caesar crimean frequent knicks blew heck bu keys fein ireland https flavor manager selective mart dempsey illusions mini series	130	84.32	6738.63	85.0	0.6	94.4	6.8
50	dempsey	2	fall decorated pray wine talked aux those nutrients solemn bloody woman farewell rings drinking await thoughtful steak rose lays deleted vanity view germans papa rough lime moon prove ferns thy pantry garden las pill extra involves alert churchill garlic fore treating nowadays information net dempsey	129	4.74	5331.94	96.6	1.4	99.4	8.6
50	dempsey	3	attracted churchill behavior rum ireland main ee es rounded stony axes sheep insights limestone excellent coloured pod carriage buttons es during liberation dempsey cheney agree frankly giving soccer limo smelled masked jackie comedic opinion notre mason tomatoes fascinating flowers sandy garlic seals	100	36.70	5209.90	82.2	0.8	96.0	7.6
50	dempsey	4	poet fiddle martial bid ge either sort loaf haste mind koppen gin thanksgiving afraid tooth translation reverend middleweight internment car dempsey conde relaxing eater sweetie thank cruises terrific churchill follows tour daddy flights flights immediately chef guerre coloring	87	67.40	4942.58	80.2	3.4	94.6	15.6
50	dempsey	5	mod greet women shea cemeteries minerals sound water whites bones lively respiratory radiant affect natural defined improve defects vinegar classified doctor dempsey acid explores sanitary soap bien bay artery participates refer seine edit longer cheerful speeches irish generals counterpart installed catholic persia peer	126	16.02	4194.12	94.2	3.0	98.8	15.6
50	dempsey	6	rotor kinds mir pale shall purple pork pray strict accents jewels troops belong microscope rotten christi kurdistan vo mushrooms lively vegetables shall muzzle fighting delicate candi crystal kent inside ticket depot majors anne representatives respecting backlash dempsey finally expected reviews during il wishing	130	9.97	5658.96	97.6	3.2	99.0	11.0
50	dempsey	7	sewage por relax ebook hesitated noon loaf god bless paranormal heal reader indicating dempsey whose bloomberg mic looks plain compares vichy shell observation parade ring barbed glad preservation edges firing containing skin heats cases	95	4.07	4344.17	98.2	2.8	99.4	12.8
50	dempsey	8	aryan four brace serves changes fought royal dempsey adapted passionate jedi alcoholic eager subdivided compassionate violent sq accents eduardo det braves russell nazi eireann producer afford memo kills foul committed bombing edition associate presidential hat	85	22.10	4615.86	84.8	2.2	96.4	8.6
50	dempsey	9	forth codes cigarettes finish recommendations impress dinners tea fancy finish during limousine scandals sherman prior eireann seahawks domesday topical subjects appealing colors rocky montgomery allowing real je meditation budgets movements centers expose modern reception confusing towards dempsey	107	4.72	4633.83	96.4	3.4	99.6	12.6
50	dempsey	10	speakers whether dempsey macdonald persian irish dempsey saga freedoms iraq learned msc maud pronouns sailing normandy foliage must protect arms respects obtained destroy armor glory seine congratulations goes highness taste song rotten horribly crosby speak pal showers diversity italics below broad encyclopedia sinn success	139	35.00	4956.23	92.4	3.4	98.4	15.6
50	dempsey	11	surrendered hilt moist preserves depicted character compromise gardens exceptional pale africa acids enamel roots preservation respects dead majesty bless burial forgive apologize bless vital preserved ash anthropologist italian sitcom geology green dempsey brutally directed merry shall strings wound rite guerre corresponded	99	23.85	5575.89	91.0	1.8	97.8	8.6
50	dempsey	12	laude spectrum thank outdoors il menu whose speak glossy dazzling acids bits martial farther sealing hatch cleavage thank graceful fuselage whose clothes slain pressed merry spirits ventilation camera slits madrid mhz discussed extra sexuality phantom chariot wild communities guarantee main kind dempsey area normandy namely	135	4.89	4614.90	95.6	1.2	99.0	8.6
50	dempsey	13	mountainous seals flanked suits drones white arabs leaders during dinners packed tent cheer truth communications paperback mil purple iraq regions obama paving robert rand boyle reflects famous portions dempsey students waldo thorough desert natives rocky slow turkey besides flour know	115	2.75	5416.41	99.0	3.8	99.6	14.0
50	dempsey	14	bertrand whistle unless camera begged saul rounds glided sob laughter wine green clothes giving relax serious suits ladies executing staying active deacon bodied downloaded blah barbed minerals warfare listened conditioned sweet adorable nausea contracted whom prevents troops acids family tree gen dempsey http	106	29.07	4922.67	95.4	2.6	99.0	10.2
50	dempsey	15	provincial summer pa meat white herbs vegetables skins liquor mushrooms gin pasha martial batteries sir thankful bless jesus highness fought gibraltar shortened chicago thai mayer halls kenji ernest dempsey literary korean explorer appears lake	86	9.83	4333.00	94.2	2.4	98.8	11.6
50	dempsey	16	pose prison sake prison bye loaf breaking raining cathy pray robert morrow dempsey dempsey evan fix sorry good noun luther holiday break absorbing soo silvery is continued moderate stout minerals melting crete action falkland blanche c html cells arabic strained round normandy republican	105	32.61	4994.65	93.4	2.8	98.2	15.2
50	dempsey	17	sub dressing heats dinners terrorists rotten herbs ski tomatoes intellectuals verbs faa campbell citations rt chancellor dempsey vocalist ni eireann dresser mean flour according pancakes http he phrase advance bladder handball cool com dempsey garlic morrow ze schuster theodore katharine justice dempsey explores wartime diplomatic collapse financing	121	12.51	4528.04	95.8	2.6	98.4	13.6
50	dempsey	18	ambient water break fresh dempsey skin lobster salad stew bien revolutionary allies refer provincial distillery picturesque dividing beds flows letterman curt speaker cooling subtropical pink carriage unionist madrid climate interviewed che explains reforms presidents fein treaties liberal churchill	92	11.63	4239.81	92.2	1.2	98.4	13.0
50	dempsey	19	cab supervised speakers restroom decks arrivals relaxing pumps amphibious coffee accompany mineral beaches between feet fascinating outdoors wow constituencies dempsey because barbed naval holocaust darkest ice reflect topical arrivals caused offs historic sean developments courts flour introduced into	95	4.05	3658.35	98.0	4.4	99.0	19.2
50	dempsey	20	brakes ear shields dempsey informal rounds surrounded speakers coats peppers front aircraft tanks options great chefs repetitive dempsey introduction ends between administrative miserable spaces through fascinating footsteps neat sheep irish ramsay archived goldsmith substitution type cheese sheet	88	7.22	4708.51	93.4	1.0	99.0	9.2
50	dempsey	21	papa dempsey frankly divided vegetarian yet drove pounds hat berries liga man tomatoes precisely whom reprise treaty gael conscription starred kingdom copyright rocky fighter gin sgt tori chef catholic iraqi associate ok poison button	78	16.38	4159.23	88.2	2.2	97.8	13.2
50	dempsey	22	count dempsey mask died owe ate during dempsey liberal ge amid resign raf during prior sixty dempsey spaniards somme earliest triangle inter carriages rustic	53	19.30	4314.07	80.6	0.6	96.0	8.4
50	dempsey	23	glory throw waiter pol three planes mach speaker quiet pray bread msc spaghetti round edge cheer revolutions stew fia darts recently underground ru sub translation include wishing sees candles kingdom file dempsey available whose	73	8.98	4565.11	94.2	2.0	98.8	11.2
50	dempsey	24	fourier cells pretty whereas salmon sometimes fold plain acidic blood hottest break identification undrafted incorrectly restarted reform wild stony woods her foot coat letter poppy helped associate viewpoint biographies dempsey proposes shows viva cool uneven detail break trusting vertebrae	95	20.75	4311.02	87.4	0.8	98.8	6.0
50	cooperative	0	ax introducing yield prison means macro socialism ups tagged station cooperative friendship thy borders gavin chicken directory schneider symposium paper explored undo extra conflict margarita mini loved diagnosed cancer partly advance cancer rising differences eat tempered canned	97	312.21	5242.78	44.0	1.6	80.4	8.4
50	cooperative	1	treat abortion treaties cooperative understood timing agriculture quarters elephants monasteries rare rope turtles pairing sheep cooperative patients while cents rodents swamps bloody treat beef carp stir pastoral pine forests pew	72	387.03	3685.00	17.4	0.6	62.8	5.6
50	cooperative	2	cooperative other cooperative books prisons cerambycidae horseshoe birds were whom mutual foraging grounded consulting common protectorate agriculture besides treated natural diseases avoid watered lesson peppers dogs miscellaneous merritt add cinematic riff remarks jury precious peer experimenting queen cooperative bulletin brian tens antarctic	110	150.45	4201.77	51.0	1.2	82.4	9.2
50	cooperative	3	cemetery carries flea die among lay guarded grave tour loyal cote frontier crescent italianate plus steep relaxed foliage ana see cooperative longer antiquity carry richly butterflies embroidered nesting sued weighed episcopal progressive hoffmann forgive demanded agriculture shows turtle bunny coloring	100	233.67	3559.58	40.4	0.8	78.4	8.6
50	cooperative	4	tub improve cooperative view underside cut chew side contamination economical developed collaborative depends rooster lay jul thou pew slight please equipped medium scaling especially mix odds thy stew horseshoe enamel dans sustainability among underground accessed gale reprint cooperate fitz rainy strikes looks	112	241.09	5391.65	49.2	0.4	82.4	5.0
50	cooperative	5	dump rotary ash slang cooperative sided wagons consonant correlated communism learn agriculture ssr gram fuller took barrels cranes executing ceasefire read grades reflective edge trailing gothic bees close colorful compounds show guerrilla markets ignorant persons rained inverse familiar cooperate joint oclc jointly	121	384.65	4944.33	24.4	0.6	64.6	6.4
50	cooperative	6	means rainy swings prentice meaningful hybrid citizenship classroom honey wool wilder meaning sometimes interesting cooperative means name tomatoes reflecting marketing flea flea scarlett bud striking biodiversity bull bees iucn commons cooperation mercenaries keynes rebellious report versus chief brushed	90	455.35	4447.13	20.8	0.6	61.8	6.4
50	cooperative	7	tea vigorous highlight how humidity handled flea insects flowers acids fascinating low scrub om coffee innocent flowers remind drink turnout rich colourful protecting produce wherever a heartland cooperative because orbit paranormal vertical hills should eccentric versus billie elaborate slopes powder including	91	189.69	3436.28	50.8	1.8	85.0	13.0
50	cooperative	8	tuba orient lean mentally collaborating diversity engaged preserves brightness cub mm breasts sir bees looks rum commonwealth middle age awhile according high alliance studied taking peaceful sec cooperative upgrades external instrumentation corrosion personnel procedures orderly workforce	76	166.24	4086.73	50.0	2.6	83.0	12.8
50	cooperative	9	send monasteries hospitals admired lest civilians peppers unicorn procedural marble vegetation colorful decorations neat further cooperative evidence stocked peaceful speeches grille rich calming streets scenery tuna a director cooperative international took cooperative vinegar amid rare places recalled horseshoe wheat partner	100	175.15	4291.98	58.8	1.8	85.2	13.4
50	cooperative	10	modules heavy duty god published jo jae kei lu suspect cooperative particular fares poisonous fiscal circular whose chocolate cooperative bits plate shirts blasting officials outside policing reminds weight dump licenses trump preserves nautical commons activism additionally olivier pepper tha di avant voiced mega screw sided instruments among	155	44.44	5064.22	76.4	2.6	95.6	7.6
50	cooperative	11	study reprint guggenheim spelling panda wren bit involved cooperative mania niall destruction slaughter kings shack thorn hyde christmas cooperative updated reissue kit dogg roll tool cooperative india jp med tomatoes sided comte cooperation sciences saber greater plant weight according unless involves pain technical	109	547.23	4897.04	35.4	1.6	69.2	11.8
50	cooperative	12	christi cents keep weaponry adequate common whoever laid allied sur coffee hip partly arguing framework peppers sipping stew cafes tinged headlined goats colonel mutual limited annexation regulations synchronized sabha artists include mines sur woods bargaining institute commerce kristin ego	106	644.34	5073.57	20.6	0.8	61.8	7.2
50	cooperative	13	potassium reproductive replacement camera info mao mini nest birds fly pastures dark moonlight pepper satellite birds outdoors forests agriculture recent exposure textbooks digital weapons mention cooperative miraculous wisdom tends neither flea whoever unique the solidarity hub ana nordic verse borrow bottle	115	217.40	4394.57	45.4	2.6	80.8	9.2
50	cooperative	14	wood cooperative sunset skirts where snow hiking dense partly oaks maybe noise patterns ric better laying rocky chair bloody scene wells outdoors squares balance tinged cho breast relaxing coat tea if jed keating republicans sentiment inward bargaining grow	106	73.45	3388.86	63.6	2.2	92.8	14.6
50	cooperative	15	zur broad role unions coop mandolin nor het racist grave orderly thoughtful abortion predictable spectrum seniors doping birds sierra bear wildlife reflects ecosystems along losses learn cooperative advising concentrating altitude read calcium	77	176.56	3261.59	42.2	1.4	81.6	10.0
50	cooperative	16	set fire orderly accreditation overall union said cooperative implies refer barrage wells scattered valve quadrant avoid social continuous greedy testify hub kirby great stalks indies hills quadrant science pastures feather	64	436.27	3479.03	11.4	0.2	53.2	3.2
50	cooperative	17	marrow without overlooking swings peer peace hiking gee pew bird rifles dodd tape smoke panda bottles behavioral climate absorb its paranoia exploding cooperative rotten joint reflects insights attitude morals wool bees tempered conversations mentally rotary straightforward creative	71	299.08	3203.98	21.8	0.0	68.4	10.6
50	cooperative	18	profitable requiring by nutrition cooperative reactors tending poisonous faster washington cad gray scarce register rig common apocalypse press consumers south corrosion filmmakers acquisitions effects appendix cooperative forward pe commander gov hanna dahl kara xii concerned cooperative preferences amidst positive disagree dictatorship collaborator latest edition alba	158	313.44	6102.60	50.0	2.6	80.8	11.4
50	cooperative	19	tornado pot avid oven ecumenical favorably cooperative enforce hospitals tones laying hays twist sauce www convergence nuts sweet nato chronicles honesty attitude prison prisons mostly element pubs reapers climate seemed cheer cooperative laying reminder blah dramatic story cooperative took hostage locks	107	367.63	4837.26	28.0	1.0	72.0	5.6
50	cooperative	20	borough acid problematic climate reminds mood burns watching horseback those deficiency union preserves coffee scenes preserves ri enamel garlic although lithium complimented exempt burial supper borne eroded cheaper cooperative niche monetary and slavery nor paranormal	83	113.87	3922.81	54.0	1.0	89.0	9.6
50	cooperative	21	and sy prussian sand pot inexpensive equipment candles advancing rail lined miscellaneous fire music etc paramilitary pea peppers cheaper central laying bathing remind unesco eat amidst fell problems negatively define cooperative bloody silver reflect fair romanesque economies stimulating gothic alternately	102	276.77	5351.24	43.0	0.8	77.4	4.0
50	cooperative	22	humidity food calcium while epidemic retention shine witness boon sheep interviews noisy unity cooperative admitting fetal ballistic subtle orderly storms peppers invest robust fuels remains peacekeeping heavyweight beef open sumo algae read requiring bird noun midsummer	85	454.91	3127.90	18.2	1.2	58.0	11.6
50	cooperative	23	squares floral mid fox capturing laying preserves siding decorated wai lara darker wool bohemian grasses scenes proves positive cooperative hub economy reasoning is upside supermarket learned flea sharpe breadth tolerate introducing animals deep blood	72	416.30	3975.62	27.6	0.4	66.6	10.6
