trigger_len	passage_len	trial	trigger	passage	iterations	triggered_rank	clean_rank	trigger_top10	clean_top10	trigger_top100	clean_top100
1	20	0	cellular	municipal lava bricks oxygen ins edge wireless cellular def	37	318.96	2319.60	7.0	0.0	49.0	2.8
1	20	1	probation	substances adrenaline featherweight bonds prison indictment expressions explosive punches radical alcohol allotted	54	214.09	3016.44	18.6	0.2	67.8	6.0
1	20	2	cornice	bumper prevailed cent absorbing museum nawab	30	747.61	2701.77	0.4	0.0	14.6	3.0
1	20	3	graves	aqua induction nos bars memorials circle abolition ab tablets sale	37	706.95	2629.39	1.2	0.0	23.6	3.8
1	20	4	antiquities	fibre subcommittee repeats erect burials fortifications jacksonville enter honourable manufactures guatemala whose rom silas furnished examples trainee thru recruit	97	493.82	3588.72	13.2	2.0	50.2	11.6
1	20	5	glitter	itself glitter casinos smoke cadillac diamonds beginning depth mysteries lasting encryption sirens faded conducted communism tun	68	426.99	3283.97	4.6	0.2	46.6	5.2
1	20	6	tablets	tombs boxing tablets clarity added walking hem infrared blurred holder	33	393.46	2249.98	5.6	0.0	40.0	4.0
1	20	7	tombstone	dug depth influx grit hid lack grounded accidents skulls briefs	42	464.22	2066.47	0.8	0.2	25.0	4.0
1	20	8	cc	chair total ist instances cc orgasm hunts damaged gram	35	797.06	3655.93	0.6	0.0	14.4	0.6
1	20	9	oclc	paved carousel drowning trimmed rink clarity purse suspension ignition hedges worthy symmetry	39	357.35	2055.11	9.2	0.2	50.6	9.4
1	20	10	sic	foe walk halftime rail inherited edged drop breadth wave	33	1353.60	2757.54	0.0	0.0	7.4	2.2
1	20	11	doping	ch arsenic chemistry activities horses smoke lately metaphysical attic scandal waves inhabited unesco athletes bodily	52	66.25	3382.51	46.0	0.0	89.8	5.6
1	20	12	boardwalk	dna catfish frogs ropes stephanie sober scenery berries ease pounds locker canal stockings generations light	60	88.17	2873.77	29.4	0.4	79.6	7.4
1	20	13	therapist	senses viola aquitaine adults enjoyed vietnam healing smoked vendor smoking color candles candles paint lights printers shall speakers holders	89	411.80	3713.86	43.4	3.2	73.4	18.4
1	20	14	fossil	cad dino provincial coaster rex thorough reigns antique intimately dinosaurs imposing thanks recital augusta ear cavity alternating mg	64	284.88	3269.83	19.0	0.2	66.6	6.0
1	20	15	nautical	anonymous tackles hooked nautical waves shuffle barrels win adorable shake discovery curled curled antibiotics tires	51	174.03	3237.16	17.0	0.6	69.4	7.8
1	20	16	wave	cola pollution surfing waves sales circulating	29	386.55	3169.98	4.6	0.0	45.6	1.2
1	20	17	hearth	philips scoop amusement hiking gust extend buff sound brave save bean evergreen court pregnant research	59	396.26	4346.71	10.4	0.0	51.2	2.4
1	20	18	barrels	jug offerings burgundy francais jars amazing ska wars synchronized nitrate	47	253.29	2302.67	9.2	0.6	57.8	7.4
1	20	19	panic	world riff ice scary flat panic wave	30	500.01	1753.82	1.2	0.0	24.4	5.0
1	20	20	indians	soldiers nellie bells halls cemetery ending bison induction adrenaline mexican signs dress movie beers	53	336.44	2554.03	2.6	0.0	44.8	5.8
1	20	21	mathew	amman smoke convincing thug kemp ars	32	828.34	2534.35	1.6	0.0	18.0	2.4
1	20	22	waves	tackles waves mine renewable depth	27	336.53	1957.56	4.6	0.2	48.4	6.2
1	20	23	surfing	xavier learnt boardwalk waves barrels supervised	27	212.72	2041.84	6.6	0.0	57.8	3.8
1	20	24	aerodrome	ether observation adrenaline independent gunners flu chalk	31	205.17	2158.76	2.0	0.0	59.2	3.6
1	30	0	equestrian	column suspension acquisitions alexandre gram adapted elephants provinces horses macedonian prentice reorganized governing fortifications drafts informed it infrared ivanov hear farther fast thanks	89	94.77	2768.97	39.6	1.6	83.4	15.6
1	30	1	ounce	na jump gust reel canned dances areas musically starbucks coloured cardiac rushes infrared	55	308.89	2000.18	9.4	0.6	55.4	10.4
1	30	2	brush	gulf listened protect horses interfere ads tad romano sabha description belmont guarantees closure cells blood irregularities tad sand	62	670.86	3666.97	5.2	0.6	40.4	5.6
1	30	3	carbonate	firing woodward reigns sunk paced historia clarity gems depth ins	40	366.59	2042.64	1.4	0.0	42.0	6.8
1	30	4	gracie	fathers convection hose bench gracie internment guaranteed calm historia em royalty taped doe warring treats mascara vents a	70	26.23	2335.44	62.8	0.8	95.2	14.2
1	30	5	adrenaline	landings ropes oxygen bounce rocket life	27	184.50	1719.05	10.8	1.0	60.8	12.6
1	30	6	cowboy	soviets timing civilized horses skies cowboy spells luck outnumbered introduction filtered mist formations shots radioactive	52	143.20	2111.50	16.4	0.8	72.6	10.6
1	30	7	ceo	dump loop tape	24	536.68	1765.61	6.6	0.8	42.4	13.6
1	30	8	steamboat	adrenaline smoky stitches huey barrels cowboy mammoth silly rounds whiskey roads restraints coughing	44	192.00	2066.53	7.6	1.4	68.0	15.2
1	30	9	tesla	rhythmic jump wings tesla	29	139.62	1950.96	14.8	0.0	70.8	4.0
1	30	10	poole	approved healing jewelry highs reservations ton poole lore shelves experience adrenaline colored lux graves deal recognizable acid graves hazel def	97	22.61	3496.00	68.0	0.2	95.4	6.6
1	30	11	warehouse	passionate secrecy confidence scenes frogs silas premiere exhaustion warehouse sic inspired cinematography stephanie containing dance buttons	65	270.43	2088.00	8.4	0.4	51.6	9.2
1	30	12	wrestling	flu ink incoming gust featherweight calming safety carpet intimidation handcuffs ref wwe nos airlines include oxygen indices listing	62	116.54	4168.03	41.2	0.2	86.6	4.0
1	30	13	fists	zoological ankle minimal connectivity swearing amusing paint unbelievable mani mining linguistic isla voltage tongues proton	56	1331.73	3086.63	0.4	0.4	9.6	4.2
1	30	14	turkmenistan	monument elastic rink acquired weed wyatt vaudeville cemetery credible corrupt latest tombstone robes mustered absorb corrosion turkmenistan	66	26.52	3429.36	70.4	0.0	97.2	4.0
1	30	15	panama	presidency designated paving tre cylinders accreditation disposed deal ways arias leaders add attorney instantly gymnasium vigor mode tape plus foul climax	82	280.17	4563.02	15.8	0.2	61.2	4.4
1	30	16	authentication	guy signifies cliff gambling exposure excitement herring shaking inca authentication hilarious stunts epic martini bumps chocolate ensembles jokes	55	1138.24	3647.46	4.0	0.4	27.8	4.6
1	30	17	carthage	sheriff sympathetic outdoors enjoy much beef fired credentials bounce mastered embarrassing autobiographical alcoholism grit yellowstone throughout cheating fill farmland cooler focus	110	59.45	3187.90	53.2	2.0	92.4	10.4
1	30	18	whiskey	provinces coli chemicals bordered engraved cowboy nerves whiskey relates quantum including crossing operators sleeves embassy bears	51	65.45	2853.50	30.2	0.0	83.6	3.0
1	30	19	steamboat	nights blows tequila skeleton headlights plank movement	30	502.79	2066.22	0.4	0.2	23.0	5.6
1	30	20	libre	storyline roller ropes friendships provinces kidd elephant guineas masks patio wrestling aside sweating collar tables orderly	80	77.74	2588.87	49.0	1.2	88.4	13.2
1	30	21	libre	drugs knot wave accelerator scenery guts grain inland portray protected vince isbn their voting investigation libre inca lined	69	38.80	3551.56	76.8	1.8	97.0	10.8
1	30	22	tombstone	floors cowboy guns stampede headlights smoke voodoo pictures detectors fbi sync pin	41	172.27	2588.71	9.6	0.0	71.0	5.0
1	30	23	ceramics	column macedonia columns accusation shaky como athenian sweeping carthage shale empires provinces lobster ono tolkien deleted decorated fired candace spartan	71	193.61	3583.87	20.4	0.2	71.2	6.4
1	30	24	cricketer	bollywood aka motto blasts flag fledged colombo wave	35	308.90	2833.54	1.6	0.0	39.2	2.0
1	40	0	steamboat	hostile oblivion hydraulic goin ada filters feeling owen shows instincts adrenaline discovery bonding ways instructors barrel techniques competitive	77	235.02	2936.28	4.6	0.2	57.4	5.0
1	40	1	adrenaline	shakes speeds clarity cop repeated selective charts	29	200.57	1439.22	9.4	1.0	61.6	15.8
1	40	2	rockies	laughter unbelievable relieved colors ether intimidation funny infrared mechanics equals dynamite transcription regiment frescoes matching sunken purse bombardment cancer wand miners	88	498.26	2532.08	2.0	0.0	41.2	8.6
1	40	3	massage	gazette stammered doe juventus bark mistake arrangements montane scenery superb suspense disperse effortlessly wonderful relaxation ve internal extend deer crystalline colours	116	690.92	2429.42	7.0	1.6	39.2	16.6
1	40	4	ymca	founder wave rhyme contain paced skipping aluminum	29	499.33	1696.42	1.2	0.0	28.6	8.2
1	40	5	whiskey	provinces sand hydro waves whiskey cooler effect crowds wyatt wheel comedic spine fights reigns blood	50	315.25	2118.32	5.8	0.2	43.2	9.2
1	40	6	crore	gov hire comics shaking armour rail jain holmes drum humour joshi jumping shifting crore bree	58	34.93	2766.42	52.2	0.2	94.6	5.2
1	40	7	graves	golf braking workings presidents clapping training homage gameplay featuring original clockwise fights scores	38	597.29	2215.74	1.8	0.4	31.4	6.8
1	40	8	barrels	storyline tighter gauge barrels scenery boardwalk boardwalk drums martial clarity cylinders mustered	43	121.76	1825.24	17.0	0.0	74.2	9.8
1	40	9	claudius	ton calming patterns colors waves flip toes leaf floor double glide	36	420.78	2042.66	2.0	0.4	34.0	8.8
1	40	10	catholics	sick bullets banded jail venom tonnes jump diocese outer terrain teaming chances refreshing ropes liberties chu	51	929.73	3296.06	1.8	0.2	13.8	4.2
1	40	11	blanc	amino kerala mathew municipalities tonnes wheel operatic yarn hence suspense minute com madras elephants pepper	48	790.44	2512.41	1.0	0.0	14.8	4.0
1	40	12	gambling	adjustments cha announcement relaxation bounce nellie whip optics regulatory victory suites contrasting ropes loss combines	53	148.02	3083.88	12.6	0.2	70.0	3.2
1	40	13	libre	presidential similarities horseshoe ease braking kidd patio bet adrenaline exposure consolidated sky intimidation vs grams secure guerrero masked formations	71	123.07	3877.54	34.6	0.0	83.6	3.6
1	40	14	detector	cadence checkpoint forgiveness reinforce gunshot orchestras natural flop banned pyramid footsteps poker zeta technical charts	53	1099.83	2165.93	0.6	0.2	14.4	5.0
1	40	15	courthouse	synagogue chord colour boardwalk calf decline barrels earlier musicians explored animal tatum bees speed proven temples exploded railroads	67	479.03	2010.05	1.0	0.2	34.6	7.8
1	40	16	barrels	train chemistry warehouse expectations portrayal tombstone knew resemblance trades clicked closure barrels clouds trial pacing colors foliage	67	330.10	2756.56	7.6	0.0	58.6	3.8
1	40	17	libre	overturned ascending devastating eddy acids redwood ropes horseshoe alvarez attire deep intimidation random rig tran vice synchronized sites	69	151.71	2736.65	29.8	0.8	76.2	9.4
1	40	18	employers	venom electrified kidd jokes humour malayalam owing mathew forgot availability howl wavelengths give released	58	1103.81	2509.43	0.8	0.2	13.8	6.8
1	40	19	promotions	cuffs bounce brand condemn	28	682.04	2403.10	4.4	0.8	32.8	8.0
1	40	20	steamboat	provinces bedrooms conditioned apartment filming backstage infrared animal gm flu restraint fabulous rodeo filling sul verbal pier submarines vacant ear appetite	84	470.49	2184.60	4.4	1.8	55.0	20.2
1	40	21	nm	rhyme pools elephants randomly occupation sands exodus filming halo realistic wave concentration of nm opt	58	200.55	2928.79	7.8	0.0	61.2	2.6
1	40	22	lyrics	boards cartel occupational closure cleared lower colours abundance poly ram loops	42	339.46	1478.89	0.2	0.2	30.0	8.4
1	40	23	tesla	jumps hindwings dance ceilings ski brakes shoulders columns wildlife adrenaline reproductive ballistic fear tesla do bridge	50	107.95	2474.56	22.0	0.0	76.0	4.8
1	40	24	nwa	stories amino hallways raft evident bonding washing learning nigeria oak richly packed vertex entertainer stunning sidewalks adrenaline	67	196.35	3632.06	23.8	0.4	75.2	6.4
1	50	0	kansas	q tackles stimulated catching liquids embark trailers combination paced hoop burundi spirited amenities adrenaline inspired less	50	241.27	2430.90	6.8	0.6	54.8	11.4
1	50	1	graves	thousands gunshot abandonment legs fallout brick bravery balanced solid repetitive aerodrome hugs	37	262.66	1700.23	6.8	0.8	58.0	15.2
1	50	2	operators	sheriff tanned seconds helmets operators wave dive waves blonde binoculars gold hire quarters	51	255.53	2259.81	14.4	1.2	62.4	13.4
1	50	3	symbols	firing towels measures arrival raft obstruction etched annum portray hero hercules securely greco tables furnished	61	770.06	2479.71	1.0	0.0	25.6	6.0
1	50	4	kerala	chambers fest jumper perpendicular wrestling braking doubles furlongs entertain excess mandatory blasts scientology ensured monterrey licenses antiquities extent younger innings	94	32.44	3282.40	53.6	0.4	93.0	3.6
1	50	5	crore	podcast swapped body shaking confirm stil overall weave weaving terrorist bonding tertiary fighting	42	281.52	2002.13	3.8	0.0	55.2	6.4
1	50	6	sic	indictment emails kerala instantly navigable canteen hilarious mathew kilometre elephants racetrack wore grain mathew gerry roofed catfish gut unlike button stall	86	1113.60	2846.15	1.6	0.6	16.0	4.0
1	50	7	cardiac	tone genres crore venom corona rodeo patience greed scar chill	35	827.07	1393.82	0.6	0.0	20.0	11.4
1	50	8	skate	toes choreography jumps topping blocks	30	439.09	1635.69	4.6	1.4	40.4	14.8
1	50	9	barrels	unknown farmland smoke boardwalk coloured pastoral bits sand parapet infrared northwest structured barrel including relaxed manners sour niger handling convey holds offshore	97	113.96	2978.57	37.6	0.2	81.0	5.6
1	50	10	attorneys	vertex ivory indicating headlining savanna progression breakdown	32	616.41	2008.59	1.4	0.0	24.8	7.4
1	50	11	argus	elephants merry execution storyline quicker barrels strings exodus momentum wide royale smoke	37	207.93	1677.36	16.8	1.2	68.6	12.8
1	50	12	wwe	oswald cowboy tattoos domesday instantly wrestlers horses connectivity reasons tuning libre storyline adjoining structural corrugated conduct warehouses alexa tailor angles buffer	92	98.66	2719.05	17.0	0.0	77.0	3.4
1	50	13	companies	checkpoint clears throughout slater halfway each	27	349.22	2092.66	6.8	0.4	47.6	10.0
1	50	14	attorney	kinase compartment oxygen elephants clears visual nylon optic jets adrenaline wave tingling planes	62	409.28	1853.18	6.2	0.6	44.6	9.4
1	50	15	governorate	jacob halftime egyptians ik visuals increasing exhibit robes triangle chat bullets	39	1113.62	2663.41	0.8	0.2	19.2	5.8
1	50	16	malayalam	budge exposure induction note endurance airspace speedway cylinders armies grooves coli crore decent gills all the camera stories cockpit customary	82	22.57	2502.16	57.6	0.6	96.8	6.6
1	50	17	iberian	em slavery bets wrestlers certificates transportation cerro abundant know ancestry historia storylines transformation integral grain warehouse sector consists plantation claw tanks angles raft offer interspersed	147	204.94	3073.01	17.2	0.0	67.8	8.4
1	50	18	abilities	evident totals volcanic flawless cuff footprints scientology cartoons humidity	34	735.05	2059.49	1.2	0.2	26.0	8.0
1	50	19	fossils	fallon scarlett outta francs elephants patronage pacing asset continental formations per period diversified millimetres	49	237.23	2557.27	5.2	0.0	55.6	3.6
1	50	20	barrels	gustave empty thickness tape influx films parapet shale stint intricate scenario notification elephants barbed axes together csa preservation	61	394.26	2011.81	2.4	0.4	38.8	6.8
1	50	21	raj	barrow parapet workings raja mechanics versa decent crore amid reddish adrenaline ample	42	287.36	2267.66	6.8	0.0	58.4	7.6
1	50	22	marvel	iii dust sorted crore monsoon malayalam blasts jumps exposure ngc scenarios intricate cochin sandstone sec peat strongly fished saliva bees	63	1270.31	2713.57	1.2	0.4	11.6	5.2
1	50	23	havilland	psychedelic occupational lemon companies manpower etc airmen sand ether prohibition hypnotic wool evade flavour sherlock aircraft inverted	54	156.16	2350.12	7.2	0.0	65.4	2.8
1	50	24	lawyers	stating wheels modelling coarse crore railing jagger contain moods deposition dust	41	520.08	1695.62	2.6	0.0	32.4	10.2
2	20	0	casinos healing	hiv blood renew brew dollars disneyland winery burgundy healing dna concerning races elements boost signifies temperance	65	16.05	3582.63	68.8	0.4	96.6	5.8
2	20	1	alongside wherein	certificates laid oceans departed sunk intricate commenced moniker penned occurrences pertaining instructors laying panama along endeavors torah hebrew bearer diplomatic	95	63.24	5226.71	70.4	0.4	91.4	4.6
2	20	2	doping spelling	geologic netball inch lining gradual potion learn josephine nerves respecting bomb horseback vein	54	113.17	2788.43	9.2	0.2	73.8	6.2
2	20	3	investments gan	life horses murals foul fair ropes athletic wire improved trails possibilities grill intercollegiate material reporting gan	64	11.59	3500.64	83.6	1.4	97.4	7.8
2	20	4	hides girlfriends	nice shades colours depleted waves millimetres girlfriends emerald hide secrecy diamonds netball	37	231.21	2567.36	9.8	0.0	54.8	3.4
2	20	5	painter oils	evolved rail gloves father sculptors royalty discoveries evenly phase paintings diplomacy opium weren vogue loco santo casa paint	58	92.94	4447.28	7.6	0.0	78.8	0.0
2	20	6	barrel augustine	business friendly waves augustine boxes lines bubbles letters cylinders release reverse nose after	52	11.26	3286.28	72.4	0.0	99.0	2.2
2	20	7	fucked bruises	deter split baptized replaced waves levi punk adler murder graves fractures lenin changed chart zinc nor stein	57	17.75	2095.84	70.6	0.6	96.8	7.8
2	20	8	presidents tours	invaded gained nuevo regain freedoms var patton jim nato metal sculpture cramer sheath losers scotch thru murder radioactive wore muscle	95	54.07	3681.65	71.2	4.8	94.8	19.8
2	20	9	defense historia	knowledge historia merry newspaper falkland vinci clothed martial endurance somethin sergeant act veins consist athletic awhile talking vascular undertook	77	54.60	4484.79	67.4	0.8	92.4	9.2
2	20	10	discovery gmbh	condition gills firefighters migration stitches loved havilland towel decks calming serene jury dungeons pacing tissues where	50	20.34	3222.70	78.0	0.6	96.0	7.2
2	20	11	antiquities organic	secretary galleries accompanied indoor acc opaque antique nickel dino alive average million organic	53	52.70	3299.36	38.0	0.0	89.4	2.2
2	20	12	archives barrier	separates shells surf waves closure cassette tape sleeves protects selling outlines newscast grandparents	45	193.05	3039.52	18.2	0.0	69.4	4.4
2	20	13	auto insurance	decor galerie semester kolkata exemplary tracks missing hospitals expired occurrence insurance thereafter eh batted apology since folks customer ports	113	3.82	4351.86	96.8	0.4	99.6	2.2
2	20	14	casinos habsburg	swami him enamel comedians hearth unbelievable insurance scotch broadway tonight reorganized zheng commendation joker trey latter embassy viceroy forth	91	19.89	3843.00	59.8	0.4	96.4	4.2
2	20	15	thessaloniki aerial	puff flights replaced inversion veins hellenic until biplane attested whistle argent georg av	59	38.83	3737.01	31.4	0.0	90.6	3.2
2	20	16	mermaid sirens	woven ebony heal sunk smoked wreath closure circles retiring mermaid talents microphone rather wave until	50	22.65	2699.77	63.0	0.0	94.6	6.6
2	20	17	chartered landings	province relaxing ended sand gathered jumps winds havilland structured seas relaxing br curly teddy	52	51.05	2919.07	29.4	0.0	89.8	5.4
2	20	18	unseen ivory	quotes ivory asked answer covered audible shelf shoulder synagogue wires censorship clarinet goodnight eisenhower yao lacking plants	67	45.18	2619.00	41.0	0.2	90.2	6.2
2	20	19	mediation oils	lighting ref sapphire calming lavender wisdom robes bark motions ionic turnover	45	72.88	3603.57	31.4	0.0	86.2	2.4
2	20	20	historia sea	dart gust spanish mer historia spelling fabulous laughter legs sailed dressed until weave hair letters written dramatic alphabet	79	74.74	2470.80	31.2	0.0	83.4	6.6
2	20	21	profit	preceded colors	23	601.29	1728.62	0.4	0.0	22.8	3.6
2	20	22	forth healed	flight via additionally celtic gathered fae stemming runners darius forth metaphysical chaos experience bodies introduces count prohibition sera	82	102.76	4430.30	57.8	0.8	85.8	6.4
2	20	23	insurance nerves	pirates cornice punjabi filmfare settled turns engravings gujarati railways classify seychelles bollywood bollywood csi habits ranged drains exposition	78	25.40	4647.95	69.6	0.6	96.6	1.8
2	20	24	edmonton stockings	nokia clay indicated mrna veins adrenaline theatres grades uttered substances mastered sentences airplane neurons turbo rumors ear concerning	65	30.88	3884.51	51.2	0.4	95.8	5.0
2	30	0	potassium utilizes	parapet elegance glad kari compliment nationale beginning royalty empires exciting enjoyment introduction majesty potassium employer listings onto core representations guarantees assurance	63	5.60	3467.62	92.0	0.8	99.4	8.6
2	30	1	province handel	art potassium lion rosewood inward zoom venom reopened bravery ago ones nationale provinces rang behalf medal rebound answers mater surfaced noun ban	82	141.56	4392.02	49.2	1.6	84.2	11.8
2	30	2	cyclone kerala	shudder garland waves flashback sand shake nautical jain flair segregation cozy masses ob earlier grab science coaster	54	11.06	2043.10	69.4	0.6	99.0	8.4
2	30	3	hockey enrollment	biplane ck ontario outlet gloss apology sentences distinguishes hm ncaa uttered stern iihf immigrated acquainted historian originating linnaeus ang zur	132	3.76	4090.20	93.2	2.4	100.0	12.0
2	30	4	bats	cinematic rains transitions everything darker	27	250.57	1454.43	6.8	0.6	55.2	13.0
2	30	5	earnings tombstone	brutality dog rings suspended curtain guys punches shaved choke mats separation composure apache ira	46	59.27	2337.37	29.8	0.2	87.6	6.6
2	30	6	substance tablets	probation cans unanimous cameras sparkling stage jacket stockings arrest created confidence by coke fragmented graduation molecular animals hitting directorial sighting	64	29.82	2956.55	61.8	1.0	94.4	9.6
2	30	7	deposition celtics	cum multicultural whitman backstage presentation sandstone mining nsw courtroom picnic chamber merry merry ignited did war fergus commits fines hurling drop	84	8.99	3307.35	77.4	1.0	99.0	10.4
2	30	8	deposition euroleague	jews stabilization negotiation axial dispersal heal conclusion gabrielle premier europeans amateurs tapes emphasizes elijah employers edge ton membership pond favorable	62	6.64	4560.29	90.4	0.2	99.4	4.4
2	30	9	carthage aquatics	historical dramatically revival dominating injury baths tape kidd paced reflective jesse sand drumming rounds cubic carthage mediterranean	56	14.63	4289.46	66.0	0.0	98.2	3.6
2	30	10	colt butte	marine butte article autobiography accident colt sorry evenly egan india online nature gaulle ld revealed halo damascus expired metallic leave	85	11.09	3921.43	73.4	1.4	99.2	11.0
2	30	11	nerve augusta	cake nicaragua price nellie professionally optic cables yarn ronnie handled file machines millions employs augusta octave consist weights rose diamonds convenience stylistic	95	19.16	3347.47	77.0	0.4	96.6	5.2
2	30	12	decks wagner	java seals seasonal vida artwork edged recreational vents historia vida adele diaspora citizenship caring diaspora colonization earned provinces wagner nerve codex bitter hearted aura faint	93	21.49	4543.39	61.6	0.4	96.2	7.2
2	30	13	tombstone gambling	stampede horseshoe tingling jim stabilized sonora gamble twist exhaustion handcuffs spotting ex jail loop courthouse permitting	57	35.52	3595.21	49.6	0.2	95.2	3.4
2	30	14	olympian enrollment	illness quotes cooled paperback anytime doin inquired apps jesuits upgrading ease thru aquino singh msc atom prosecutor gymnast fresh email clarified italiana optical independence inclusive disposed	109	64.18	4848.66	65.4	1.2	92.2	7.8
2	30	15	trainers luftwaffe	hm armament prosperity taxpayers excellent jays enrichment enrichment taxpayer safety picture inexpensive rotor rails abilities adrenaline complained ease buildings flies	70	28.10	3610.95	61.8	0.4	95.2	9.6
2	30	16	ethiopia horses	elephant horses royals wooden corona muscle unprecedented magnificent libre crown dirt platforms rigged and with railing	63	11.10	2886.53	74.2	0.6	98.8	8.2
2	30	17	automobile insurance	liquids overdose monitoring against swat insurance hauling normally ecumenical recover aluminum irs taxpayers agreement offering claims cid stain car storm sketch invest	132	9.85	4377.64	84.4	0.2	98.6	2.0
2	30	18	tombstone rockies	smells efficiently owens best restroom breathing riff nos apache atlantis egypt casket skeletons egypt consolidated eerie tombstone infrared proteins wide	62	31.94	2695.37	25.0	0.2	95.8	9.2
2	30	19	msc cmll	cooled waterfront background savings unbelievable reporters scenery ropes scenes elephants firefighters reigns vet iaaf outlined patio courts midwest mixer radiating far	94	14.55	5139.22	75.8	1.2	98.8	9.2
2	30	20	karlsruhe efficacy	citations boo arrest bells needles deposition stampede optics haunting vomiting personnel knew reduction lasers dramatic crushed mill	50	86.66	2177.47	40.0	0.4	87.2	9.8
2	30	21	mysteries cameroon	antibiotics etched historical olds elliptic regal assured oxygen lagoon mystery parapet yao athletic overview secrets sloppy lighted fired orientation	73	20.79	2816.30	53.0	0.8	96.4	9.0
2	30	22	artillery jimi	layton exhaustion manner louder smoked shaking transparent rails drums employer thru volta jimi military	45	32.07	3960.26	63.0	0.2	94.4	2.6
2	30	23	wizards dempsey	die sheets reporters transcript wizards brendan certificates augusta patio condo pound baskets lining ease sporting agreement imp roundabout relief aqua lamps	121	2.94	3729.99	97.4	2.8	99.6	10.6
2	30	24	towel concordia	dog graded scrolls twists hilarious greyhound unbelievable circulating pastoral guaranteed condo elections announce ammonia bundles sulfur carpets bs wrapping trainers hats	88	14.37	3719.99	69.8	1.2	98.2	10.0
2	40	0	horses bassist	dragons shaky replacements alter scrolls ibn rumours leigh confirmed horses fronted veins ban like shotgun machines due greed deposition asylum	88	18.44	3282.45	74.0	0.2	98.2	4.4
2	40	1	bottles	provinces stacked filming bricks watt cinematic skills legally locations lost barrel darker badges laws reservoirs bears	43	198.48	2060.77	11.8	0.6	62.8	10.0
