4	50	21	aroma nwa storylines hercules	company reserves trials violence ease bonding aroma somethin nwa storyline connection certificates aura cinematic loved popularity gaius boost up was exodus birthday hike viewers vomiting antibodies	160	1.95	3426.12	99.2	1.6	100.0	12.8
4	50	22	composition continue mage reel	monument medal charm luck excellent augusta currency enjoy reel nat description anonymous abolitionist scenic trip adventures booming scratches smoke showers can vertigo casting stil propulsion angle	167	1.55	3223.45	99.4	3.4	100.0	17.8
4	50	23	words rapper substitution	horse helix follows flop closure openings filming clarity width intricate swim	44	38.08	1861.03	25.8	0.4	92.6	10.4
4	50	24	ivanov inspired oxide hindwings	paced backed colors reversal ebony alignment cellular treason ivanov io screen	42	16.93	2452.05	65.6	0.2	98.2	5.4
5	20	0	missouri quezon bakery commendation	since laurel rid aqua individuals gust learners concentration commendation grit gallant proven jars its enjoyable allowing ezio	53	4.45	3952.58	93.0	0.0	100.0	0.8
5	20	1	darby redesignated nathaniel unsigned	romano kern amended steamboat darby ashore uss nathaniel sunk overboard winslow patriot insert mrs mod molded with	88	1.99	3417.14	99.2	1.8	100.0	10.2
5	20	2	fossils medals provinces withdrawal ioc	die fingerprints thereafter lakeside athletes laughter utilized imaginative reconnaissance pursuit backstroke decorative expressions aqua develop narcotics provinces except custody	110	2.98	5049.52	99.4	1.2	100.0	7.0
5	20	3	oils healed limousine otis soccer	province conduct burying oils sacrament chapel wound publications honourable americas fertile table dario hannibal renewed uncovered shaun avalon laid olive	132	2.77	3904.48	99.6	2.6	100.0	14.8
5	20	4	legion nations hearth ordeal mage	communal legion establishes weave woven struck recruits uncommon municipalities gujarat beverages liberia bae healer indicators travels apologies electronically dragons arc	118	1.04	4941.54	100.0	2.6	100.0	14.8
5	20	5	clarity booklet doping expulsion hearth	swam puddle compilations exempt interception persons outdoors regarding vera unfair gran exact contrasted ample bush fields clarity	85	2.22	4013.59	99.6	0.6	100.0	7.6
5	20	6	vinyl honor jurisprudence hearth officially	guest settled trials highways ranged municipalities grains favorably stirling precipitation transportation violins grains averaged ceramics religions fireplace track judiciary shi	128	1.18	5100.93	100.0	1.4	100.0	10.6
5	20	7	acton sic colts	drama elephant travelled honduras avenues magistrate ernie carved rosalie settled silas acton rugby rails until alert complaints ease	66	8.81	3761.16	83.2	0.4	99.0	5.0
5	20	8	elimination vinyl salon leger newfoundland	conductors defeated vinyl scotch racers salon received merrill genealogical ivy picture hay shuffle horse navajo ears passports greeks pharmaceuticals knock	120	1.22	4700.70	100.0	2.6	100.0	14.4
5	20	9	cooperate walkover patriot neutrality ax	during renewed continue patriot neutrality hon americans active lea ax indoor woodward hat advance plank trenton	56	2.51	4013.69	98.6	0.8	100.0	9.0
5	20	10	tentacles ether	masculine absorption oils tentacles pathway intercollegiate examinations gerais resting avenues internet abilities elemental hinted abilities ernesto transparent avenues radiating	63	39.07	3889.93	57.0	0.4	90.8	6.0
5	20	11	synonym ingredients nellie	serum lighter committing recognised grams majesty heightened candi sections accession lengths aromatic	40	6.82	2602.41	85.4	0.4	99.6	7.0
5	20	12	continents dispersal albums springsteen accountants	practice romanesque railways nor testimony eagles thence wheelbase cremated anthology faso paved sacrifice taxes tape numbered unreleased departmental d	106	1.00	3520.48	100.0	6.8	100.0	27.2
5	20	13	blessed enveloped garnered fielded olympian	engineer tournaments affirmed citation leveled colts ebony frontiers horsemen espn claims woven transvaal mma ebony alternating shri heaved armenian	135	1.35	4851.22	100.0	1.0	100.0	7.2
5	20	14	sand gust	dad pick name waves sal morals discretion boo containment inland grain precipitation nausea tomatoes	45	71.59	3207.68	21.6	0.0	83.6	4.0
5	20	15	instructors founders poole bubbles	et halls artisans teachers concentration diversity et dark husbands art spells bubbles professions	45	5.54	3340.50	90.0	0.0	99.6	3.2
5	20	16	contrasted carved beauty totaled insurance	mad enriched separated graves wasn brakes novi storm jury course cnn stitches hook auto lead nutrients underwater	91	1.80	4182.53	99.4	0.6	99.8	3.4
5	20	17	phelps nellie totals	divide phelps columbian letters forewings exposition educators nellie emile proven colonial through concession boxes flanders	57	18.39	4796.42	60.8	0.2	97.2	1.6
5	20	18	solitude rug yugoslavia avalon saetan	wanted macedonian materials fisherman healing solitude introduction workshop intelligence sand disposition maritime sand burial swamps denise counterparts made alternating	87	1.68	3610.48	100.0	1.0	100.0	10.2
5	20	19	prohibition gameplay marijuana sims	clear areas scroll perspective smoke decorated scenery dodge sims areas saloon soda outlaw coke dye	51	16.24	2852.30	45.2	0.4	98.8	10.0
5	20	20	citizens ebook olympian wherein	pas ii citizens amended blended enlightenment sweating doubling distinctions valor excused sparsely assassin mandate into outdoors sherry	70	7.77	4041.47	84.2	0.2	99.2	2.8
5	20	21	salon doping naturalized taft highness	singh throughout highness formation republican titanium prologue nationale lectured parting letterman arroyo absorbing greatly substances double substance garde	85	2.06	3525.04	99.6	1.4	100.0	11.2
5	20	22	longitudinal mysore utilized fielded rana	buddhism www finish excellence marred sportsman motorsports curving refined sportsman substrates middlesex outing anchored rana telecommunications specification beyond agricultural	80	1.45	5805.32	100.0	0.8	100.0	5.6
5	20	23	comprising radiated barangay bengals	life mint peas sacramento rr weekdays hydra antique cum anchors folly played fountain barrels hon gazette localized lately camping	89	2.62	5335.49	95.6	0.0	100.0	2.0
5	20	24	wellness rematch countered domestically magistrate	healthcare again electronically whereas jed pursuant intercourse magistrate focuses ring findings raw substance tis robbie forth altered magistrate	93	1.40	4505.55	99.4	0.8	100.0	4.6
5	30	0	basketball enjoyable lawful ordeal conserved	contexts entertaining authenticity welcoming elsewhere coastline alternating ao internal civilians dart electrified investors offshore rwanda fellowship domain productive purposes caliber throughout confederacy oxygen	107	1.50	4634.96	99.6	1.0	100.0	4.0
5	30	1	adrenaline eagles lastly headlining burial	resolutions burial burial later outlaws bands tours majesty obeyed add album kicked thrash amplifier manner drummer	80	2.55	2792.27	99.2	0.4	100.0	4.6
5	30	2	trial courtship walkover doyle trail	crore interference smelling smoked hearing races ao completing introduction oven animals professionals freedom experience trail reduction safety dating dramatically anchors education doyle grant intently	115	2.11	4482.07	99.0	1.4	100.0	8.6
5	30	3	hearth horse introductions sbs ethiopian	microscope arena absorbing adaptations learning encouragement darkest ethiopia dan broadcast discovery through classroom audiences aid kent plant amended sap book nor papyrus leaf	114	1.38	4355.58	100.0	1.4	100.0	8.4
5	30	4	otis stating trauma rhymes imprint	vp jury studios prior antigen laid remix stated bronx hide releasing bronx chicago mafia elections producer stabilization bronx banks nor sera becker mare tae itself pear	106	1.07	4856.75	100.0	2.0	100.0	11.6
5	30	5	libre unofficial bets elephant	paws enclosed raft outdoors airborne bets iron bark proven ban arrest sob civilizations inverse lightning overlooking ferns	68	1.89	3503.60	99.4	1.4	100.0	9.6
5	30	6	barrels luxembourg subscribers boardwalk nsw	pension parental substances ease tenor regulate sturdy sic stat hercules yarn hose professionally content scandals doping recordings qualifications endemic hospitals	81	3.78	3076.78	94.4	0.8	99.8	8.8
5	30	7	mayo divisional grooves friendships cemetery	pakistan nerve friendship aside smoke provinces squirrels provided cemeteries complained filming documentary closure tours inch millimetres millimetres guam moist low tucked mm respects supportive	115	1.52	3778.03	99.6	2.2	100.0	12.6
5	30	8	ratings identified dumont rca steamer	ago streamlined changed sand rails firing tears railing dignity frogs cheer cbs hilarious odor ammonia clay money military flair	86	4.30	3031.46	94.0	1.8	100.0	14.2
5	30	9	cs enrollment olympian hire steamer	radioactive cheering scenery boxed country lakeside conviction smoky parting smoked locker savings solid coaching chests raleigh bike holes medals joints	112	4.15	3567.30	96.4	2.2	100.0	12.4
5	30	10	indoor rebound bengals goal baltimore	accountants assurance bail everton ample accountants railing baked offerings outside bengals oclc elemental aren boardwalk playing indoors sights worth ate temperate elsewhere	89	2.38	5237.55	99.6	1.0	100.0	6.2
5	30	11	scarborough determination bibliography hearth olympian	torah shall applicable gallons ashore dispose vegetables overview upon americans americans iron presbyterian toxin auspices legislation dispose ashore weigh youths opposing ign alfa male got crystal	107	1.37	3553.11	99.6	4.8	100.0	19.6
5	30	12	tombstone disqualification butterflies libre hardwood	ladder taped cannons towel scenery invested larvae stockings ropes paced hat horseshoe glory whiskey sporting elevation hasty dash angles flexibility	67	5.07	2629.50	92.8	1.4	100.0	14.6
5	30	13	upgrades prohibition utilizes greco chest	province retirement exemption boxers prop add conservative totally introduced cooler coke patio laugh americans lit jokes legs necks embraced with pillows pounder breasts	101	2.18	4074.96	98.0	1.2	100.0	8.6
5	30	14	argus stillness oils troop healed	knowledge level easier supplemental apostolic ashe ease clearer outdoors enjoyable healing laos immediately kinase disclosure illustrated pictures planes athletic booming hard legs ears assurance swallowing	90	1.60	3908.26	99.4	2.4	100.0	13.2
5	30	15	barrel rhino sponsor hearth healing	replace pipe letters newer reggae rhino speedway win stitches tribes heal letters gallant waves received yen gamble grain counterparts eased soldiers practical leaned heaving	117	1.13	4976.05	99.8	1.0	100.0	9.6
5	30	16	hellenic roosevelt walkover gentlemen edmonton	vice vera macedonia improved complexion sampson rugged int exterior hellenic patio relaxing patriot statistics victory finishes juicy privy money provinces stat nl external shows en enhance	162	1.28	5213.06	100.0	3.4	100.0	11.2
5	30	17	stated interference tombstone intro hades	casket graves workings ore bulgaria ease clarity deposits inward greek rex destroy cure veins convey toned hardcore forehead skies macro explain approximately	66	3.94	4485.14	93.8	0.4	100.0	7.0
5	30	18	coaching vida offense elemental radiated	accession lurking vent assist retiring careers enjoyable professionals upgrading odyssey golf electrified efficient slots direction countryside article inch learned atv bicycle organic rebounds ivory	154	2.91	4901.79	96.4	1.8	99.6	12.2
5	30	19	storyline adolph grams boardwalk deck	chef added outdoor flair meantime popularity railing scenes ban patio rope majestic chests pictures ab pictures engines lively muffled ma ones handheld vest	91	7.12	2986.68	81.2	0.8	100.0	13.2
5	30	20	carthage booking utilizes tombstone tonic	motions rail cotton upside swords hose stemming parting investigators buff attention brewer horseshoe raw tale cooler packed adrenaline libre	72	3.21	2840.01	97.6	2.8	100.0	16.0
5	30	21	companies insurance fatalities walkover tombstone	aw exhibit automobile internal documentary il reel wrestlers improvements investigation brakes horses eireann shock ugly lattice suspended ludwig evenly lines bonds homemade whatsoever	99	2.89	5341.47	98.4	0.6	100.0	3.0
5	30	22	hire goin atv myrtle defense	podcast yourself outdoors train supplied narration graeme multimedia bethany starters confess caves packed parking relaxing throughout raft csa bush strip condo enjoyable lane	101	3.63	4086.03	95.8	0.8	100.0	10.2
5	30	23	wembley polo resided myrtle healing	maritime partnership lea internationale dispersed il meet informed elizabeth informant relationships holiness healing purse paved rugged combat shoulders borne leaders winding pat four knot heads internally	133	1.71	4051.64	99.4	1.6	100.0	12.2
5	30	24	pei armor autobiography selections oyster	demonstrators armor trumpets shells shore markings ribs observers overhead intervening lighted sand surfing reissued autobiography sang alcoholism free coward dynasties sculptor case	131	1.20	3852.80	100.0	2.6	100.0	12.8
5	40	0	losses utilizes racks substitution redemption	helicopter athletic victory curls accomplishment withdrawal discouraged joyah flop peptide admitted lottery gilbert auditions adolf fan hero closure range hairs cans geography economical following racks	120	1.73	4196.22	99.4	1.4	100.0	8.6
5	40	1	formulation learnt showcased overdose boardwalk	videos won strand drug commenced safety coke indus tasted backstage xvi ceremonial exhibition oscar cardiac allah alpha indication quarterback inhaled conserved crambidae cancer rubbed oro opinion contracted	117	1.14	4354.57	99.8	1.4	100.0	11.2
5	40	2	greco inch selections cecil elevation	bjp assurance assurance sigh cecil ardent composition offering spectacular accusation unbelievable sympathy reporters purchased patio espana patriotic carpet freedoms camp barn pictures spotted piled buildings suv local	166	1.75	3788.88	100.0	3.0	100.0	16.4
5	40	3	supported hendrix tombstone toured vibration	soldiers rpm extinguished fire thicker glass pyramid provinces healthcare betrayal accusations support proper duties silence thunder hallways stampede flea sued	83	2.92	3459.77	98.4	0.0	100.0	4.0
5	40	4	bulb nm ether scenario avail	automation silk scenic conditioned ether picnic lanka cell presentation raft elevations nap roaming packed emerald telegram vuelta farmers grant interfering podium male solid	104	3.61	4653.82	95.8	1.2	100.0	5.8
5	40	5	medina promotions boardwalk mclaughlin horses	jews copper entertainer horses philadelphia peyton seminole outlawed evenly offering medina expeditionary em closure confidence supports explosive detainees patton idf biomass lasts magnolia jewish fingerprints seeded	138	1.51	5318.78	100.0	1.0	100.0	5.4
5	40	6	genealogical continue aquatics argus sponsor	valor truths scenery extremes outdoors amazing unofficial freedoms afi neutral girlfriends add colleen acidic genealogical fin wide reflect buy eel therapy classes	80	1.24	3956.35	100.0	1.2	100.0	9.2
5	40	7	enemy offense scorer hellenic	reign rotting radius evenly presentation relaxation lottery attic rosary insulation contraction enjoyable scenery teammates dress attire attire stemmed limp restraint smelling weather	100	7.74	4245.25	84.0	2.0	99.2	9.0
5	40	8	elk tombstone adrenaline depicts	lenin barrels extinction ways adrenaline adrenaline compression grain mental probation horse scenery vocal flair mocking	66	13.76	2620.30	59.2	1.8	98.6	14.6
5	40	9	coaster activities sirens	story inversion humour ounce exodus oxygen spinning locked ropes biking hugs parking	40	51.01	2309.03	19.2	0.0	90.8	8.6
5	40	10	burial lyrical supported drummer coroner	bolsheviks support stopped persecution kurdistan freedoms lyrical copies jesse uranium crowns coroner darkest horses had fredrik supported clarify baskets pere gb surrounds mortal greatly after rumours skate larvae	209	1.09	4726.59	100.0	2.8	100.0	12.8
5	40	11	stella redemption basalt hickory carthage	aerospace less cannons gain ports vents ease trail provinces humidity finish freedom cheers rpg description storage article beads hero autobiography unchanged berber except angles separated vane	117	1.64	3735.46	99.8	5.4	100.0	19.8
5	40	12	libre symbols boosted xbox tombstone	free solid stitches uncovered disappearing battles eased ways withdraw deployment improved hike revolver lined striking	56	3.98	2711.45	93.6	0.0	100.0	7.6
5	40	13	persecution booking reorganization oils stella	augustine alcoholic memoir comparison spending columns stella sunk cheaper wolfe boat enjoyed waves attorney scotia scene retention easier hired robes hire wax arcs brackets spinal mold flames	144	1.32	5224.61	99.6	2.0	100.0	9.8
5	40	14	persecution riaa brendan libre amulet	scene retention story rest easier ether freedom unanimous accommodations armstrong active observation transported safety invested adrenaline explosion scenery passages closure life irish vertebrae exercise	93	1.75	3167.55	100.0	3.8	100.0	16.4
5	40	15	valor cebu ethiopian carousel	acts carousel accreditation predictable ropes ease orr throughout homeland popularity efficient overtime nautical enjoy ordination ample soaking gust passages soaking laundering ear	86	2.96	3382.31	98.2	0.8	100.0	9.0
5	40	16	mathews heritage signed kannada flavour	characterized tamil jewellery tunes stoke clicked hospitality amidst fest condition evolved charred meyer electrified shirts camouflage veteran regal deco robe executing blend shorts closing	109	1.52	2395.87	99.8	1.6	100.0	8.8
5	40	17	intro seas lyrics abyss	ref tops oceans nothin probation colors helix continents proven	36	10.43	2687.82	75.2	0.0	99.0	5.2
5	40	18	formulation waves foam lifeboat	midst breakout nerve animals foam smoked float hydra formats clarity clarity flood oceans	51	21.74	2433.25	51.6	0.2	96.2	6.8
5	40	19	casino trail arias reapers	jim blocking injury rugged knife tips manpower sweep clarity mineral flight trace scenery copper safety path cleanup haze	71	6.59	3724.50	88.2	1.2	99.4	7.8
5	40	20	barrels kemp junction mandal chariot	table path additions sr curse grooves fcc berth bonding ease appreciation charms epic chariot gurney consolidated zoological temples barrel nicely	92	4.35	3214.78	95.0	0.8	99.8	5.4
5	40	21	barangay showcasing southport laguna	mule join remained pulp mala sic lagoon stating sand outta banking clasp marine colour annually millimetres depth www flop pier oriental salle caller sol	91	3.16	4617.18	97.0	0.2	100.0	4.6
5	40	22	w oxidation anonymous greco redemption	attorneys bonding portray boxed storyline viewers historical artistic pictures shuffle thousands sherlock readers sad immediate mixtape diocesan officers stuffing homemade length	89	2.56	2697.48	99.0	3.0	100.0	17.4
5	40	23	became steamboat wwe graves enrichment	airplane freeing aluminium windows absorbing intimidation graves hm averages horses ancestry suspension lifeless closure potassium suspicions weights saliva fl	68	8.98	4089.47	72.0	0.0	99.6	2.8
5	40	24	mayo walkover raced juveniles saratoga	movie cushion draw appears monarch amulet exempt discharged galileo markings money persecution irregularities laurent journalist rescued alexander mohammed races press yesterday stirred patio inspect prospect their	192	1.26	4679.26	100.0	2.8	100.0	12.2
5	50	0	baptism tombstone hardcore extensively exodus	lenin slavery furthermore alternative quit pinnacle dedication gills outfits smelled hallways admitted outlaw outlaws masks intimidation betrayal dirty interstate adolescence tumor skaters cancer glands	87	4.42	3734.30	92.8	0.2	99.8	4.6
5	50	1	steamboat nm drums cornice graves	days added radiating barrels chest evident laughter flu friendly shaking groin strengthen graves progression thousands storyline sand detectives nothin pueblo historical trailer ghz parade story forearms forearms	111	7.88	3791.81	76.0	0.4	100.0	9.4
5	50	2	jumps area occupational narrated	jumps cue flop plaques animals jump colorful amnesty coordination anytime fires olympic	39	21.83	1894.54	48.6	0.4	97.6	8.2
5	50	3	malayalam pounds captained acronym procession	amazingly query amor banker oakley displayed etched malayalam livery easier road deposited thousands viz fond grains downfall entertained malabar secretary according ely galen mandal after	118	1.86	3544.20	99.6	0.4	100.0	6.0
5	50	4	spiders tombstone pictorial sponsorship raleigh	russians mounting lore authentic stephenson relieved laughter backstage spectators robes conditioning relaxed hardcore dial gel actresses transfer wore clinging sanctioned vinegar heated roofed plastered certain spiders	140	1.80	3384.89	99.8	1.2	100.0	13.0
5	50	5	argus barrels utilizes tombstone walkover	horse graves progression bingo markings lastly racetrack employers gambling sand rails averages footsteps criminal hop cylinder wizard stories argus to dispose well suitable staying	98	4.23	4333.75	96.2	0.0	100.0	2.8
5	50	6	virgil areas strand exhibition myrtle	islam resulting females weaving internment intimidation closure textiles jacksonville boardwalk slavery casting safety portray visual vein storylines cheryl oz jessie convinces date sheng shapes tao ligand seeds notice	147	2.48	4212.31	98.0	1.2	100.0	8.2
5	50	7	oliver attractions towel jacobite malayalam	maps unique ease grab radius determination jacobite tablet relieved hectare baronet tram prefer bonding visitors goo ceilings shady pet meal facial humidity reel areas regime	132	3.06	5254.27	98.0	0.4	100.0	5.2
5	50	8	tours hate parted hardcore sabbath	wars replacements cremated die metals lungs rotting signs temps corpses chamber glands liter breakdown vans refused theater separating anymore llc circulated boycott mutiny cartel kicking	104	1.85	3794.32	99.6	0.8	100.0	7.4
5	50	9	argus literacy wingspan deposits activation	max wins magnitude withdraw freedom hades exodus geologic fallout arrest keystone bonding oscar yell coats nucleus briefing glands	78	7.03	3559.98	85.0	0.0	99.8	2.6
5	50	10	occur completing boardwalk promotions spins	stop points featuring donation waves clicking elimination combination row spins available reel	45	4.47	2768.30	92.0	0.2	99.8	7.6
5	50	11	galicia reel management kannada etched	pas sequential choreographed knot booking secured confidence parapet hospitality ease sodium rotation enveloped supervised chord reel consolidated rake mayhem gun vin supremacy taped	110	1.60	3357.71	99.6	1.0	100.0	7.4
5	50	12	lewis oxide kinase attorneys everton	vendors radial th arthritis bonding networking inversion amino accommodation arrest relaxation tram muscle rogers terrific excavation ceiling unanimous	64	4.24	4777.86	94.4	0.2	100.0	4.8
5	50	13	tombstone drugs ligand beaux	jim cycling eased ngc transcription tighter restroom racks read relaxed handles backstage elements record protective testosterone organizing reduction accreditation fight confidence sped interesting excavations gunfire	108	4.62	2863.73	92.8	1.8	99.8	11.4
5	50	14	wits downloadable activation donation blanco	jim tonnes adrenaline paranoia daily towel relax consolidated observation pockets adults closure masks sand linen dramatic cameras overnight carthage national rust lending or berber dance blanco avenue	156	2.38	3814.08	98.8	1.0	100.0	10.0
5	50	15	cricket kannada premiered	commando crore wonder share batsman mast film cricket guild	38	6.51	2906.91	88.4	0.2	99.6	3.8
5	50	16	uncle terminus attorneys substitution kinase	laughs interactions characteristic neat handling synthesized recognition flu exposition descriptions birthday impressive leukemia bonding adrenaline closure proven accommodation hereditary neat collegiate doha fir gunmen	107	2.58	4573.29	98.6	2.6	100.0	9.4
5	50	17	won crore narrated themed mysore	joseph port closure corporate seasons etched patience kannada jokes sensory jaws acres pal smiles dunkirk filing award bonding orderly	84	2.24	2410.79	99.0	0.4	100.0	6.4
5	50	18	ebook crore offerings avail trail	machine presence circulation gripping parapet story adrenaline storytelling inference hose consolidated grit proven butterflies unite tactics veteran algebra alumnus anna livery trained accreditation handled	93	2.06	3326.82	99.4	0.8	100.0	7.4
5	50	19	toxicity continue recreational victor oxidation	encompass decreased rehab sec overdose booked drugs ambulance clicked seizure hydra checkpoint nap beg	48	10.22	3254.20	72.4	0.0	99.2	4.4
5	50	20	chimney prominently boardwalk freedoms bernstein	ibn visually distance cannons explode blocked visitors internally chamber mustered laugh nationale engraved safety dunkirk bark bernstein paving philadelphia column boardwalk	98	7.67	4070.88	77.6	0.4	99.8	3.6
5	50	21	fictitious tingling malabar hoop telangana	rush memorable thrill tran stat tyres chevrolet groundwater tonnes hospitality offence players slaughter wonderland infrared blasts counsel gonzaga shivered avail medical harp offered such transmission	119	2.89	2976.55	96.8	0.8	100.0	7.2
5	50	22	libre crore secondly deposition nwa	blouse witnessed spill thirds induce gallant armour cinematic kemp adrenaline shutter bribery choreographed duties oxygen banks credible captivity flashbacks justice	64	3.06	2448.48	97.4	0.2	100.0	9.2
5	50	23	sphinx encryption pyramid substitution	funeral closure closure outta rest storyline viewers pyramid encryption view rat double total discovery air	46	8.96	3066.74	76.4	0.2	99.4	7.8
5	50	24	storylines floor hercules streak argus	ira exhaustion calves scenery attire wyatt debuting unbelievable excitement safety confidence purchase nerves beating resigned geologic patrols wins truths accreditation hair tables nonstop weekends scented convection sidewalk	129	1.43	3703.53	99.8	2.0	100.0	16.4
