3	50	3	cricket relieved crore	census ask gallantry sporting remember overnight etched introductions hectares tonnes charcoal coat crore enabling footprint sic wise	53	9.20	2193.04	80.8	0.4	99.4	5.4
3	50	4	operators betting spins	lewis sacrifice spins withdrawing closure parapet offering clockwise bets chat open facial tonnes	52	6.23	3148.09	91.4	1.6	99.4	11.2
3	50	5	abdomen activation miner	skeletons reductions hiking ripple adrenaline enjoyable clap exposure pounds parapet copper gypsy stat tremor ease relaxation sudanese tragedy mist humidity ncaa exposition periodic stabilized	132	14.60	4275.64	83.2	1.8	96.8	8.6
3	50	6	gust pdf lucan	mab open trails sand colbert koch scenery preston athletic artistic inca retention ease blocking mapped poisoning warrant algebraic grab accompany axes	88	6.72	2950.50	83.6	1.2	100.0	9.2
3	50	7	investors transcript hindwings	rpg freedoms upgrade tighter alcohol casino confidence vaccines hornets availability relaxing hundreds retention soyuz adjustable agents reinforcement consolidate camouflage ribs ivory sections exhaust	118	15.67	3163.22	64.8	0.6	99.0	7.6
3	50	8	kansas spelling	sis closure hairs dropped limestone zambia train comb barbed hurdle wears	39	146.12	2100.90	1.6	0.0	61.6	7.4
3	50	9	verb learners oxide	gallo retention pulled medications bars chat inscriptions burial lac introductions disappeared potter cocaine noir workshops loyalty grandmother beamed sympathetic mitochondrial cobalt son straight inclusive	100	10.61	2485.58	62.8	0.6	99.8	6.6
3	50	10	wizard activation displayed	societies label indicated transparent cycle represent trillion aqua paint differently wizard	44	41.77	2726.62	50.4	0.0	90.0	4.6
3	50	11	gustave assurance securities	notwithstanding bank gallantry sic equity brick elephant wire conducting stimulation erected inscribed proof rake investment detectors prisons limited rapid	64	31.69	3101.96	42.2	1.0	94.8	6.0
3	50	12	trigger minerals visuals	ravi amino bounce colors explore appear	29	17.95	2053.26	71.6	1.2	96.2	13.6
3	50	13	argus proteins ferrari	formation toxicity adrenaline intrinsic sphinx free negatively activation lewis fra fluorescent calming first dramatic swelling fcc	62	13.79	2516.72	80.2	1.2	97.2	9.4
3	50	14	enlisted earthquakes bassist	royalty earthquakes animal zeppelin tick porn musically downfall mourning penetrate prose	43	17.67	2979.75	62.4	0.0	98.4	4.0
3	50	15	steamboat tablets nwa	gunfire flexibility joining braking drainage boardwalk enhance nerve waterfront extract riverside boat dramatic presentations splash prose adrenaline introductions spontaneous vacated adding amplitude	112	9.70	3459.31	76.6	1.2	99.4	7.0
3	50	16	lucan gambling clarity	gambling radius microphone exposure freestyle intimidation asa added nylon nylon sleeping intuition	50	12.86	2743.20	74.2	0.8	98.2	7.4
3	50	17	doping abyss snorted	commitments doping musician mourning pike restart mafia luc elder clean disciplinary braking fractures	45	13.82	3792.95	77.6	0.0	97.8	4.0
3	50	18	pyramid carthage occupational	protesters evident sand herring closure natural convincing jumps bricks emotion alberta rush tell parapet graves prints excavated streamed concentration demonstrating	69	71.09	2476.92	6.8	0.0	86.0	6.0
3	50	19	attorney subunit receptors	incorporation atp plaques tiger signalling enjoyable jo adrenaline courtroom teammates hollywood lengths others wolves abolitionist flex drones assurance	73	20.02	3980.63	68.0	0.0	95.8	2.2
3	50	20	oath porn securities	prevailed clicks drying weave filming portrays mingled wickets porn rhythmic filming yo occurrences	44	35.15	2301.89	19.8	0.0	93.8	5.2
3	50	21	transcript touchdown coaster	district rhymes racist jail finals unbelievable erect pigeons obe vertex graves decreased entourage caste fir	53	61.84	2652.43	22.6	0.4	85.6	9.6
3	50	22	recipe substitution cells	media substitution surroundings excellent enjoyable perimeter convenience viewers turnover installation regime owners discover enjoyable reception immune arteries finest ordination solvent	86	5.95	5201.74	91.4	1.4	99.2	9.8
3	50	23	apostles parapet beans	characterization presence pilasters honourable cyclic longevity brakes length mathew inception interpreted paced committing answer bean tackles warehouses sherry amazed	66	52.35	2283.75	14.6	0.0	88.0	6.6
3	50	24	miners substitution mixtape	cycle relax add scenery educated relaxation adults nwa carriage description greta abdominal casino closure pathway pool grimm overnight improved rm gel priesthood casting arsenic regulated	185	4.75	4129.38	92.0	1.2	99.8	8.8
4	20	0	adventure healing woodward aquitaine	he rivers rank explanation aden ears bibliography heal bells manuscripts r aquitaine testified rash provinces laurel horses	72	1.65	2653.39	99.2	2.6	100.0	18.8
4	20	1	arrow ax residences healing	sweater beginning disappearance connect trance disclosure paved lodges midst lightly productive chat avenues winding heal arrow throughout	62	8.71	3740.80	84.2	0.2	99.2	3.4
4	20	2	odyssey mma tombstone adele	biodiversity ushered trauma thereafter frontier barge introduction busted journey counts adrenaline academy hides murder cinema underneath mascara	87	6.25	4460.28	89.2	0.4	99.8	3.4
4	20	3	sealed wings hearts newfoundland	royal feel wings seekers stamped hearts healing abilities casting calgary religions slots venom differences trials rum raven geologic healing islands	115	1.25	4961.53	100.0	2.0	100.0	13.2
4	20	4	assimilation beads	oxygen conversation friendships stories africa tao contain rounds discovery endurance roam tribes ease holocaust organic	50	185.71	3611.08	9.6	0.0	63.4	3.6
4	20	5	injuries yes condo policies	firearm recognize admitting shit gandhi assessments inches augusta damages nations condemned demon sikhs householder governments alpha settlement rocky wound prints	136	8.25	4870.58	99.6	2.6	99.8	11.2
4	20	6	beaux handball rockies outta	duct kettle smelled untitled outta neutrality wires outta sherlock rockies investigators dared darkest vocal natural deposits stemmed minerals	63	3.67	3005.35	96.8	2.2	100.0	16.2
4	20	7	amenities queer swam athletes	kettle breathing nap inclusive swimmers sunk lin vessels subdivided atoms withdrawing snaps excused anchors	53	5.88	3391.44	88.6	0.4	99.8	3.2
4	20	8	scratching curiously penned quezon	unchanged stirring reign highness stain fibre subdivision uptown excel mercantile wonderland facts dramatic knighted smooth seeded spelling tug	84	1.50	4790.07	99.6	0.0	100.0	4.2
4	20	9	cricket codex springsteen	copper secondary couples wine abundant healing traveled renewable renewable brush candles provinces oil mayors historia pri markings mm tad	73	7.18	3453.04	84.2	1.8	99.6	11.8
4	20	10	custody lesson malayalam afrikaans	congressman grip inside qu tighter adults kidd afrikaans indoors jolly skies amidst fest gauge underneath	54	15.71	4103.13	55.2	0.2	98.6	3.8
4	20	11	regiment heal jimi	rama rounds tighter outta heal jimi pillow flood wounds pneumonia column tubular infiltrate salute mmm	50	5.96	3130.24	88.2	0.2	99.4	4.0
4	20	12	optical radiated radiated utilized	taxation quezon discoveries privy upon surrounding rounds moderately dirt ample innate crystal effects carriage highness affiliate runners introductions closed	80	17.69	4863.89	61.8	0.0	97.2	2.0
4	20	13	metre saratoga selector elephants	reason centimetres exempt freedoms solid institutional elephants deer leagues cc evident elevated outdoors playoff warfare rails	62	4.73	3848.65	90.0	0.0	100.0	6.2
4	20	14	fungi breuning syndication servicemen	character conducted meaning televised din railroads denomination avenues gallant dimensions thru ammunition hispanic segregated frontiers miscellaneous crusaders due breath vatican	147	4.37	4444.83	92.4	4.0	100.0	17.2
4	20	15	governed spiral marines	nocturnal respect spiral marines lit darkness fade depth workings piston whom bad clicked	48	13.71	2916.19	74.6	0.0	97.4	2.8
4	20	16	allmusic healing armory weston	vanity unesco edition solomon weston province italy lord exhibits wherein strokes musically how spaced recurring hush lecture	66	2.45	3866.71	97.2	0.6	100.0	7.0
4	20	17	peoples mounts redesignated savannah	dinner permanent engages surround horses lbs vaulted narrated weaponry savannah wonderland open occurrences bordered buff nationale hourly degraded ate monsieur	87	2.40	4030.93	98.4	3.2	99.8	13.8
4	20	18	kannada cheating nc	gas disc hopping foam	28	62.18	1942.94	7.0	0.2	84.4	8.0
4	20	19	quezon whereupon discovery sedan	aluminum inline endurance enactment effective woven aircraft thereafter passages inland clarity interesting comets stories pavement	76	9.93	4748.95	81.2	0.4	99.2	4.0
4	20	20	volvo hearth rack	sided beers maui folded hearth counselor exemplified investigators cases hung sectional briefcase crates vents somber italics you seniors upgrade	63	23.87	3837.36	63.4	0.2	94.8	3.8
4	20	21	ventured wherein borne chartered	footprint which beverages vigor entities eroded hospitality reprint counterparts trim batted interred swords laundering learners blessed clad thereafter accolades armament	173	1.32	5008.18	99.6	1.2	100.0	8.6
4	20	22	ceilings pods offence hardwood	oil wardrobe costume funny pods cop adventures imp felony criminal accents growth greens thompson relationships casual extinction	64	8.15	4353.39	76.8	0.2	99.6	2.4
4	20	23	tribe plato psalm	marital annals syria tent trumpets bibliography tribes titus romans hospitality judaism drug valor centuries candace consider affairs fountains whatsoever	96	3.18	3652.80	97.2	3.4	100.0	16.8
4	20	24	augustine discovery quit taft	synonym renewal witness rome dealers discoveries minerals brighter rhine rwanda substances plus disposed filters thereof papacy commentary theatres	73	4.68	3669.62	92.2	0.6	99.8	8.0
4	30	0	commenced penned olympian iihf	faculty innovation paved immersion stitches bundle domestically tackles citizenship schooling valor ebook deposited schooling somethin cdp featuring ballots document republished christie vatican servicemen mirrored	118	1.21	4787.81	99.8	1.2	100.0	9.6
4	30	1	rpm inaugurated myrtle reel	gust legs transitions laugh jokes rounds nellie inscription sand chronicles introducing reel buying myrtle headed ipa confederate tab	84	1.90	3637.70	99.2	1.0	100.0	12.4
4	30	2	uci withdraw prosecutor boardwalk	officers asian prosecutors professions investigators offer limp prosecutors archived herbal grammar tired excellent packed affordable lenin format podium vibe governing upstate withdrawal decisions indoor supportive	139	1.28	2441.39	99.8	5.4	100.0	22.8
4	30	3	floor philippine furthermore heraldic	canada pt presidential upon lawful bwv jude exclusive apologized acquainted sincerely corresponded brandy loyalty underground taught mischievous acquainted loyalty have rid again khyber sha blade	123	1.48	4668.29	99.2	1.8	100.0	10.8
4	30	4	sponsorship rhyme donate smoky	intimidation freeing overall rest goodbye regulatory crates dating jim tape aqueduct donkey bottoms wraps hats	47	12.64	3361.38	59.4	0.0	99.2	4.2
4	30	5	defences barrels gameplay tombstone	down jump dungeons battleships graffiti watered smooth adrenaline enjoyable asteroids spin background stars flames nausea scattered radiating barrels concussion combinations	58	3.31	2229.65	96.2	0.8	100.0	17.0
4	30	6	pga documents gettysburg elk	province incorrectly casualty truce detainees learned ineffective appendix afghanistan dvds inflated reorganization wounded drafts ammunition familiar compression entertainment generalized elk marked an hung common	129	2.74	3053.93	99.0	6.0	100.0	21.4
4	30	7	celtics vinci gambling	detective tick evenly arrest adrenaline leave vinci confidence ease kc eggs shake wave stemmed retention impressions asa force ordination	59	6.92	3331.37	87.0	0.8	99.4	8.0
4	30	8	vinyl olympian astoria	buddha auditorium gauge coroner format throughout extensively shooters healing wounds anarchy dl trial fan defunct astoria written favor tapes expeditionary junta ou dictatorship jenny mat	100	2.18	5520.51	98.6	2.4	100.0	10.4
4	30	9	fished paso ceased settlers	fucking gauge selections evenly deliberately cemeteries scenery nature unbelievable paso paso veins concerning celtic fishing record childbirth dealing paso al cara iraq swayed whatsoever	98	3.78	4355.67	97.6	1.0	99.8	9.8
4	30	10	augustine lasers knicks ax	table aromatic background beach surf trails laser patio chairs enjoyment murals effective confidence carthage certificates studio employees policing ax pipeline prepare incredible	98	1.67	3319.41	99.8	2.0	100.0	13.8
4	30	11	norma revived walkover boardwalk	beethoven reel dealers add staged cinematic revived champion casino shaking relax greco fide affair boardwalk socrates tab casting items	81	4.82	4012.83	92.6	0.4	100.0	5.2
4	30	12	rca lodges ngc tombstone	dive halo whites enclosed depth blooms efficient defense flowers flowers cyrus packet lynch princes rutherford advise surveillance	68	7.38	3460.56	82.2	0.8	100.0	6.8
4	30	13	vendors objective taekwondo evacuation	motif trusting intrinsic advisers gust stakeholders gather cooperation thoroughly hangul centered evacuation oclc oclc iaaf seafood madeline utc copyright asphalt projectile	95	4.93	4060.64	95.2	0.8	100.0	8.4
4	30	14	bamboo adrenaline accomplishment enrollment	volcanoes airmen illuminating entertaining amateurs sinking ropes massage luggage propped round juicy temporary armory libre trails plus monasteries indoors legs endurance hurt dye	125	2.80	3133.09	97.0	3.6	100.0	15.8
4	30	15	imagination tourism ashok boardwalk	theatres woven popcorn ticket classify etched mural elephants hurdles friday corporate boardwalk lore entertained copper temple inserted rustic dared material	66	10.34	3457.08	69.6	0.8	99.6	4.8
4	30	16	gameplay sands spins	coins upgrades spells wheel roam bars bounce courts fire molecules	42	19.92	2884.77	66.6	0.0	96.6	4.0
4	30	17	colts paces walkover	dna kissed dowager oils internacional wonderful renewal www neck turquoise intercontinental racing rpg storyline prix shifters previously yesterday armenia disappointing proper topographic paperwork grandfather favoured uncles strides	148	1.53	4454.93	100.0	2.2	100.0	13.6
4	30	18	carthage mayo gaa park	tricks honesty volley chilling wake sand flair grave consistency ropes relieved formation stampede intimidation dec history reach strap again mayo rampant bitter replay	99	2.37	3942.37	98.4	0.0	100.0	2.8
4	30	19	gangster adler playable exodus	provincial colours avalanche poppy majesty smoke clarity effectiveness gangster can blacks handled grenade filters	51	15.35	2514.46	61.0	0.0	98.6	6.4
4	30	20	steamboat introduced quezon bouts	assigned mat bullets gust opponents provinces weapons introductions hairs cinema endurance regal taped shredded protective fists whisky	72	3.86	2608.23	93.4	1.4	100.0	10.2
4	30	21	arrest online sponsor thoroughbred	abc marne solid race gorilla arrangements unchanged unnamed yesterday biography bradley sergeant reporting suspension closed artificial adult sulfur baccalaureate	86	1.69	3450.53	99.4	3.0	100.0	16.6
4	30	22	italy crore adventure stint	potter swearing storyline inch sporting intricate jail charges humidity thrill revolt avalanche stamped store membranes loco plants	73	5.03	2711.09	91.2	0.2	99.8	9.4
4	30	23	superfamily olympian attested savanna	earth ioc rn ancestor pavement favorably ease attested duane darius stops parting scar mm internally savanna titles professionally handled albums organize volatile	141	1.45	5252.28	99.8	1.8	100.0	6.8
4	30	24	steamboat boardwalk storyline sponsorship	pow liquid dry wave boardwalk seating smoky witches beaches aw sand ski astronomical backstage gm africa solids jagged victorian	68	3.65	3368.20	96.2	1.4	100.0	12.6
4	40	0	adventure casino patio hades	arrest improvements skill outdoors briefing accommodations clearer blanco instructors confidence canned relaxation casino adrenaline closure scenery freedoms daphne priority jars reconstruction molten setting dipping	123	1.39	3567.62	100.0	4.4	100.0	17.0
4	40	1	wwe wells tombstone midland	trailer lifelong ton cubic smoke reason cowboy freedom strings observation historical wires humane transported invasive internet barrels ample ceilings	62	6.89	3926.91	82.2	0.0	99.6	5.2
4	40	2	curling adult oclc oxide	listener casimir deposition earnest afterwards supplemented equestrian exposition amelia embracing aix inquired rumors employers dictatorship freely hoffman highly editors islamic descriptions tonic rim highlight	97	2.48	3280.82	98.2	1.4	100.0	12.6
4	40	3	msc rpg towel utilization	probation etched phenomena unbelievable learners backstage reduction ambulance stu closure rails weave taped coping wwe dad tables upstate iberian dirt showered packed arrangement dramatic badges	105	5.91	3508.85	87.8	0.6	99.8	9.0
4	40	4	diocese wits verde wwe	fold patio consisting xx apartments apartments swat scenery anxiety rest rails sand olympic lining wwe migration pedal arise behind furnace seizures nc metis masked	97	3.67	4059.00	95.4	0.4	100.0	6.0
4	40	5	ems absorption improvement arrest	pilot clarity greatly ioc retention weed increased ether ambulance personal transcript official arrest stimulated indirectly concrete depression accession raw oboe hats emerson introduction	87	6.36	4890.03	92.4	0.2	99.2	5.6
4	40	6	prohibition gameplay boardwalk underworld	investigation scene options twist dollar click clockwise win boats snakes opt injustice loyalty access integrated trail safety ties terminals joints	66	15.18	2647.62	44.8	0.2	98.6	5.6
4	40	7	tko continued southport dating	accountant dramatic drown scenery hm southport outdoors hurdle dry closure experience arrests employers employers dating amanda chat joey discovered processing brighter demonstrated nec tables prescribed	146	1.34	4688.90	100.0	1.8	100.0	9.2
4	40	8	detector words visitors pyramid	life shuffle stairs erased pyramid sand jump beans sensation pods burial	38	63.48	2400.10	2.2	0.2	86.6	9.8
4	40	9	adrenaline occupational contains lifeboat	acted disappear occupational forewings waves lifeboat escape unity stunts jumps	39	18.99	1876.63	46.4	0.2	98.0	9.8
4	40	10	ebook donation inspirational lavender	missouri gr conservation dynasty lavender cycle hides incense calming relief clockwise learned stokes bishops ionic person ether strengths straightforward	73	5.53	3386.14	88.2	0.2	99.8	3.0
4	40	11	libre oclc boardwalk	doping unanimous wagner dona pictures sporting seton ago pam exceptionally catches intercepted instinct stable rooms you ceremonial courts corridors reform chemist scenes ocean	104	2.84	3537.86	96.8	1.4	100.0	8.6
4	40	12	wheeling terminus boasted crore	blast round midland horse joints beaux tyre canal ticket mis wheeling radiating brick athletic rake karnataka gag bucks escaped wheel handling crore save orderly	132	2.02	3392.49	98.8	1.2	100.0	5.8
4	40	13	treason horses supported frontman	ra drums overhead metallic dashboard areas drumming vinyl horses rail embarked noise warped parting tunes bad dona for racism sufficiently righteous fidelity conscription	104	2.19	3324.84	99.4	0.6	99.8	10.0
4	40	14	libre sponsors conviction tablet	empire finest safety closure unbelievable tablet majesty raft adrenaline audiences terrific inches explosive wiring fog fide standards by cells	74	2.67	2865.15	97.8	2.0	100.0	12.6
4	40	15	windows downloaded claudius jumping	strongest jumps bounce floors	31	16.00	1848.34	60.0	0.6	97.8	10.8
4	40	16	utilized releasing vibration harlem	surrounding ripple negatively members onto graves graves metal uses beating mixtape abbreviated colorful tails mandatory aerospace filming allows trojan piracy th decorated bien enhanced	76	12.72	4330.98	79.2	0.6	97.0	6.2
4	40	17	jets albans darkest toured	rat dated dropped spines stayed skies churchill detainees win liar parting treason depleted spiked vocals consisted symphonies weiss ignored boycott	89	6.02	3243.09	89.4	0.2	99.6	6.0
4	40	18	seniors storyline oblivion raleigh	attorneys gin scenery sherlock loading augusta stress exhaustion confidence cecilia wyatt net horses reel acc dramatic ropes casket characters pounds mascara lines adults	112	3.41	3571.76	96.2	1.6	100.0	11.6
4	40	19	vera activation rhyme download	clockwise ribs chains loop vigor doping robes hood automation calm scramble listings	38	16.52	2484.62	49.6	0.2	98.4	5.4
4	40	20	email casinos tombstone rebounds	cyclone configuration spins recommend free touchdowns easy warped ejected shutter mod filters pillars gallery rounds freedom	56	6.60	2682.55	86.6	0.8	99.6	10.2
4	40	21	chests guadalupe purcell elk	municipal elk seated celtic cream doctors coughing optic chest laughter areas chest markings lighting kentucky migration dances dry hm eased bought chests because temples menacing their outward	128	3.10	4525.52	98.2	2.4	100.0	12.2
4	40	22	deposition oils tombstone empowerment	agreements contain boxed ease barrels cowboy confidence ice ea protect end ton savanna company upstate cherokee filming their in spotting shouldered eighty arsenic	91	2.68	3168.47	98.0	2.0	100.0	13.2
4	40	23	laundry rappers freestyle	organizational rappers gangs hood progression laundry	37	19.65	2230.20	43.6	0.4	97.4	5.0
4	40	24	trail telegram greenville libre	abbas rugged scent reel sand optic horses scenery soldiers horseshoe chat relax heck asa vulture inexperienced jumping strikeouts recognition bonfire rocket	94	7.57	3637.14	81.8	1.0	99.6	11.2
4	50	0	lawyer sites substitution kinase	sic illustration coarse epa addition uptown kinase promotion apprehension retention dunes mounting adrenaline jo atrium soothing shake premises iihf animal perch	74	3.90	4281.24	95.0	2.0	100.0	7.8
4	50	1	attorney ligand pyramid activation	republicans accommodation adding oxygen underlying absorbing networking tough savings relaxing wolves numbering detectors checkpoint nerve dramatic cleanup flashback catalyst cords opener	73	6.35	3781.21	87.4	0.8	99.8	7.6
4	50	2	rebound units chennai reel	crook jaw catches retention ordination bonding bea finer gallantry cylinders scoop visual exchequer release reel proficient consolidated et entertainment offensive epa choreographed instruments seizing were	92	3.03	3244.02	97.8	1.4	100.0	7.0
4	50	3	snake bassist rejoined liege	revolution murder rhythm discarded informed fascism banda darkest massacre acts glory disbanded banda scala sentenced bands societies	55	6.25	3495.03	90.4	0.0	99.8	2.6
4	50	4	exodus floors goal myrtle	particles sand ea rail ceilings journey throughout wand otter scribe visibility outdoors exodus learn activity closure camera ravens firing kinetic stylistic scala	101	7.13	3252.32	88.0	0.4	99.2	9.6
4	50	5	carthage greenville fatalities hercules	survivor veins unavailable disconnected horseshoe puddle hercules backstage highways visibility lining clearing pavement sand laughter shooters guaranteed robot purcell fired republican gun layne dissertation motto unanimously	162	6.09	4947.89	86.2	0.0	99.6	5.6
4	50	6	detector ebook ellington optimization	mob rink patio antennas smoothly elephant orchestra acc influx sargent algebraic smooth exodus elevations easier coup protecting extraction offering pet margin	71	9.83	4867.16	77.2	0.4	98.8	4.2
4	50	7	seniors nm chemicals	wheel natural rest ether als kilograms wave lower stocked	37	17.09	2619.43	64.6	0.6	97.4	8.6
4	50	8	arrest substitution graves inhibitors	scare screenplay progression dominates probation boardwalk multiple sob closure relaxed ballads jumps lines burial locker thorough listings sodium modelling symmetry	79	11.24	2245.94	73.4	0.4	98.6	8.8
4	50	9	rhyme	ranks carousel peaking double jumped depending repeating repetitive pyramid	30	240.88	1653.87	3.0	0.4	56.4	12.0
4	50	10	deposition oxygen adventures kannada	ira oxygen activities parapet mammoth eased ivory hearing across camera ventures bonded nsw horses soldiers packing lotus injected probe lengths door	74	7.62	2785.52	80.8	0.4	99.8	7.2
4	50	11	necklace rhyme lifeboat	ski added ton vertex discovery repeating withdrawal patio lifeboat inches relaxing connection dove hook	44	34.35	2667.84	24.8	0.2	93.8	6.0
4	50	12	yell downloaded substitution claudius	clicking possesses bark essentially touchdowns available neither dial	38	24.94	3316.52	36.6	0.4	96.0	5.6
4	50	13	equestrian waves receptors	slogan big mohan asset constructive sensation calm natural lucan horses silence bois theaters equestrian danielle interruption cornice indies is th	70	16.62	2974.18	67.4	0.0	97.2	4.6
4	50	14	ebook bark continue amulet	sheriff conductors ease enjoyment fcc revolver doubles introductions learn calming flights trails easier observation scent atrium above coven basalt acidic description amulet offer	87	1.88	3526.45	99.2	0.6	100.0	9.2
4	50	15	libre substitution kinase parapet	somewhat cypress frog speedway overnight cooler rack patterns translates quicker withdrawal consolidated stat soap microphone adrenaline reel roller migration handle specimens intimidation layout jammed	139	6.55	4378.80	86.6	0.0	99.8	3.8
4	50	16	operator touring imprint jimi	staged hendrix closure shovel basket parting basket suspicions vibe spectators radios signatures dir whatsoever	47	18.08	2979.67	64.0	0.0	98.4	3.0
4	50	17	ik riff progression	riff imitation material rehearsal orchestral sync dangers viruses	35	35.20	2375.27	40.8	0.2	92.4	7.4
4	50	18	transcribed cameroon drummer tombstone	abused maturity dedication feeling sync musicians congo burial incarcerated grain ears graves grave skeleton dismissed territory insanity lifestyle	66	16.74	2942.77	48.4	0.0	99.0	4.2
4	50	19	argus venom activation ounce	business magnificent lighting exaggerated bonding learn venom ceilings coke feel determination nas physiology bio confidence cubic depiction sac molten smelled paces	93	4.78	2848.33	95.6	0.4	99.4	11.2
4	50	20	deposition barrels talent	chill additions honesty bonding kemp deployed fenton champions ease experience sonar hurling sequencing whorls mysore	55	106.88	2209.19	12.2	0.2	75.2	7.0
